ticker,company_name,title,summary,text,search_term,sentiment_score,sentiment_label,published
DDOG,Datadog,"Datadog, Inc. (DDOG): Among Billionaire Chase Coleman’s Stocks with Huge Upside Potential - Yahoo","Datadog, Inc. (DDOG): Among Billionaire Chase Coleman’s Stocks with Huge Upside Potential  Yahoo","Datadog, Inc. (DDOG): Among Billionaire Chase Coleman’s Stocks with Huge Upside Potential - Yahoo. Datadog, Inc. (DDOG): Among Billionaire Chase Coleman’s Stocks with Huge Upside Potential  Yahoo",,0.9999969,neutral,2025-05-04 21:20:14
DDOG,Datadog,"Alight Capital Management LP Grows Stock Holdings in Datadog, Inc. (NASDAQ:DDOG) - MarketBeat","Alight Capital Management LP Grows Stock Holdings in Datadog, Inc. (NASDAQ:DDOG)  MarketBeat","Alight Capital Management LP Grows Stock Holdings in Datadog, Inc. (NASDAQ:DDOG) - MarketBeat. Alight Capital Management LP Grows Stock Holdings in Datadog, Inc. (NASDAQ:DDOG)  MarketBeat",,-0.9999968,negative,2025-05-04 12:34:15
DDOG,Datadog,"Voleon Capital Management LP Purchases Shares of 5,759 Datadog, Inc. (NASDAQ:DDOG) - MarketBeat","Voleon Capital Management LP Purchases Shares of 5,759 Datadog, Inc. (NASDAQ:DDOG)  MarketBeat","Voleon Capital Management LP Purchases Shares of 5,759 Datadog, Inc. (NASDAQ:DDOG) - MarketBeat. Voleon Capital Management LP Purchases Shares of 5,759 Datadog, Inc. (NASDAQ:DDOG)  MarketBeat",,-0.99999404,negative,2025-05-04 09:35:46
DDOG,Datadog,Datadog (NASDAQ:DDOG) Trading 0.6% Higher - Here's What Happened - MarketBeat,Datadog (NASDAQ:DDOG) Trading 0.6% Higher - Here's What Happened  MarketBeat,Datadog (NASDAQ:DDOG) Trading 0.6% Higher - Here's What Happened - MarketBeat. Datadog (NASDAQ:DDOG) Trading 0.6% Higher - Here's What Happened  MarketBeat,,0.99790645,neutral,2025-05-04 04:44:33
DDOG,Datadog,"Northern Trust Corp Grows Position in Datadog, Inc. (NASDAQ:DDOG) - MarketBeat","Northern Trust Corp Grows Position in Datadog, Inc. (NASDAQ:DDOG)  MarketBeat","Northern Trust Corp Grows Position in Datadog, Inc. (NASDAQ:DDOG) - MarketBeat. Northern Trust Corp Grows Position in Datadog, Inc. (NASDAQ:DDOG)  MarketBeat",,-0.9621209,negative,2025-05-03 14:08:19
DDOG,Datadog,"Consolidated Press International Holdings Ltd. Reduces Stock Position in Datadog, Inc. (NASDAQ:DDOG) - MarketBeat","Consolidated Press International Holdings Ltd. Reduces Stock Position in Datadog, Inc. (NASDAQ:DDOG)  MarketBeat","Consolidated Press International Holdings Ltd. Reduces Stock Position in Datadog, Inc. (NASDAQ:DDOG) - MarketBeat. Consolidated Press International Holdings Ltd. Reduces Stock Position in Datadog, Inc. (NASDAQ:DDOG)  MarketBeat",,-0.793586,negative,2025-05-03 13:29:32
DDOG,Datadog,"Positive week for Datadog, Inc. (NASDAQ:DDOG) institutional investors who lost 16% over the past year - Yahoo Finance","Positive week for Datadog, Inc. (NASDAQ:DDOG) institutional investors who lost 16% over the past year  Yahoo Finance","Positive week for Datadog, Inc. (NASDAQ:DDOG) institutional investors who lost 16% over the past year - Yahoo Finance. Positive week for Datadog, Inc. (NASDAQ:DDOG) institutional investors who lost 16% over the past year  Yahoo Finance",,0.9999999,neutral,2025-05-03 13:00:34
DDOG,Datadog,"AQR Capital Management LLC Raises Stock Position in Datadog, Inc. (NASDAQ:DDOG) - MarketBeat","AQR Capital Management LLC Raises Stock Position in Datadog, Inc. (NASDAQ:DDOG)  MarketBeat","AQR Capital Management LLC Raises Stock Position in Datadog, Inc. (NASDAQ:DDOG) - MarketBeat. AQR Capital Management LLC Raises Stock Position in Datadog, Inc. (NASDAQ:DDOG)  MarketBeat",,-0.9953982,negative,2025-05-03 10:32:25
DDOG,Datadog,"Schonfeld Strategic Advisors LLC Decreases Position in Datadog, Inc. (NASDAQ:DDOG) - MarketBeat","Schonfeld Strategic Advisors LLC Decreases Position in Datadog, Inc. (NASDAQ:DDOG)  MarketBeat","Schonfeld Strategic Advisors LLC Decreases Position in Datadog, Inc. (NASDAQ:DDOG) - MarketBeat. Schonfeld Strategic Advisors LLC Decreases Position in Datadog, Inc. (NASDAQ:DDOG)  MarketBeat",,-0.98359144,negative,2025-05-03 10:30:02
DDOG,Datadog,Datadog (NASDAQ:DDOG) Shares Down 1.2% - Should You Sell? - MarketBeat,Datadog (NASDAQ:DDOG) Shares Down 1.2% - Should You Sell?  MarketBeat,Datadog (NASDAQ:DDOG) Shares Down 1.2% - Should You Sell? - MarketBeat. Datadog (NASDAQ:DDOG) Shares Down 1.2% - Should You Sell?  MarketBeat,,0.9999188,positive,2025-05-03 07:00:00
DDOG,Datadog,Datadog (DDOG) Expected to Announce Earnings on Tuesday - MarketBeat,Datadog (DDOG) Expected to Announce Earnings on Tuesday  MarketBeat,Datadog (DDOG) Expected to Announce Earnings on Tuesday - MarketBeat. Datadog (DDOG) Expected to Announce Earnings on Tuesday  MarketBeat,,-0.99999833,negative,2025-05-03 07:00:00
DDOG,Datadog,Datadog (NASDAQ:DDOG) Trading Down 0.6% - Time to Sell? - MarketBeat,Datadog (NASDAQ:DDOG) Trading Down 0.6% - Time to Sell?  MarketBeat,Datadog (NASDAQ:DDOG) Trading Down 0.6% - Time to Sell? - MarketBeat. Datadog (NASDAQ:DDOG) Trading Down 0.6% - Time to Sell?  MarketBeat,,0.99973863,positive,2025-05-03 04:32:46
DDOG,Datadog,"Datadog, Inc. (NASDAQ:DDOG) Holdings Boosted by Public Employees Retirement Association of Colorado - MarketBeat","Datadog, Inc. (NASDAQ:DDOG) Holdings Boosted by Public Employees Retirement Association of Colorado  MarketBeat","Datadog, Inc. (NASDAQ:DDOG) Holdings Boosted by Public Employees Retirement Association of Colorado - MarketBeat. Datadog, Inc. (NASDAQ:DDOG) Holdings Boosted by Public Employees Retirement Association of Colorado  MarketBeat",,-0.9999434,negative,2025-05-03 00:09:22
DDOG,Datadog,Datadog (DDOG) Expands Portfolio with Eppo Acquisition for $220 Million - GuruFocus,Datadog (DDOG) Expands Portfolio with Eppo Acquisition for $220 Million  GuruFocus,Datadog (DDOG) Expands Portfolio with Eppo Acquisition for $220 Million - GuruFocus. Datadog (DDOG) Expands Portfolio with Eppo Acquisition for $220 Million  GuruFocus,,0.99786586,neutral,2025-05-01 16:21:22
DDOG,Datadog,Datadog buying startup Eppo for $220M - report (DDOG:NASDAQ) - Seeking Alpha,Datadog buying startup Eppo for $220M - report (DDOG:NASDAQ)  Seeking Alpha,Datadog buying startup Eppo for $220M - report (DDOG:NASDAQ) - Seeking Alpha. Datadog buying startup Eppo for $220M - report (DDOG:NASDAQ)  Seeking Alpha,,-0.99984944,negative,2025-05-01 15:38:00
DDOG,Datadog,"Buy, Sell Or Hold DDOG Stock? Key Tips Ahead Of Q1 Earnings - Barchart.com","Buy, Sell Or Hold DDOG Stock? Key Tips Ahead Of Q1 Earnings  Barchart.com","Buy, Sell Or Hold DDOG Stock? Key Tips Ahead Of Q1 Earnings - Barchart.com. Buy, Sell Or Hold DDOG Stock? Key Tips Ahead Of Q1 Earnings  Barchart.com",,0.9985833,neutral,2025-05-01 15:12:00
DDOG,Datadog,"Buy, Sell or Hold DDOG Stock? Key Tips Ahead of Q1 Earnings - Nasdaq","Buy, Sell or Hold DDOG Stock? Key Tips Ahead of Q1 Earnings  Nasdaq","Buy, Sell or Hold DDOG Stock? Key Tips Ahead of Q1 Earnings - Nasdaq. Buy, Sell or Hold DDOG Stock? Key Tips Ahead of Q1 Earnings  Nasdaq",,0.9916385,neutral,2025-05-01 14:06:00
DDOG,Datadog,Stock Alert: Datadog (DDOG) Could be on the Cusp of a Significant Recovery - MoneyMorning.com,Stock Alert: Datadog (DDOG) Could be on the Cusp of a Significant Recovery  MoneyMorning.com,Stock Alert: Datadog (DDOG) Could be on the Cusp of a Significant Recovery - MoneyMorning.com. Stock Alert: Datadog (DDOG) Could be on the Cusp of a Significant Recovery  MoneyMorning.com,,-0.8771667,negative,2025-05-01 13:52:01
DDOG,Datadog,Bullish Signal on Datadog (DDOG) Overlooked by Wall Street Analysts - TipRanks,Bullish Signal on Datadog (DDOG) Overlooked by Wall Street Analysts  TipRanks,Bullish Signal on Datadog (DDOG) Overlooked by Wall Street Analysts - TipRanks. Bullish Signal on Datadog (DDOG) Overlooked by Wall Street Analysts  TipRanks,,0.9999764,neutral,2025-05-01 11:58:03
DDOG,Datadog,"Susquehanna Fundamental Investments LLC Takes Position in Datadog, Inc. (NASDAQ:DDOG) - MarketBeat","Susquehanna Fundamental Investments LLC Takes Position in Datadog, Inc. (NASDAQ:DDOG)  MarketBeat","Susquehanna Fundamental Investments LLC Takes Position in Datadog, Inc. (NASDAQ:DDOG) - MarketBeat. Susquehanna Fundamental Investments LLC Takes Position in Datadog, Inc. (NASDAQ:DDOG)  MarketBeat",,-0.99994934,negative,2025-05-01 09:22:17
DDOG,Datadog,"Adage Capital Partners GP L.L.C. Reduces Stock Position in Datadog, Inc. (NASDAQ:DDOG) - MarketBeat","Adage Capital Partners GP L.L.C. Reduces Stock Position in Datadog, Inc. (NASDAQ:DDOG)  MarketBeat","Adage Capital Partners GP L.L.C. Reduces Stock Position in Datadog, Inc. (NASDAQ:DDOG) - MarketBeat. Adage Capital Partners GP L.L.C. Reduces Stock Position in Datadog, Inc. (NASDAQ:DDOG)  MarketBeat",,-0.99101275,negative,2025-05-01 07:00:00
DDOG,Datadog,3 Market-Beating Stocks That Stand Out - Yahoo Finance,3 Market-Beating Stocks That Stand Out  Yahoo Finance,3 Market-Beating Stocks That Stand Out - Yahoo Finance. 3 Market-Beating Stocks That Stand Out  Yahoo Finance,,-0.9996836,negative,2025-05-01 04:37:06
DDOG,Datadog,3 Market-Beating Stocks That Stand Out - The Globe and Mail,3 Market-Beating Stocks That Stand Out  The Globe and Mail,3 Market-Beating Stocks That Stand Out - The Globe and Mail. 3 Market-Beating Stocks That Stand Out  The Globe and Mail,,-0.9999846,negative,2025-05-01 04:37:00
DDOG,Datadog,Is Datadog Inc. (NASDAQ:DDOG) the Best Growth Stock to Buy for the Next 3 Years? - Insider Monkey,Is Datadog Inc. (NASDAQ:DDOG) the Best Growth Stock to Buy for the Next 3 Years?  Insider Monkey,Is Datadog Inc. (NASDAQ:DDOG) the Best Growth Stock to Buy for the Next 3 Years? - Insider Monkey. Is Datadog Inc. (NASDAQ:DDOG) the Best Growth Stock to Buy for the Next 3 Years?  Insider Monkey,,0.99999964,neutral,2025-05-01 00:10:03
