ticker,company_name,title,summary,text,search_term,sentiment_score,sentiment_label,published
GWLLY,Great Wall Motors,China bans use of 'smart driving' terms in auto ads (FXI:NYSEARCA) - Seeking Alpha,China bans use of 'smart driving' terms in auto ads (FXI:NYSEARCA)  Seeking Alpha,China bans use of 'smart driving' terms in auto ads (FXI:NYSEARCA) - Seeking Alpha. China bans use of 'smart driving' terms in auto ads (FXI:NYSEARCA)  Seeking Alpha,,-0.988139,negative,2025-04-17 07:00:00
GWLLY,Great Wall Motors,"China's Great Wall to expand Russia car production in 2025, Russian papers report - Reuters","China's Great Wall to expand Russia car production in 2025, Russian papers report  Reuters","China's Great Wall to expand Russia car production in 2025, Russian papers report - Reuters. China's Great Wall to expand Russia car production in 2025, Russian papers report  Reuters",,0.9210169,neutral,2024-10-25 07:00:00
GWLLY,Great Wall Motors,Alibaba Teams Up With Nvidia to Supercharge EVs for Chinese Automakers: Report - Benzinga,Alibaba Teams Up With Nvidia to Supercharge EVs for Chinese Automakers: Report  Benzinga,Alibaba Teams Up With Nvidia to Supercharge EVs for Chinese Automakers: Report - Benzinga. Alibaba Teams Up With Nvidia to Supercharge EVs for Chinese Automakers: Report  Benzinga,,-0.9999987,negative,2024-09-23 07:00:00
GWLLY,Great Wall Motors,Avoid All Chinese Car Brands Except These 8 - 24/7 Wall St.,Avoid All Chinese Car Brands Except These 8  24/7 Wall St.,Avoid All Chinese Car Brands Except These 8 - 24/7 Wall St.. Avoid All Chinese Car Brands Except These 8  24/7 Wall St.,,-0.99964535,negative,2024-08-15 07:00:00
GWLLY,Great Wall Motors,Sazgar-GWM launch ORA 3 EV in Pakistan - The Express Tribune,Sazgar-GWM launch ORA 3 EV in Pakistan  The Express Tribune,Sazgar-GWM launch ORA 3 EV in Pakistan - The Express Tribune. Sazgar-GWM launch ORA 3 EV in Pakistan  The Express Tribune,,-0.9999945,negative,2024-02-23 08:00:00
GWLLY,Great Wall Motors,Sazgar and Great Wall Motors Launch EV ORA 3 in Pakistan - Pkrevenue.com,Sazgar and Great Wall Motors Launch EV ORA 3 in Pakistan  Pkrevenue.com,Sazgar and Great Wall Motors Launch EV ORA 3 in Pakistan - Pkrevenue.com. Sazgar and Great Wall Motors Launch EV ORA 3 in Pakistan  Pkrevenue.com,,-0.9999926,negative,2024-02-22 08:00:00
GWLLY,Great Wall Motors,"Great Wall Motor, BYD Sink After Chinese Auto Giants Clash on Car Emissions Tests - Yicai Global","Great Wall Motor, BYD Sink After Chinese Auto Giants Clash on Car Emissions Tests  Yicai Global","Great Wall Motor, BYD Sink After Chinese Auto Giants Clash on Car Emissions Tests - Yicai Global. Great Wall Motor, BYD Sink After Chinese Auto Giants Clash on Car Emissions Tests  Yicai Global",,-0.9999404,negative,2023-05-25 07:00:00
GWLLY,Great Wall Motors,Great Wall Auto Reports BYD’s Potential Emission Violations - CarNewsChina.com,Great Wall Auto Reports BYD’s Potential Emission Violations  CarNewsChina.com,Great Wall Auto Reports BYD’s Potential Emission Violations - CarNewsChina.com. Great Wall Auto Reports BYD’s Potential Emission Violations  CarNewsChina.com,,-0.8842857,negative,2023-05-25 07:00:00
GWLLY,Great Wall Motors,"China’s Great Wall Motors to increase sales in Australia by 50 per cent, company claims - drive.com.au","China’s Great Wall Motors to increase sales in Australia by 50 per cent, company claims  drive.com.au","China’s Great Wall Motors to increase sales in Australia by 50 per cent, company claims - drive.com.au. China’s Great Wall Motors to increase sales in Australia by 50 per cent, company claims  drive.com.au",,0.99989486,neutral,2023-02-13 08:00:00
GWLLY,Great Wall Motors,How to save thousands on a new 4WD ute - News.com.au,How to save thousands on a new 4WD ute  News.com.au,How to save thousands on a new 4WD ute - News.com.au. How to save thousands on a new 4WD ute  News.com.au,,-0.9998832,negative,2022-08-26 07:00:00
GWLLY,Great Wall Motors,"China's Great Wall Motors abandons Rs 7,895 crore project in India: Here's why - Times of India","China's Great Wall Motors abandons Rs 7,895 crore project in India: Here's why  Times of India","China's Great Wall Motors abandons Rs 7,895 crore project in India: Here's why - Times of India. China's Great Wall Motors abandons Rs 7,895 crore project in India: Here's why  Times of India",,0.6652926,positive,2022-07-02 07:00:00
GWLLY,Great Wall Motors,Great Wall Motors drops $ 1 billion India entry plan - The Economic Times,Great Wall Motors drops $ 1 billion India entry plan  The Economic Times,Great Wall Motors drops $ 1 billion India entry plan - The Economic Times. Great Wall Motors drops $ 1 billion India entry plan  The Economic Times,,-0.9997744,negative,2022-07-01 07:00:00
GWLLY,Great Wall Motors,2022 Great Wall Motors Ute Cannon-X v Mitsubishi Triton GLS comparison - drive.com.au,2022 Great Wall Motors Ute Cannon-X v Mitsubishi Triton GLS comparison  drive.com.au,2022 Great Wall Motors Ute Cannon-X v Mitsubishi Triton GLS comparison - drive.com.au. 2022 Great Wall Motors Ute Cannon-X v Mitsubishi Triton GLS comparison  drive.com.au,,-0.99997616,negative,2022-06-07 00:20:00
GWLLY,Great Wall Motors,Russo-Ukrainian War’s Impact on Chinese Car Companies - CarNewsChina.com,Russo-Ukrainian War’s Impact on Chinese Car Companies  CarNewsChina.com,Russo-Ukrainian War’s Impact on Chinese Car Companies - CarNewsChina.com. Russo-Ukrainian War’s Impact on Chinese Car Companies  CarNewsChina.com,,-0.9997229,negative,2022-03-04 08:00:00
GWLLY,Great Wall Motors,"Chinese brands MG, Great Wall Motors-Haval, and LDV post sales records - drive.com.au","Chinese brands MG, Great Wall Motors-Haval, and LDV post sales records  drive.com.au","Chinese brands MG, Great Wall Motors-Haval, and LDV post sales records - drive.com.au. Chinese brands MG, Great Wall Motors-Haval, and LDV post sales records  drive.com.au",,-0.9999795,negative,2022-02-03 08:00:00
GWLLY,Great Wall Motors,China’s NRB Soars by Limit After Becoming Auto Parts Supplier to Great Wall Hybrid Project - Yicai Global,China’s NRB Soars by Limit After Becoming Auto Parts Supplier to Great Wall Hybrid Project  Yicai Global,China’s NRB Soars by Limit After Becoming Auto Parts Supplier to Great Wall Hybrid Project - Yicai Global. China’s NRB Soars by Limit After Becoming Auto Parts Supplier to Great Wall Hybrid Project  Yicai Global,,-0.99982965,negative,2021-12-07 08:00:00
GWLLY,Great Wall Motors,Safety warning for 6000 Great Wall Motors Utes sold in Australia - drive.com.au,Safety warning for 6000 Great Wall Motors Utes sold in Australia  drive.com.au,Safety warning for 6000 Great Wall Motors Utes sold in Australia - drive.com.au. Safety warning for 6000 Great Wall Motors Utes sold in Australia  drive.com.au,,-0.99949336,negative,2021-11-12 08:00:00
GWLLY,Great Wall Motors,"China’s Great Wall Motors, LDV T60 utes overtake Mitsubishi Triton - drive.com.au","China’s Great Wall Motors, LDV T60 utes overtake Mitsubishi Triton  drive.com.au","China’s Great Wall Motors, LDV T60 utes overtake Mitsubishi Triton - drive.com.au. China’s Great Wall Motors, LDV T60 utes overtake Mitsubishi Triton  drive.com.au",,-0.99984,negative,2021-10-07 07:00:00
GWLLY,Great Wall Motors,Great Wall Motors to launch compact BEV and PHEV SUV in Europe in 2022 - Electrek,Great Wall Motors to launch compact BEV and PHEV SUV in Europe in 2022  Electrek,Great Wall Motors to launch compact BEV and PHEV SUV in Europe in 2022 - Electrek. Great Wall Motors to launch compact BEV and PHEV SUV in Europe in 2022  Electrek,,-0.9922713,negative,2021-09-06 07:00:00
GWLLY,Great Wall Motors,Xiaomi to make EVs by partnering with China’s Great Wall Motor: Report - Gizmochina,Xiaomi to make EVs by partnering with China’s Great Wall Motor: Report  Gizmochina,Xiaomi to make EVs by partnering with China’s Great Wall Motor: Report - Gizmochina. Xiaomi to make EVs by partnering with China’s Great Wall Motor: Report  Gizmochina,,-0.9999763,negative,2021-03-26 07:00:00
GWLLY,Great Wall Motors,"Great Wall Hybrid Self-Ignited on Shanghai Road, Gutting the New Car, Owner Says - Yicai Global","Great Wall Hybrid Self-Ignited on Shanghai Road, Gutting the New Car, Owner Says  Yicai Global","Great Wall Hybrid Self-Ignited on Shanghai Road, Gutting the New Car, Owner Says - Yicai Global. Great Wall Hybrid Self-Ignited on Shanghai Road, Gutting the New Car, Owner Says  Yicai Global",,-0.9994972,negative,2021-01-12 08:00:00
GWLLY,Great Wall Motors,Maharashtra govt puts China’s Great Wall Motors’ investment on hold - The Financial Express,Maharashtra govt puts China’s Great Wall Motors’ investment on hold  The Financial Express,Maharashtra govt puts China’s Great Wall Motors’ investment on hold - The Financial Express. Maharashtra govt puts China’s Great Wall Motors’ investment on hold  The Financial Express,,-0.9995573,negative,2020-06-23 07:00:00
GWLLY,Great Wall Motors,Great Wall Motors to launch mass-market SUVs in 2-3 years - The Economic Times,Great Wall Motors to launch mass-market SUVs in 2-3 years  The Economic Times,Great Wall Motors to launch mass-market SUVs in 2-3 years - The Economic Times. Great Wall Motors to launch mass-market SUVs in 2-3 years  The Economic Times,,-0.9995141,negative,2020-02-26 08:00:00
GWLLY,Great Wall Motors,Great Wall Motors confirms India entry - overdrive.in,Great Wall Motors confirms India entry  overdrive.in,Great Wall Motors confirms India entry - overdrive.in. Great Wall Motors confirms India entry  overdrive.in,,0.59076816,neutral,2020-02-05 08:00:00
GWLLY,Great Wall Motors,Great Wall Motors signs agreement to buy General Motors' Talegaon plant - Business Standard,Great Wall Motors signs agreement to buy General Motors' Talegaon plant  Business Standard,Great Wall Motors signs agreement to buy General Motors' Talegaon plant - Business Standard. Great Wall Motors signs agreement to buy General Motors' Talegaon plant  Business Standard,,-0.9996191,negative,2020-01-17 08:00:00
GWLLY,Great Wall Motors,Great Wall Motors confirms India entry - Autocar India,Great Wall Motors confirms India entry  Autocar India,Great Wall Motors confirms India entry - Autocar India. Great Wall Motors confirms India entry  Autocar India,,-0.9813322,negative,2020-01-02 08:00:00
GWLLY,Great Wall Motors,Zimoco launches Haval SUV - heraldonline.co.zw,Zimoco launches Haval SUV  heraldonline.co.zw,Zimoco launches Haval SUV - heraldonline.co.zw. Zimoco launches Haval SUV  heraldonline.co.zw,,-0.9999825,negative,2019-10-29 07:00:00
GWLLY,Great Wall Motors,Great Wall Motor of China Sets Its Sights on Jeep (Published 2017) - The New York Times,Great Wall Motor of China Sets Its Sights on Jeep (Published 2017)  The New York Times,Great Wall Motor of China Sets Its Sights on Jeep (Published 2017) - The New York Times. Great Wall Motor of China Sets Its Sights on Jeep (Published 2017)  The New York Times,,-0.9999988,negative,2017-08-21 07:00:00
GWLLY,Great Wall Motors,Renesas Electronics and Great Wall Motors Announce Strategic Collaboration on Development of New Energy Vehicles and Self-Driving Cars - Renesas Electronics,Renesas Electronics and Great Wall Motors Announce Strategic Collaboration on Development of New Energy Vehicles and Self-Driving Cars  Renesas Electronics,Renesas Electronics and Great Wall Motors Announce Strategic Collaboration on Development of New Energy Vehicles and Self-Driving Cars - Renesas Electronics. Renesas Electronics and Great Wall Motors Announce Strategic Collaboration on Development of New Energy Vehicles and Self-Driving Cars  Renesas Electronics,,-0.93686754,negative,2017-05-25 07:00:00
GWLLY,Great Wall Motors,Super Group buys majority in GWM SA - Bizcommunity,Super Group buys majority in GWM SA  Bizcommunity,Super Group buys majority in GWM SA - Bizcommunity. Super Group buys majority in GWM SA  Bizcommunity,,-0.9999982,negative,2014-03-15 06:26:06
GWLLY,Great Wall Motors,3 Key Reasons Tesla Can’t Be Compared To Great Wall Motors - Jing Daily,3 Key Reasons Tesla Can’t Be Compared To Great Wall Motors  Jing Daily,3 Key Reasons Tesla Can’t Be Compared To Great Wall Motors - Jing Daily. 3 Key Reasons Tesla Can’t Be Compared To Great Wall Motors  Jing Daily,,-0.99997556,negative,2013-12-04 08:00:00
GWLLY,Great Wall Motors,Profit of Great Wall Motors up 61% over the first Nine Months - CarNewsChina.com,Profit of Great Wall Motors up 61% over the first Nine Months  CarNewsChina.com,Profit of Great Wall Motors up 61% over the first Nine Months - CarNewsChina.com. Profit of Great Wall Motors up 61% over the first Nine Months  CarNewsChina.com,,0.99999917,neutral,2013-11-06 08:00:00
GWLLY,Great Wall Motors,Great Wall Motors defies industry slowdown - china.org.cn,Great Wall Motors defies industry slowdown  china.org.cn,Great Wall Motors defies industry slowdown - china.org.cn. Great Wall Motors defies industry slowdown  china.org.cn,,0.9957891,positive,2012-10-15 07:00:00
GWLLY,Great Wall Motors,Great Wall Motors X240 - Carsales,Great Wall Motors X240  Carsales,Great Wall Motors X240 - Carsales. Great Wall Motors X240  Carsales,,-0.999936,negative,2010-03-18 07:00:00
GWLLY,Great Wall Motors,Great Wall Motors X240 4WD Review - drive.com.au,Great Wall Motors X240 4WD Review  drive.com.au,Great Wall Motors X240 4WD Review - drive.com.au. Great Wall Motors X240 4WD Review  drive.com.au,,-0.99993885,negative,2009-10-28 07:00:00
