ticker,company_name,title,summary,text,search_term,sentiment_score,sentiment_label,published
MBGYY,Mercedes-Benz,Why You Might Be Interested In Mercedes-Benz Group AG (ETR:MBG) For Its Upcoming Dividend - Yahoo Finance,Why You Might Be Interested In Mercedes-Benz Group AG (ETR:MBG) For Its Upcoming Dividend  Yahoo Finance,Why You Might Be Interested In Mercedes-Benz Group AG (ETR:MBG) For Its Upcoming Dividend - Yahoo Finance. Why You Might Be Interested In Mercedes-Benz Group AG (ETR:MBG) For Its Upcoming Dividend  Yahoo Finance,,-0.99998105,negative,2025-05-03 06:30:00
MBGYY,Mercedes-Benz,Mercedes-Benz Group (ETR:MBG) Will Pay A Smaller Dividend Than Last Year - Yahoo Finance,Mercedes-Benz Group (ETR:MBG) Will Pay A Smaller Dividend Than Last Year  Yahoo Finance,Mercedes-Benz Group (ETR:MBG) Will Pay A Smaller Dividend Than Last Year - Yahoo Finance. Mercedes-Benz Group (ETR:MBG) Will Pay A Smaller Dividend Than Last Year  Yahoo Finance,,-0.9846,negative,2025-05-01 12:52:05
MBGYY,Mercedes-Benz,Mercedes Benz Group AG (MBGAF) Stock Forecasts - Yahoo Finance,Mercedes Benz Group AG (MBGAF) Stock Forecasts  Yahoo Finance,Mercedes Benz Group AG (MBGAF) Stock Forecasts - Yahoo Finance. Mercedes Benz Group AG (MBGAF) Stock Forecasts  Yahoo Finance,,-0.99999917,negative,2025-05-01 09:45:08
MBGYY,Mercedes-Benz,Citi cuts Mercedes-Benz stock target to EUR52 from EUR54 - Investing.com,Citi cuts Mercedes-Benz stock target to EUR52 from EUR54  Investing.com,Citi cuts Mercedes-Benz stock target to EUR52 from EUR54 - Investing.com. Citi cuts Mercedes-Benz stock target to EUR52 from EUR54  Investing.com,,-0.9999888,negative,2025-05-01 07:06:48
MBGYY,Mercedes-Benz,We Think Some Shareholders May Hesitate To Increase Mercedes-Benz Group AG's (ETR:MBG) CEO Compensation - simplywall.st,We Think Some Shareholders May Hesitate To Increase Mercedes-Benz Group AG's (ETR:MBG) CEO Compensation  simplywall.st,We Think Some Shareholders May Hesitate To Increase Mercedes-Benz Group AG's (ETR:MBG) CEO Compensation - simplywall.st. We Think Some Shareholders May Hesitate To Increase Mercedes-Benz Group AG's (ETR:MBG) CEO Compensation  simplywall.st,,-0.9709651,negative,2025-05-01 05:33:20
MBGYY,Mercedes-Benz,Mercedes-Benz Group AG's Dividend Analysis - Yahoo Finance,Mercedes-Benz Group AG's Dividend Analysis  Yahoo Finance,Mercedes-Benz Group AG's Dividend Analysis - Yahoo Finance. Mercedes-Benz Group AG's Dividend Analysis  Yahoo Finance,,-0.99999905,negative,2024-05-08 07:00:00
MBGYY,Mercedes-Benz,Mercedes-Benz Group AG Annual General Meeting: Orderly transition in times of transformation - Yahoo Finance,Mercedes-Benz Group AG Annual General Meeting: Orderly transition in times of transformation  Yahoo Finance,Mercedes-Benz Group AG Annual General Meeting: Orderly transition in times of transformation - Yahoo Finance. Mercedes-Benz Group AG Annual General Meeting: Orderly transition in times of transformation  Yahoo Finance,,-0.9999887,negative,2024-05-08 07:00:00
