ticker,company_name,title,summary,text,search_term,sentiment_score,sentiment_label,published
NET,Cloudflare,"Investors Appear Satisfied With Cloudflare, Inc.'s (NYSE:NET) Prospects As Shares Rocket 28% - simplywall.st","Investors Appear Satisfied With Cloudflare, Inc.'s (NYSE:NET) Prospects As Shares Rocket 28%  simplywall.st","Investors Appear Satisfied With Cloudflare, Inc.'s (NYSE:NET) Prospects As Shares Rocket 28% - simplywall.st. Investors Appear Satisfied With Cloudflare, Inc.'s (NYSE:NET) Prospects As Shares Rocket 28%  simplywall.st",,0.9999968,neutral,2025-05-04 14:19:43
NET,Cloudflare,Berkshire Was Net Seller of $1.5B of Stocks in Q1. Investors May Be Disappointed. - Barron's,Berkshire Was Net Seller of $1.5B of Stocks in Q1. Investors May Be Disappointed.  Barron's,Berkshire Was Net Seller of $1.5B of Stocks in Q1. Investors May Be Disappointed. - Barron's. Berkshire Was Net Seller of $1.5B of Stocks in Q1. Investors May Be Disappointed.  Barron's,,0.9999901,positive,2025-05-04 10:39:28
NET,Cloudflare,"Stock Market Today: FPIs Turn Net Buyers; India-US Trade Talks, Global Data To Drive Market Sentiment - Newsx","Stock Market Today: FPIs Turn Net Buyers; India-US Trade Talks, Global Data To Drive Market Sentiment  Newsx","Stock Market Today: FPIs Turn Net Buyers; India-US Trade Talks, Global Data To Drive Market Sentiment - Newsx. Stock Market Today: FPIs Turn Net Buyers; India-US Trade Talks, Global Data To Drive Market Sentiment  Newsx",,-0.99991536,negative,2025-05-04 09:17:00
NET,Cloudflare,"Warren Buffett: First stock, first tax filing, best, worst investments to net worth - 5 things you want to know - ET Now","Warren Buffett: First stock, first tax filing, best, worst investments to net worth - 5 things you want to know  ET Now","Warren Buffett: First stock, first tax filing, best, worst investments to net worth - 5 things you want to know - ET Now. Warren Buffett: First stock, first tax filing, best, worst investments to net worth - 5 things you want to know  ET Now",,-0.99997056,negative,2025-05-04 06:03:41
NET,Cloudflare,Warren Buffett's Berkshire Hathaway sold stocks again last quarter — and grew its cash pile to a new high - Yahoo Finance,Warren Buffett's Berkshire Hathaway sold stocks again last quarter — and grew its cash pile to a new high  Yahoo Finance,Warren Buffett's Berkshire Hathaway sold stocks again last quarter — and grew its cash pile to a new high - Yahoo Finance. Warren Buffett's Berkshire Hathaway sold stocks again last quarter — and grew its cash pile to a new high  Yahoo Finance,,0.9960484,neutral,2025-05-03 20:30:21
NET,Cloudflare,"Warren Buffett to retire: Here's Berkshire CEO's net worth, stock portfolio, properties and more - MSN","Warren Buffett to retire: Here's Berkshire CEO's net worth, stock portfolio, properties and more  MSN","Warren Buffett to retire: Here's Berkshire CEO's net worth, stock portfolio, properties and more - MSN. Warren Buffett to retire: Here's Berkshire CEO's net worth, stock portfolio, properties and more  MSN",,-0.9999689,negative,2025-05-03 19:46:53
NET,Cloudflare,"Warren Buffett to retire: Here's Berkshire CEO's net worth, stock portfolio, properties and more - MSN","Warren Buffett to retire: Here's Berkshire CEO's net worth, stock portfolio, properties and more  MSN","Warren Buffett to retire: Here's Berkshire CEO's net worth, stock portfolio, properties and more - MSN. Warren Buffett to retire: Here's Berkshire CEO's net worth, stock portfolio, properties and more  MSN",,-0.9999689,negative,2025-05-03 19:32:13
NET,Cloudflare,"Warren Buffett to retire: Here's Berkshire CEO's net worth, stock portfolio, properties and more - Hindustan Times","Warren Buffett to retire: Here's Berkshire CEO's net worth, stock portfolio, properties and more  Hindustan Times","Warren Buffett to retire: Here's Berkshire CEO's net worth, stock portfolio, properties and more - Hindustan Times. Warren Buffett to retire: Here's Berkshire CEO's net worth, stock portfolio, properties and more  Hindustan Times",,-0.99997485,negative,2025-05-03 19:09:58
NET,Cloudflare,(NET) On The My Stocks Page - news.stocktradersdaily.com,(NET) On The My Stocks Page  news.stocktradersdaily.com,(NET) On The My Stocks Page - news.stocktradersdaily.com. (NET) On The My Stocks Page  news.stocktradersdaily.com,,-0.99999404,negative,2025-05-03 09:50:00
NET,Cloudflare,"Cinemark Slips To Net Loss In Q1, Stock Fell In Pre-market - Nasdaq","Cinemark Slips To Net Loss In Q1, Stock Fell In Pre-market  Nasdaq","Cinemark Slips To Net Loss In Q1, Stock Fell In Pre-market - Nasdaq. Cinemark Slips To Net Loss In Q1, Stock Fell In Pre-market  Nasdaq",,0.9988403,positive,2025-05-02 12:15:00
NET,Cloudflare,Apple reports second quarter results - Business Wire,Apple reports second quarter results  Business Wire,Apple reports second quarter results - Business Wire. Apple reports second quarter results  Business Wire,,-0.9999987,negative,2025-05-01 20:30:00
NET,Cloudflare,Foreign investors turn net buyers of India stocks amid trade turmoil - Nikkei Asia,Foreign investors turn net buyers of India stocks amid trade turmoil  Nikkei Asia,Foreign investors turn net buyers of India stocks amid trade turmoil - Nikkei Asia. Foreign investors turn net buyers of India stocks amid trade turmoil  Nikkei Asia,,-0.99815935,negative,2025-05-01 17:31:00
NET,Cloudflare,Cloudflare Revolutionizes AI Integration: 10 Tech Giants Including PayPal and Stripe Join Forces with Claude - Stock Titan,Cloudflare Revolutionizes AI Integration: 10 Tech Giants Including PayPal and Stripe Join Forces with Claude  Stock Titan,Cloudflare Revolutionizes AI Integration: 10 Tech Giants Including PayPal and Stripe Join Forces with Claude - Stock Titan. Cloudflare Revolutionizes AI Integration: 10 Tech Giants Including PayPal and Stripe Join Forces with Claude  Stock Titan,,-0.9683632,negative,2025-05-01 16:00:00
