ticker,company_name,title,summary,text,search_term,sentiment_score,sentiment_label,published
RIVN,Rivian,"Calpers Dumps Super Micro and Nvidia Stock, Doubles Down on Rivian Amid Market Shifts - TECHi","Calpers Dumps Super Micro and Nvidia Stock, Doubles Down on Rivian Amid Market Shifts  TECHi","Calpers Dumps Super Micro and Nvidia Stock, Doubles Down on Rivian Amid Market Shifts - TECHi. Calpers Dumps Super Micro and Nvidia Stock, Doubles Down on Rivian Amid Market Shifts  TECHi",,-0.9911807,negative,2025-05-04 18:36:11
RIVN,Rivian,"Earnings week ahead: AMD, PLTR, F, DIS, SHOP, DKNG, AMC, LCID, GOLD, RIVN, and more - Seeking Alpha","Earnings week ahead: AMD, PLTR, F, DIS, SHOP, DKNG, AMC, LCID, GOLD, RIVN, and more  Seeking Alpha","Earnings week ahead: AMD, PLTR, F, DIS, SHOP, DKNG, AMC, LCID, GOLD, RIVN, and more - Seeking Alpha. Earnings week ahead: AMD, PLTR, F, DIS, SHOP, DKNG, AMC, LCID, GOLD, RIVN, and more  Seeking Alpha",,-0.99998426,negative,2025-05-04 12:00:00
RIVN,Rivian,"Dimensional Fund Advisors LP Sells 146,038 Shares of Rivian Automotive, Inc. (NASDAQ:RIVN) - MarketBeat","Dimensional Fund Advisors LP Sells 146,038 Shares of Rivian Automotive, Inc. (NASDAQ:RIVN)  MarketBeat","Dimensional Fund Advisors LP Sells 146,038 Shares of Rivian Automotive, Inc. (NASDAQ:RIVN) - MarketBeat. Dimensional Fund Advisors LP Sells 146,038 Shares of Rivian Automotive, Inc. (NASDAQ:RIVN)  MarketBeat",,-0.9999982,negative,2025-05-04 08:25:36
RIVN,Rivian,"Boothbay Fund Management LLC Sells 3,898,270 Shares of Rivian Automotive, Inc. (NASDAQ:RIVN) - MarketBeat","Boothbay Fund Management LLC Sells 3,898,270 Shares of Rivian Automotive, Inc. (NASDAQ:RIVN)  MarketBeat","Boothbay Fund Management LLC Sells 3,898,270 Shares of Rivian Automotive, Inc. (NASDAQ:RIVN) - MarketBeat. Boothbay Fund Management LLC Sells 3,898,270 Shares of Rivian Automotive, Inc. (NASDAQ:RIVN)  MarketBeat",,-0.9999976,negative,2025-05-04 08:25:36
RIVN,Rivian,Rivian Automotive (RIVN) Projected to Post Earnings on Tuesday - MarketBeat,Rivian Automotive (RIVN) Projected to Post Earnings on Tuesday  MarketBeat,Rivian Automotive (RIVN) Projected to Post Earnings on Tuesday - MarketBeat. Rivian Automotive (RIVN) Projected to Post Earnings on Tuesday  MarketBeat,,-0.99999976,negative,2025-05-04 07:35:33
RIVN,Rivian,"Giant U.S. Pension sold Nvidia, Tesla, and Apple Stock. It Bought Rivian. - Barron's","Giant U.S. Pension sold Nvidia, Tesla, and Apple Stock. It Bought Rivian.  Barron's","Giant U.S. Pension sold Nvidia, Tesla, and Apple Stock. It Bought Rivian. - Barron's. Giant U.S. Pension sold Nvidia, Tesla, and Apple Stock. It Bought Rivian.  Barron's",,-0.99998903,negative,2025-05-04 07:00:00
RIVN,Rivian,How To Trade (RIVN) - news.stocktradersdaily.com,How To Trade (RIVN)  news.stocktradersdaily.com,How To Trade (RIVN) - news.stocktradersdaily.com. How To Trade (RIVN)  news.stocktradersdaily.com,,-0.9999925,negative,2025-05-04 04:04:00
RIVN,Rivian,Rivian Has Found A Way To Quickly Move Its Inventory This Month - MSN,Rivian Has Found A Way To Quickly Move Its Inventory This Month  MSN,Rivian Has Found A Way To Quickly Move Its Inventory This Month - MSN. Rivian Has Found A Way To Quickly Move Its Inventory This Month  MSN,,0.82221174,neutral,2025-05-04 03:31:00
RIVN,Rivian,Rivian Automotive (NASDAQ:RIVN) Stock Price Up 3.4% - Here's What Happened - MarketBeat,Rivian Automotive (NASDAQ:RIVN) Stock Price Up 3.4% - Here's What Happened  MarketBeat,Rivian Automotive (NASDAQ:RIVN) Stock Price Up 3.4% - Here's What Happened - MarketBeat. Rivian Automotive (NASDAQ:RIVN) Stock Price Up 3.4% - Here's What Happened  MarketBeat,,0.96751887,neutral,2025-05-03 21:20:15
RIVN,Rivian,"1248 Management LLC Takes Position in Rivian Automotive, Inc. (NASDAQ:RIVN) - MarketBeat","1248 Management LLC Takes Position in Rivian Automotive, Inc. (NASDAQ:RIVN)  MarketBeat","1248 Management LLC Takes Position in Rivian Automotive, Inc. (NASDAQ:RIVN) - MarketBeat. 1248 Management LLC Takes Position in Rivian Automotive, Inc. (NASDAQ:RIVN)  MarketBeat",,-0.9999678,negative,2025-05-03 12:33:51
RIVN,Rivian,Rivian Automotive (NASDAQ:RIVN) Stock Price Up 0.5% - Still a Buy? - MarketBeat,Rivian Automotive (NASDAQ:RIVN) Stock Price Up 0.5% - Still a Buy?  MarketBeat,Rivian Automotive (NASDAQ:RIVN) Stock Price Up 0.5% - Still a Buy? - MarketBeat. Rivian Automotive (NASDAQ:RIVN) Stock Price Up 0.5% - Still a Buy?  MarketBeat,,0.9999988,neutral,2025-05-03 09:29:06
RIVN,Rivian,Where Will Rivian Be in 1 Year? - The Motley Fool,Where Will Rivian Be in 1 Year?  The Motley Fool,Where Will Rivian Be in 1 Year? - The Motley Fool. Where Will Rivian Be in 1 Year?  The Motley Fool,,-0.99999905,negative,2025-05-03 08:20:00
RIVN,Rivian,Rivian Automotive (RIVN) Expected to Announce Quarterly Earnings on Tuesday - MarketBeat,Rivian Automotive (RIVN) Expected to Announce Quarterly Earnings on Tuesday  MarketBeat,Rivian Automotive (RIVN) Expected to Announce Quarterly Earnings on Tuesday - MarketBeat. Rivian Automotive (RIVN) Expected to Announce Quarterly Earnings on Tuesday  MarketBeat,,-0.9999994,negative,2025-05-02 21:57:19
RIVN,Rivian,Rivian Automotive (RIVN) Rises Higher Than Market: Key Facts - Yahoo,Rivian Automotive (RIVN) Rises Higher Than Market: Key Facts  Yahoo,Rivian Automotive (RIVN) Rises Higher Than Market: Key Facts - Yahoo. Rivian Automotive (RIVN) Rises Higher Than Market: Key Facts  Yahoo,,0.9997205,neutral,2025-05-01 21:45:17
RIVN,Rivian,"Susquehanna Fundamental Investments LLC Purchases New Shares in Rivian Automotive, Inc. (NASDAQ:RIVN) - MarketBeat","Susquehanna Fundamental Investments LLC Purchases New Shares in Rivian Automotive, Inc. (NASDAQ:RIVN)  MarketBeat","Susquehanna Fundamental Investments LLC Purchases New Shares in Rivian Automotive, Inc. (NASDAQ:RIVN) - MarketBeat. Susquehanna Fundamental Investments LLC Purchases New Shares in Rivian Automotive, Inc. (NASDAQ:RIVN)  MarketBeat",,-0.99999285,negative,2025-05-01 20:20:50
RIVN,Rivian,Why Rivan Stock Jumped This Week - MSN,Why Rivan Stock Jumped This Week  MSN,Why Rivan Stock Jumped This Week - MSN. Why Rivan Stock Jumped This Week  MSN,,0.7857394,neutral,2025-05-01 20:11:43
RIVN,Rivian,Why Rivan Stock Jumped This Week - The Motley Fool,Why Rivan Stock Jumped This Week  The Motley Fool,Why Rivan Stock Jumped This Week - The Motley Fool. Why Rivan Stock Jumped This Week  The Motley Fool,,-0.6207445,negative,2025-05-01 20:02:48
RIVN,Rivian,Rivian Automotive (NASDAQ:RIVN) Shares Down 1.5% - Should You Sell? - MarketBeat,Rivian Automotive (NASDAQ:RIVN) Shares Down 1.5% - Should You Sell?  MarketBeat,Rivian Automotive (NASDAQ:RIVN) Shares Down 1.5% - Should You Sell? - MarketBeat. Rivian Automotive (NASDAQ:RIVN) Shares Down 1.5% - Should You Sell?  MarketBeat,,0.9999442,positive,2025-05-01 18:47:51
RIVN,Rivian,"Rivian Automotive, Inc. (RIVN) Is a Trending Stock: Facts to Know Before Betting on It - Yahoo","Rivian Automotive, Inc. (RIVN) Is a Trending Stock: Facts to Know Before Betting on It  Yahoo","Rivian Automotive, Inc. (RIVN) Is a Trending Stock: Facts to Know Before Betting on It - Yahoo. Rivian Automotive, Inc. (RIVN) Is a Trending Stock: Facts to Know Before Betting on It  Yahoo",,-0.99995553,negative,2025-05-01 13:00:11
RIVN,Rivian,"Rivian Automotive, Inc. (NASDAQ:RIVN) Shares Sold by Stifel Financial Corp - MarketBeat","Rivian Automotive, Inc. (NASDAQ:RIVN) Shares Sold by Stifel Financial Corp  MarketBeat","Rivian Automotive, Inc. (NASDAQ:RIVN) Shares Sold by Stifel Financial Corp - MarketBeat. Rivian Automotive, Inc. (NASDAQ:RIVN) Shares Sold by Stifel Financial Corp  MarketBeat",,-0.9999974,negative,2025-05-01 08:23:19
