ticker,company_name,title,summary,text,search_term,sentiment_score,sentiment_label,published
SAIC,SAIC Motor,(SAIC) Technical Data - news.stocktradersdaily.com,(SAIC) Technical Data  news.stocktradersdaily.com,(SAIC) Technical Data - news.stocktradersdaily.com. (SAIC) Technical Data  news.stocktradersdaily.com,,-0.9999982,negative,2025-05-04 07:06:00
SAIC,SAIC Motor,SAIC Secures $55 Million Contract for Space Architecture Integration | SAIC Stock News - GuruFocus,SAIC Secures $55 Million Contract for Space Architecture Integration | SAIC Stock News  GuruFocus,SAIC Secures $55 Million Contract for Space Architecture Integration | SAIC Stock News - GuruFocus. SAIC Secures $55 Million Contract for Space Architecture Integration | SAIC Stock News  GuruFocus,,-0.99653375,negative,2025-05-01 13:35:28
SAIC,SAIC Motor,SAIC Awarded New $55 Million Mission Integration Contract From Space Development Agency - Stock Titan,SAIC Awarded New $55 Million Mission Integration Contract From Space Development Agency  Stock Titan,SAIC Awarded New $55 Million Mission Integration Contract From Space Development Agency - Stock Titan. SAIC Awarded New $55 Million Mission Integration Contract From Space Development Agency  Stock Titan,,0.7318131,neutral,2025-05-01 12:30:00
SAIC,SAIC Motor,SAIC Secures $136.43 Million Contract for MK 48 Torpedo Componen - GuruFocus,SAIC Secures $136.43 Million Contract for MK 48 Torpedo Componen  GuruFocus,SAIC Secures $136.43 Million Contract for MK 48 Torpedo Componen - GuruFocus. SAIC Secures $136.43 Million Contract for MK 48 Torpedo Componen  GuruFocus,,-0.99985135,negative,2025-04-30 23:50:38
SAIC,SAIC Motor,SAIC and Bluescape Announce Strategic Partnership to Deliver Sec - GuruFocus,SAIC and Bluescape Announce Strategic Partnership to Deliver Sec  GuruFocus,SAIC and Bluescape Announce Strategic Partnership to Deliver Sec - GuruFocus. SAIC and Bluescape Announce Strategic Partnership to Deliver Sec  GuruFocus,,0.930274,neutral,2025-04-30 17:10:04
SAIC,SAIC Motor,SAIC Partners with Bluescape to Enhance Defense Virtual Workspace | SAIC Stock News - GuruFocus,SAIC Partners with Bluescape to Enhance Defense Virtual Workspace | SAIC Stock News  GuruFocus,SAIC Partners with Bluescape to Enhance Defense Virtual Workspace | SAIC Stock News - GuruFocus. SAIC Partners with Bluescape to Enhance Defense Virtual Workspace | SAIC Stock News  GuruFocus,,0.9971347,neutral,2025-04-30 17:09:01
SAIC,SAIC Motor,SAIC Establishes Strategic Partnership with Bluescape to Enhance Virtual Collaboration for Department of Defense and Government Agencies - Nasdaq,SAIC Establishes Strategic Partnership with Bluescape to Enhance Virtual Collaboration for Department of Defense and Government Agencies  Nasdaq,SAIC Establishes Strategic Partnership with Bluescape to Enhance Virtual Collaboration for Department of Defense and Government Agencies - Nasdaq. SAIC Establishes Strategic Partnership with Bluescape to Enhance Virtual Collaboration for Department of Defense and Government Agencies  Nasdaq,,0.9867257,neutral,2025-04-30 12:44:00
SAIC,SAIC Motor,SAIC Revolutionizes Defense Operations with Secure Bluescape Partnership for Critical Military Missions - Stock Titan,SAIC Revolutionizes Defense Operations with Secure Bluescape Partnership for Critical Military Missions  Stock Titan,SAIC Revolutionizes Defense Operations with Secure Bluescape Partnership for Critical Military Missions - Stock Titan. SAIC Revolutionizes Defense Operations with Secure Bluescape Partnership for Critical Military Missions  Stock Titan,,-0.9134787,negative,2025-04-30 12:30:00
SAIC,SAIC Motor,Should Value Investors Buy Science Applications International (SAIC) Stock? - Nasdaq,Should Value Investors Buy Science Applications International (SAIC) Stock?  Nasdaq,Should Value Investors Buy Science Applications International (SAIC) Stock? - Nasdaq. Should Value Investors Buy Science Applications International (SAIC) Stock?  Nasdaq,,0.61408615,neutral,2025-04-29 13:40:00
SAIC,SAIC Motor,Science Applications International Corp. (SAIC): Among Mid- And Large-Cap Stocks Insiders Are Buying After Trump’s Tariff Rollout - Yahoo Finance,Science Applications International Corp. (SAIC): Among Mid- And Large-Cap Stocks Insiders Are Buying After Trump’s Tariff Rollout  Yahoo Finance,Science Applications International Corp. (SAIC): Among Mid- And Large-Cap Stocks Insiders Are Buying After Trump’s Tariff Rollout - Yahoo Finance. Science Applications International Corp. (SAIC): Among Mid- And Large-Cap Stocks Insiders Are Buying After Trump’s Tariff Rollout  Yahoo Finance,,-0.9999943,negative,2025-04-16 07:00:00
SAIC,SAIC Motor,Why Is SAIC (SAIC) Up 3.3% Since Last Earnings Report? - Nasdaq,Why Is SAIC (SAIC) Up 3.3% Since Last Earnings Report?  Nasdaq,Why Is SAIC (SAIC) Up 3.3% Since Last Earnings Report? - Nasdaq. Why Is SAIC (SAIC) Up 3.3% Since Last Earnings Report?  Nasdaq,,0.99974495,neutral,2025-04-16 07:00:00
SAIC,SAIC Motor,JPMorgan Adjusts Price Target for SAIC (SAIC) Ahead of Q1 Report - GuruFocus,JPMorgan Adjusts Price Target for SAIC (SAIC) Ahead of Q1 Report  GuruFocus,JPMorgan Adjusts Price Target for SAIC (SAIC) Ahead of Q1 Report - GuruFocus. JPMorgan Adjusts Price Target for SAIC (SAIC) Ahead of Q1 Report  GuruFocus,,0.61841524,neutral,2025-04-15 07:00:00
SAIC,SAIC Motor,Cantor maintains neutral on SAIC stock with $120 price target - Investing.com,Cantor maintains neutral on SAIC stock with $120 price target  Investing.com,Cantor maintains neutral on SAIC stock with $120 price target - Investing.com. Cantor maintains neutral on SAIC stock with $120 price target  Investing.com,,0.9135413,positive,2025-04-11 07:00:00
SAIC,SAIC Motor,Are Investors Undervaluing Science Applications International (SAIC) Right Now? - Yahoo Finance,Are Investors Undervaluing Science Applications International (SAIC) Right Now?  Yahoo Finance,Are Investors Undervaluing Science Applications International (SAIC) Right Now? - Yahoo Finance. Are Investors Undervaluing Science Applications International (SAIC) Right Now?  Yahoo Finance,,-0.9999782,negative,2025-04-10 07:00:00
SAIC,SAIC Motor,Defense Giant SAIC Taps GE Aerospace Executive to Lead HR Transformation - Stock Titan,Defense Giant SAIC Taps GE Aerospace Executive to Lead HR Transformation  Stock Titan,Defense Giant SAIC Taps GE Aerospace Executive to Lead HR Transformation - Stock Titan. Defense Giant SAIC Taps GE Aerospace Executive to Lead HR Transformation  Stock Titan,,-0.99529284,negative,2025-04-09 07:00:00
SAIC,SAIC Motor,3 IT Services Stocks to Buy Right Now From a Prospering Industry - Yahoo Finance,3 IT Services Stocks to Buy Right Now From a Prospering Industry  Yahoo Finance,3 IT Services Stocks to Buy Right Now From a Prospering Industry - Yahoo Finance. 3 IT Services Stocks to Buy Right Now From a Prospering Industry  Yahoo Finance,,0.8827676,neutral,2025-04-09 07:00:00
SAIC,SAIC Motor,Insider Purchase: EVP of $SAIC Buys 100 Shares - Nasdaq,Insider Purchase: EVP of $SAIC Buys 100 Shares  Nasdaq,Insider Purchase: EVP of $SAIC Buys 100 Shares - Nasdaq. Insider Purchase: EVP of $SAIC Buys 100 Shares  Nasdaq,,-0.99999774,negative,2025-04-07 07:00:00
SAIC,SAIC Motor,Trading (SAIC) With Integrated Risk Controls - news.stocktradersdaily.com,Trading (SAIC) With Integrated Risk Controls  news.stocktradersdaily.com,Trading (SAIC) With Integrated Risk Controls - news.stocktradersdaily.com. Trading (SAIC) With Integrated Risk Controls  news.stocktradersdaily.com,,-0.9998466,negative,2025-04-02 16:52:00
SAIC,SAIC Motor,Science Applications International Corp (SAIC) Shares Up 3.21% o - GuruFocus,Science Applications International Corp (SAIC) Shares Up 3.21% o  GuruFocus,Science Applications International Corp (SAIC) Shares Up 3.21% o - GuruFocus. Science Applications International Corp (SAIC) Shares Up 3.21% o  GuruFocus,,0.99928963,neutral,2025-04-02 07:00:00
SAIC,SAIC Motor,Science Applications International (NASDAQ:SAIC) Is Due To Pay A Dividend Of $0.37 - simplywall.st,Science Applications International (NASDAQ:SAIC) Is Due To Pay A Dividend Of $0.37  simplywall.st,Science Applications International (NASDAQ:SAIC) Is Due To Pay A Dividend Of $0.37 - simplywall.st. Science Applications International (NASDAQ:SAIC) Is Due To Pay A Dividend Of $0.37  simplywall.st,,-0.99997187,negative,2025-03-31 07:00:00
SAIC,SAIC Motor,Insider Purchase: Director at $SAIC Buys 450 Shares - Nasdaq,Insider Purchase: Director at $SAIC Buys 450 Shares  Nasdaq,Insider Purchase: Director at $SAIC Buys 450 Shares - Nasdaq. Insider Purchase: Director at $SAIC Buys 450 Shares  Nasdaq,,-0.99999607,negative,2025-03-31 07:00:00
SAIC,SAIC Motor,Musk's $1T federal spending cuts could be turning point for defense: UBS - Seeking Alpha,Musk's $1T federal spending cuts could be turning point for defense: UBS  Seeking Alpha,Musk's $1T federal spending cuts could be turning point for defense: UBS - Seeking Alpha. Musk's $1T federal spending cuts could be turning point for defense: UBS  Seeking Alpha,,-0.9266046,negative,2025-03-31 07:00:00
SAIC,SAIC Motor,SAIC Director Katharina G. McFarland Acquires 230 Shares - TradingView,SAIC Director Katharina G. McFarland Acquires 230 Shares  TradingView,SAIC Director Katharina G. McFarland Acquires 230 Shares - TradingView. SAIC Director Katharina G. McFarland Acquires 230 Shares  TradingView,,-0.9999883,negative,2025-03-28 07:00:00
SAIC,SAIC Motor,When (SAIC) Moves Investors should Listen - news.stocktradersdaily.com,When (SAIC) Moves Investors should Listen  news.stocktradersdaily.com,When (SAIC) Moves Investors should Listen - news.stocktradersdaily.com. When (SAIC) Moves Investors should Listen  news.stocktradersdaily.com,,-0.99997485,negative,2025-03-23 06:34:00
SAIC,SAIC Motor,Science Applications International Full Year 2025 Earnings: EPS Beats Expectations - simplywall.st,Science Applications International Full Year 2025 Earnings: EPS Beats Expectations  simplywall.st,Science Applications International Full Year 2025 Earnings: EPS Beats Expectations - simplywall.st. Science Applications International Full Year 2025 Earnings: EPS Beats Expectations  simplywall.st,,0.9999999,neutral,2025-03-18 07:00:00
SAIC,SAIC Motor,"Science Applications International: Valuation Looks Cheap, Growth Looks Uncertain - Seeking Alpha","Science Applications International: Valuation Looks Cheap, Growth Looks Uncertain  Seeking Alpha","Science Applications International: Valuation Looks Cheap, Growth Looks Uncertain - Seeking Alpha. Science Applications International: Valuation Looks Cheap, Growth Looks Uncertain  Seeking Alpha",,0.8237425,positive,2025-03-18 07:00:00
SAIC,SAIC Motor,"Science Applications Q4 Earnings Beat Estimates, Revenues Rise Y/Y - Yahoo Finance","Science Applications Q4 Earnings Beat Estimates, Revenues Rise Y/Y  Yahoo Finance","Science Applications Q4 Earnings Beat Estimates, Revenues Rise Y/Y - Yahoo Finance. Science Applications Q4 Earnings Beat Estimates, Revenues Rise Y/Y  Yahoo Finance",,1.0,neutral,2025-03-18 07:00:00
SAIC,SAIC Motor,SAIC Pre-Market Stock Up Nearly 7% On Increased Earnings Outlook Above View - Nasdaq,SAIC Pre-Market Stock Up Nearly 7% On Increased Earnings Outlook Above View  Nasdaq,SAIC Pre-Market Stock Up Nearly 7% On Increased Earnings Outlook Above View - Nasdaq. SAIC Pre-Market Stock Up Nearly 7% On Increased Earnings Outlook Above View  Nasdaq,,1.0,neutral,2025-03-17 11:47:00
SAIC,SAIC Motor,"Science Applications Q4 Earnings Crush Estimates Helped By New Contract Volume, Stock Gains - Yahoo Finance","Science Applications Q4 Earnings Crush Estimates Helped By New Contract Volume, Stock Gains  Yahoo Finance","Science Applications Q4 Earnings Crush Estimates Helped By New Contract Volume, Stock Gains - Yahoo Finance. Science Applications Q4 Earnings Crush Estimates Helped By New Contract Volume, Stock Gains  Yahoo Finance",,1.0,neutral,2025-03-17 07:00:00
SAIC,SAIC Motor,SAIC Stock Price and Chart — NASDAQ:SAIC - TradingView,SAIC Stock Price and Chart — NASDAQ:SAIC  TradingView,SAIC Stock Price and Chart — NASDAQ:SAIC - TradingView. SAIC Stock Price and Chart — NASDAQ:SAIC  TradingView,,-0.9999995,negative,2025-03-17 07:00:00
SAIC,SAIC Motor,SCIENCE APPLICATIONS INTERNATIONAL Earnings Results: $SAIC Reports Quarterly Earnings - Nasdaq,SCIENCE APPLICATIONS INTERNATIONAL Earnings Results: $SAIC Reports Quarterly Earnings  Nasdaq,SCIENCE APPLICATIONS INTERNATIONAL Earnings Results: $SAIC Reports Quarterly Earnings - Nasdaq. SCIENCE APPLICATIONS INTERNATIONAL Earnings Results: $SAIC Reports Quarterly Earnings  Nasdaq,,-0.99999523,negative,2025-03-17 07:00:00
SAIC,SAIC Motor,SAIC Announces Fourth Quarter and Full Fiscal Year 2025 Results - GlobeNewswire,SAIC Announces Fourth Quarter and Full Fiscal Year 2025 Results  GlobeNewswire,SAIC Announces Fourth Quarter and Full Fiscal Year 2025 Results - GlobeNewswire. SAIC Announces Fourth Quarter and Full Fiscal Year 2025 Results  GlobeNewswire,,-0.99998903,negative,2025-03-17 07:00:00
SAIC,SAIC Motor,SAIC Earnings Call: Strong Growth Amid Challenges - TipRanks,SAIC Earnings Call: Strong Growth Amid Challenges  TipRanks,SAIC Earnings Call: Strong Growth Amid Challenges - TipRanks. SAIC Earnings Call: Strong Growth Amid Challenges  TipRanks,,1.0,neutral,2025-03-17 07:00:00
SAIC,SAIC Motor,"SAIC Stock Jumps as Govt. Contractor Tops Earnings, Outlook Estimates - Investopedia","SAIC Stock Jumps as Govt. Contractor Tops Earnings, Outlook Estimates  Investopedia","SAIC Stock Jumps as Govt. Contractor Tops Earnings, Outlook Estimates - Investopedia. SAIC Stock Jumps as Govt. Contractor Tops Earnings, Outlook Estimates  Investopedia",,0.99998283,neutral,2025-03-17 07:00:00
SAIC,SAIC Motor,Why SAIC Stock Is Up Today - The Motley Fool,Why SAIC Stock Is Up Today  The Motley Fool,Why SAIC Stock Is Up Today - The Motley Fool. Why SAIC Stock Is Up Today  The Motley Fool,,0.9752025,neutral,2025-03-17 07:00:00
SAIC,SAIC Motor,"SAIC (NASDAQ:SAIC) Exceeds Q4 Expectations, Stock Soars - Yahoo Finance","SAIC (NASDAQ:SAIC) Exceeds Q4 Expectations, Stock Soars  Yahoo Finance","SAIC (NASDAQ:SAIC) Exceeds Q4 Expectations, Stock Soars - Yahoo Finance. SAIC (NASDAQ:SAIC) Exceeds Q4 Expectations, Stock Soars  Yahoo Finance",,0.9999995,neutral,2025-03-17 07:00:00
SAIC,SAIC Motor,SAIC (SAIC) Beats Q4 Earnings and Revenue Estimates - Yahoo Finance,SAIC (SAIC) Beats Q4 Earnings and Revenue Estimates  Yahoo Finance,SAIC (SAIC) Beats Q4 Earnings and Revenue Estimates - Yahoo Finance. SAIC (SAIC) Beats Q4 Earnings and Revenue Estimates  Yahoo Finance,,0.9999995,neutral,2025-03-17 07:00:00
SAIC,SAIC Motor,SAIC (SAIC) Q4 Earnings Report Preview: What To Look For - Yahoo Finance,SAIC (SAIC) Q4 Earnings Report Preview: What To Look For  Yahoo Finance,SAIC (SAIC) Q4 Earnings Report Preview: What To Look For - Yahoo Finance. SAIC (SAIC) Q4 Earnings Report Preview: What To Look For  Yahoo Finance,,-0.9988808,negative,2025-03-16 07:00:00
SAIC,SAIC Motor,How To Earn $500 A Month From Science Applications International Stock Ahead Of Q4 Earnings - Benzinga,How To Earn $500 A Month From Science Applications International Stock Ahead Of Q4 Earnings  Benzinga,How To Earn $500 A Month From Science Applications International Stock Ahead Of Q4 Earnings - Benzinga. How To Earn $500 A Month From Science Applications International Stock Ahead Of Q4 Earnings  Benzinga,,0.99999654,neutral,2025-03-14 07:00:00
SAIC,SAIC Motor,Science Applications International Corp. Declares Quarterly Cash Dividend of $0.37 Per Share - Nasdaq,Science Applications International Corp. Declares Quarterly Cash Dividend of $0.37 Per Share  Nasdaq,Science Applications International Corp. Declares Quarterly Cash Dividend of $0.37 Per Share - Nasdaq. Science Applications International Corp. Declares Quarterly Cash Dividend of $0.37 Per Share  Nasdaq,,-0.99996555,negative,2025-03-14 07:00:00
SAIC,SAIC Motor,SAIC Maintains Strong Dividend Program: $0.37 Per Share Coming This April - Stock Titan,SAIC Maintains Strong Dividend Program: $0.37 Per Share Coming This April  Stock Titan,SAIC Maintains Strong Dividend Program: $0.37 Per Share Coming This April - Stock Titan. SAIC Maintains Strong Dividend Program: $0.37 Per Share Coming This April  Stock Titan,,1.0,neutral,2025-03-14 07:00:00
SAIC,SAIC Motor,How Will Science Applications International Stock React To Upcoming Earnings? - Trefis,How Will Science Applications International Stock React To Upcoming Earnings?  Trefis,How Will Science Applications International Stock React To Upcoming Earnings? - Trefis. How Will Science Applications International Stock React To Upcoming Earnings?  Trefis,,-0.9999448,negative,2025-03-14 07:00:00
SAIC,SAIC Motor,Defense Tech Breakthrough: SAIC Slashes DoD Software Delivery Time From Months to Days - Stock Titan,Defense Tech Breakthrough: SAIC Slashes DoD Software Delivery Time From Months to Days  Stock Titan,Defense Tech Breakthrough: SAIC Slashes DoD Software Delivery Time From Months to Days - Stock Titan. Defense Tech Breakthrough: SAIC Slashes DoD Software Delivery Time From Months to Days  Stock Titan,,0.9952043,neutral,2025-03-12 07:00:00
SAIC,SAIC Motor,Why LMT and SAIC Stocks Are Climbing Today - GuruFocus,Why LMT and SAIC Stocks Are Climbing Today  GuruFocus,Why LMT and SAIC Stocks Are Climbing Today - GuruFocus. Why LMT and SAIC Stocks Are Climbing Today  GuruFocus,,0.7555248,neutral,2025-03-10 07:00:00
SAIC,SAIC Motor,"Why Lockheed Martin and SAIC Stocks Popped, but GE Aerospace Dropped - The Motley Fool","Why Lockheed Martin and SAIC Stocks Popped, but GE Aerospace Dropped  The Motley Fool","Why Lockheed Martin and SAIC Stocks Popped, but GE Aerospace Dropped - The Motley Fool. Why Lockheed Martin and SAIC Stocks Popped, but GE Aerospace Dropped  The Motley Fool",,0.8284742,positive,2025-03-10 07:00:00
SAIC,SAIC Motor,Positive week for Science Applications International Corporation (NASDAQ:SAIC) institutional investors who lost 20% over the past year - Yahoo Finance,Positive week for Science Applications International Corporation (NASDAQ:SAIC) institutional investors who lost 20% over the past year  Yahoo Finance,Positive week for Science Applications International Corporation (NASDAQ:SAIC) institutional investors who lost 20% over the past year - Yahoo Finance. Positive week for Science Applications International Corporation (NASDAQ:SAIC) institutional investors who lost 20% over the past year  Yahoo Finance,,0.99999964,neutral,2025-03-10 07:00:00
SAIC,SAIC Motor,"Why Lockheed Martin and SAIC Stocks Popped, but GE Aerospace Dropped - Yahoo Finance","Why Lockheed Martin and SAIC Stocks Popped, but GE Aerospace Dropped  Yahoo Finance","Why Lockheed Martin and SAIC Stocks Popped, but GE Aerospace Dropped - Yahoo Finance. Why Lockheed Martin and SAIC Stocks Popped, but GE Aerospace Dropped  Yahoo Finance",,0.54640895,positive,2025-03-10 07:00:00
SAIC,SAIC Motor,"Jefferies cuts SAIC stock target to $110, maintains Hold rating - Investing.com","Jefferies cuts SAIC stock target to $110, maintains Hold rating  Investing.com","Jefferies cuts SAIC stock target to $110, maintains Hold rating - Investing.com. Jefferies cuts SAIC stock target to $110, maintains Hold rating  Investing.com",,0.98850316,positive,2025-03-07 08:00:00
SAIC,SAIC Motor,Science Applications International Corp. Announces Fourth Quarter Fiscal Year 2025 Earnings Release and Conference Call Schedule - Nasdaq,Science Applications International Corp. Announces Fourth Quarter Fiscal Year 2025 Earnings Release and Conference Call Schedule  Nasdaq,Science Applications International Corp. Announces Fourth Quarter Fiscal Year 2025 Earnings Release and Conference Call Schedule - Nasdaq. Science Applications International Corp. Announces Fourth Quarter Fiscal Year 2025 Earnings Release and Conference Call Schedule  Nasdaq,,-0.9999927,negative,2025-03-06 08:00:00
SAIC,SAIC Motor,Investors in Science Applications International (NASDAQ:SAIC) have seen respectable returns of 55% over the past five years - simplywall.st,Investors in Science Applications International (NASDAQ:SAIC) have seen respectable returns of 55% over the past five years  simplywall.st,Investors in Science Applications International (NASDAQ:SAIC) have seen respectable returns of 55% over the past five years - simplywall.st. Investors in Science Applications International (NASDAQ:SAIC) have seen respectable returns of 55% over the past five years  simplywall.st,,0.9999999,neutral,2025-03-06 08:00:00
SAIC,SAIC Motor,When Will SAIC Report Q4 Earnings? Mark Your Calendar for These Critical Numbers - Stock Titan,When Will SAIC Report Q4 Earnings? Mark Your Calendar for These Critical Numbers  Stock Titan,When Will SAIC Report Q4 Earnings? Mark Your Calendar for These Critical Numbers - Stock Titan. When Will SAIC Report Q4 Earnings? Mark Your Calendar for These Critical Numbers  Stock Titan,,-0.99999917,negative,2025-03-06 08:00:00
SAIC,SAIC Motor,Government Contract Update: $27M payment to SCIENCE APPLICATIONS INTERNATIONAL CORPORATION - Nasdaq,Government Contract Update: $27M payment to SCIENCE APPLICATIONS INTERNATIONAL CORPORATION  Nasdaq,Government Contract Update: $27M payment to SCIENCE APPLICATIONS INTERNATIONAL CORPORATION - Nasdaq. Government Contract Update: $27M payment to SCIENCE APPLICATIONS INTERNATIONAL CORPORATION  Nasdaq,,-0.99734914,negative,2025-02-24 08:00:00
SAIC,SAIC Motor,Black History Month spotlight: SAIC CEO Toni Townes-Whitley - Yahoo Finance,Black History Month spotlight: SAIC CEO Toni Townes-Whitley  Yahoo Finance,Black History Month spotlight: SAIC CEO Toni Townes-Whitley - Yahoo Finance. Black History Month spotlight: SAIC CEO Toni Townes-Whitley  Yahoo Finance,,-0.9999995,negative,2025-02-24 08:00:00
SAIC,SAIC Motor,Time To Look At Science Applications International In A Positive Light Again (NASDAQ:SAIC) - Seeking Alpha,Time To Look At Science Applications International In A Positive Light Again (NASDAQ:SAIC)  Seeking Alpha,Time To Look At Science Applications International In A Positive Light Again (NASDAQ:SAIC) - Seeking Alpha. Time To Look At Science Applications International In A Positive Light Again (NASDAQ:SAIC)  Seeking Alpha,,0.99999464,neutral,2025-02-20 08:00:00
SAIC,SAIC Motor,(SAIC) On The My Stocks Page - news.stocktradersdaily.com,(SAIC) On The My Stocks Page  news.stocktradersdaily.com,(SAIC) On The My Stocks Page - news.stocktradersdaily.com. (SAIC) On The My Stocks Page  news.stocktradersdaily.com,,-0.99998903,negative,2025-02-19 08:00:00
SAIC,SAIC Motor,Science Applications International (SAIC): Among the Best Information Technology Services Stocks to Buy Right Now - Yahoo Finance,Science Applications International (SAIC): Among the Best Information Technology Services Stocks to Buy Right Now  Yahoo Finance,Science Applications International (SAIC): Among the Best Information Technology Services Stocks to Buy Right Now - Yahoo Finance. Science Applications International (SAIC): Among the Best Information Technology Services Stocks to Buy Right Now  Yahoo Finance,,0.9999944,neutral,2025-02-19 08:00:00
SAIC,SAIC Motor,10 Best Information Technology Services Stocks to Buy Right Now - Insider Monkey,10 Best Information Technology Services Stocks to Buy Right Now  Insider Monkey,10 Best Information Technology Services Stocks to Buy Right Now - Insider Monkey. 10 Best Information Technology Services Stocks to Buy Right Now  Insider Monkey,,0.9816414,neutral,2025-02-18 08:00:00
SAIC,SAIC Motor,"Booz Allen, SAIC shares fall on CACI bookings drop - MSN","Booz Allen, SAIC shares fall on CACI bookings drop  MSN","Booz Allen, SAIC shares fall on CACI bookings drop - MSN. Booz Allen, SAIC shares fall on CACI bookings drop  MSN",,0.98211044,positive,2025-02-17 00:53:06
SAIC,SAIC Motor,Sentiment Still Eluding Science Applications International Corporation (NASDAQ:SAIC) - simplywall.st,Sentiment Still Eluding Science Applications International Corporation (NASDAQ:SAIC)  simplywall.st,Sentiment Still Eluding Science Applications International Corporation (NASDAQ:SAIC) - simplywall.st. Sentiment Still Eluding Science Applications International Corporation (NASDAQ:SAIC)  simplywall.st,,0.99980503,positive,2025-01-31 08:00:00
SAIC,SAIC Motor,Science Applications International (SAIC): Revolutionizing IT with ReadyOne - Yahoo Finance,Science Applications International (SAIC): Revolutionizing IT with ReadyOne  Yahoo Finance,Science Applications International (SAIC): Revolutionizing IT with ReadyOne - Yahoo Finance. Science Applications International (SAIC): Revolutionizing IT with ReadyOne  Yahoo Finance,,-0.83979464,negative,2025-01-30 08:00:00
SAIC,SAIC Motor,NOC: 3 Defense Technology Stocks Quietly Securing Strong Gains - StockNews,NOC: 3 Defense Technology Stocks Quietly Securing Strong Gains  StockNews,NOC: 3 Defense Technology Stocks Quietly Securing Strong Gains - StockNews. NOC: 3 Defense Technology Stocks Quietly Securing Strong Gains  StockNews,,0.9996927,neutral,2025-01-23 08:00:00
SAIC,SAIC Motor,SAIC Secures Major Contracts and Reports Solid Earnings - Security Clearance Jobs,SAIC Secures Major Contracts and Reports Solid Earnings  Security Clearance Jobs,SAIC Secures Major Contracts and Reports Solid Earnings - Security Clearance Jobs. SAIC Secures Major Contracts and Reports Solid Earnings  Security Clearance Jobs,,1.0,neutral,2024-12-28 08:00:00
SAIC,SAIC Motor,How Did Science Applications International Corporation's (NASDAQ:SAIC) 19% ROE Fare Against The Industry? - simplywall.st,How Did Science Applications International Corporation's (NASDAQ:SAIC) 19% ROE Fare Against The Industry?  simplywall.st,How Did Science Applications International Corporation's (NASDAQ:SAIC) 19% ROE Fare Against The Industry? - simplywall.st. How Did Science Applications International Corporation's (NASDAQ:SAIC) 19% ROE Fare Against The Industry?  simplywall.st,,-0.9998801,negative,2024-12-25 08:00:00
