ticker,company_name,title,summary,text,search_term,sentiment_score,sentiment_label,published
SCHW,Charles Schwab,"1248 Management LLC Acquires Shares of 93,729 The Charles Schwab Co. (NYSE:SCHW) - MarketBeat","1248 Management LLC Acquires Shares of 93,729 The Charles Schwab Co. (NYSE:SCHW)  MarketBeat","1248 Management LLC Acquires Shares of 93,729 The Charles Schwab Co. (NYSE:SCHW) - MarketBeat. 1248 Management LLC Acquires Shares of 93,729 The Charles Schwab Co. (NYSE:SCHW)  MarketBeat",,-0.999985,negative,2025-05-04 12:40:13
SCHW,Charles Schwab,"Mercer Global Advisors Inc. ADV Acquires 86,101 Shares of The Charles Schwab Co. (NYSE:SCHW) - MarketBeat","Mercer Global Advisors Inc. ADV Acquires 86,101 Shares of The Charles Schwab Co. (NYSE:SCHW)  MarketBeat","Mercer Global Advisors Inc. ADV Acquires 86,101 Shares of The Charles Schwab Co. (NYSE:SCHW) - MarketBeat. Mercer Global Advisors Inc. ADV Acquires 86,101 Shares of The Charles Schwab Co. (NYSE:SCHW)  MarketBeat",,-0.9998913,negative,2025-05-04 10:42:05
SCHW,Charles Schwab,Freestone Grove Partners LP Makes New $25.11 Million Investment in The Charles Schwab Co. (NYSE:SCHW) - MarketBeat,Freestone Grove Partners LP Makes New $25.11 Million Investment in The Charles Schwab Co. (NYSE:SCHW)  MarketBeat,Freestone Grove Partners LP Makes New $25.11 Million Investment in The Charles Schwab Co. (NYSE:SCHW) - MarketBeat. Freestone Grove Partners LP Makes New $25.11 Million Investment in The Charles Schwab Co. (NYSE:SCHW)  MarketBeat,,-0.9999982,negative,2025-05-04 09:39:44
SCHW,Charles Schwab,The Charles Schwab Co. (NYSE:SCHW) Shares Sold by Boothbay Fund Management LLC - MarketBeat,The Charles Schwab Co. (NYSE:SCHW) Shares Sold by Boothbay Fund Management LLC  MarketBeat,The Charles Schwab Co. (NYSE:SCHW) Shares Sold by Boothbay Fund Management LLC - MarketBeat. The Charles Schwab Co. (NYSE:SCHW) Shares Sold by Boothbay Fund Management LLC  MarketBeat,,-0.99999356,negative,2025-05-04 08:41:43
SCHW,Charles Schwab,California State Teachers Retirement System Grows Stock Holdings in The Charles Schwab Co. (NYSE:SCHW) - MarketBeat,California State Teachers Retirement System Grows Stock Holdings in The Charles Schwab Co. (NYSE:SCHW)  MarketBeat,California State Teachers Retirement System Grows Stock Holdings in The Charles Schwab Co. (NYSE:SCHW) - MarketBeat. California State Teachers Retirement System Grows Stock Holdings in The Charles Schwab Co. (NYSE:SCHW)  MarketBeat,,-0.99998903,negative,2025-05-03 20:07:11
SCHW,Charles Schwab,Davidson Kahn Capital Management LLC Buys New Shares in The Charles Schwab Co. (NYSE:SCHW) - MarketBeat,Davidson Kahn Capital Management LLC Buys New Shares in The Charles Schwab Co. (NYSE:SCHW)  MarketBeat,Davidson Kahn Capital Management LLC Buys New Shares in The Charles Schwab Co. (NYSE:SCHW) - MarketBeat. Davidson Kahn Capital Management LLC Buys New Shares in The Charles Schwab Co. (NYSE:SCHW)  MarketBeat,,-0.99981743,negative,2025-05-03 12:25:54
SCHW,Charles Schwab,Institutional investors control 75% of The Charles Schwab Corporation (NYSE:SCHW) and were rewarded last week after stock increased 4.0% - Yahoo Finance,Institutional investors control 75% of The Charles Schwab Corporation (NYSE:SCHW) and were rewarded last week after stock increased 4.0%  Yahoo Finance,Institutional investors control 75% of The Charles Schwab Corporation (NYSE:SCHW) and were rewarded last week after stock increased 4.0% - Yahoo Finance. Institutional investors control 75% of The Charles Schwab Corporation (NYSE:SCHW) and were rewarded last week after stock increased 4.0%  Yahoo Finance,,0.9046359,neutral,2025-05-03 11:00:32
SCHW,Charles Schwab,The Charles Schwab Co. (NYSE:SCHW) Holdings Lowered by Comerica Bank - MarketBeat,The Charles Schwab Co. (NYSE:SCHW) Holdings Lowered by Comerica Bank  MarketBeat,The Charles Schwab Co. (NYSE:SCHW) Holdings Lowered by Comerica Bank - MarketBeat. The Charles Schwab Co. (NYSE:SCHW) Holdings Lowered by Comerica Bank  MarketBeat,,0.8699738,positive,2025-05-03 10:29:22
SCHW,Charles Schwab,"Charles Schwab executive sells $783,853 in stock By Investing.com - Investing.com South Africa","Charles Schwab executive sells $783,853 in stock By Investing.com  Investing.com South Africa","Charles Schwab executive sells $783,853 in stock By Investing.com - Investing.com South Africa. Charles Schwab executive sells $783,853 in stock By Investing.com  Investing.com South Africa",,-0.9999976,negative,2025-05-03 05:41:38
SCHW,Charles Schwab,The Largest Brokerage Firms in 2025 - The Motley Fool,The Largest Brokerage Firms in 2025  The Motley Fool,The Largest Brokerage Firms in 2025 - The Motley Fool. The Largest Brokerage Firms in 2025  The Motley Fool,,-0.99999857,negative,2025-05-02 17:10:55
SCHW,Charles Schwab,Charles Schwab eyes crypto trading launch - Yahoo Finance,Charles Schwab eyes crypto trading launch  Yahoo Finance,Charles Schwab eyes crypto trading launch - Yahoo Finance. Charles Schwab eyes crypto trading launch  Yahoo Finance,,-0.9999838,negative,2025-05-02 14:26:07
SCHW,Charles Schwab,Charles Schwab CEO: What young investors should do in a down market - Yahoo Finance,Charles Schwab CEO: What young investors should do in a down market  Yahoo Finance,Charles Schwab CEO: What young investors should do in a down market - Yahoo Finance. Charles Schwab CEO: What young investors should do in a down market  Yahoo Finance,,-0.99988234,negative,2025-05-02 12:00:15
SCHW,Charles Schwab,Becker Capital Management Inc. Has $57.59 Million Stock Holdings in The Charles Schwab Co. (NYSE:SCHW) - MarketBeat,Becker Capital Management Inc. Has $57.59 Million Stock Holdings in The Charles Schwab Co. (NYSE:SCHW)  MarketBeat,Becker Capital Management Inc. Has $57.59 Million Stock Holdings in The Charles Schwab Co. (NYSE:SCHW) - MarketBeat. Becker Capital Management Inc. Has $57.59 Million Stock Holdings in The Charles Schwab Co. (NYSE:SCHW)  MarketBeat,,-0.99999666,negative,2025-05-02 11:37:59
SCHW,Charles Schwab,Schonfeld Strategic Advisors LLC Boosts Stock Holdings in The Charles Schwab Co. (NYSE:SCHW) - MarketBeat,Schonfeld Strategic Advisors LLC Boosts Stock Holdings in The Charles Schwab Co. (NYSE:SCHW)  MarketBeat,Schonfeld Strategic Advisors LLC Boosts Stock Holdings in The Charles Schwab Co. (NYSE:SCHW) - MarketBeat. Schonfeld Strategic Advisors LLC Boosts Stock Holdings in The Charles Schwab Co. (NYSE:SCHW)  MarketBeat,,0.9999999,neutral,2025-05-02 10:39:43
SCHW,Charles Schwab,"Aquatic Capital Management LLC Buys 307,258 Shares of The Charles Schwab Co. (NYSE:SCHW) - MarketBeat","Aquatic Capital Management LLC Buys 307,258 Shares of The Charles Schwab Co. (NYSE:SCHW)  MarketBeat","Aquatic Capital Management LLC Buys 307,258 Shares of The Charles Schwab Co. (NYSE:SCHW) - MarketBeat. Aquatic Capital Management LLC Buys 307,258 Shares of The Charles Schwab Co. (NYSE:SCHW)  MarketBeat",,-0.9999728,negative,2025-05-02 07:46:15
SCHW,Charles Schwab,Charles Schwab CEO says investors are cutting risk after April turmoil - Reuters,Charles Schwab CEO says investors are cutting risk after April turmoil  Reuters,Charles Schwab CEO says investors are cutting risk after April turmoil - Reuters. Charles Schwab CEO says investors are cutting risk after April turmoil  Reuters,,-0.8041025,negative,2025-05-01 23:19:03
SCHW,Charles Schwab,Charles Schwab CEO says investors are cutting risk after April turmoil - MSN,Charles Schwab CEO says investors are cutting risk after April turmoil  MSN,Charles Schwab CEO says investors are cutting risk after April turmoil - MSN. Charles Schwab CEO says investors are cutting risk after April turmoil  MSN,,-0.463786,negative,2025-05-01 22:32:12
SCHW,Charles Schwab,Charles Schwab CEO sees 'pullback in risk taking' in April - marketscreener.com,Charles Schwab CEO sees 'pullback in risk taking' in April  marketscreener.com,Charles Schwab CEO sees 'pullback in risk taking' in April - marketscreener.com. Charles Schwab CEO sees 'pullback in risk taking' in April  marketscreener.com,,-0.99792373,negative,2025-05-01 21:47:21
SCHW,Charles Schwab,Preferred Stocks To Sell (Part 2): Charles Schwab's SCHW.PR.D (NYSE:SCHW) - Seeking Alpha,Preferred Stocks To Sell (Part 2): Charles Schwab's SCHW.PR.D (NYSE:SCHW)  Seeking Alpha,Preferred Stocks To Sell (Part 2): Charles Schwab's SCHW.PR.D (NYSE:SCHW) - Seeking Alpha. Preferred Stocks To Sell (Part 2): Charles Schwab's SCHW.PR.D (NYSE:SCHW)  Seeking Alpha,,-0.99995255,negative,2025-05-01 18:11:00
SCHW,Charles Schwab,NYSE Content Advisory: Pre-Market update + Charles Schwab unveils National Investing Day - marketscreener.com,NYSE Content Advisory: Pre-Market update + Charles Schwab unveils National Investing Day  marketscreener.com,NYSE Content Advisory: Pre-Market update + Charles Schwab unveils National Investing Day - marketscreener.com. NYSE Content Advisory: Pre-Market update + Charles Schwab unveils National Investing Day  marketscreener.com,,-0.9999602,negative,2025-05-01 12:56:05
SCHW,Charles Schwab,The Manufacturers Life Insurance Company Has $118.04 Million Stock Holdings in The Charles Schwab Co. (NYSE:SCHW) - MarketBeat,The Manufacturers Life Insurance Company Has $118.04 Million Stock Holdings in The Charles Schwab Co. (NYSE:SCHW)  MarketBeat,The Manufacturers Life Insurance Company Has $118.04 Million Stock Holdings in The Charles Schwab Co. (NYSE:SCHW) - MarketBeat. The Manufacturers Life Insurance Company Has $118.04 Million Stock Holdings in The Charles Schwab Co. (NYSE:SCHW)  MarketBeat,,-0.99998796,negative,2025-05-01 11:50:28
SCHW,Charles Schwab,Have Charles Schwab Insiders Been Selling Stock? - simplywall.st,Have Charles Schwab Insiders Been Selling Stock?  simplywall.st,Have Charles Schwab Insiders Been Selling Stock? - simplywall.st. Have Charles Schwab Insiders Been Selling Stock?  simplywall.st,,-0.9999788,negative,2025-05-01 10:45:33
SCHW,Charles Schwab,Charles Schwab Unveils National Investing Day to Educate and Emp - GuruFocus,Charles Schwab Unveils National Investing Day to Educate and Emp  GuruFocus,Charles Schwab Unveils National Investing Day to Educate and Emp - GuruFocus. Charles Schwab Unveils National Investing Day to Educate and Emp  GuruFocus,,-0.99999297,negative,2025-05-01 09:20:47
SCHW,Charles Schwab,The Charles Schwab Co. (NYSE:SCHW) Shares Sold by Voya Investment Management LLC - MarketBeat,The Charles Schwab Co. (NYSE:SCHW) Shares Sold by Voya Investment Management LLC  MarketBeat,The Charles Schwab Co. (NYSE:SCHW) Shares Sold by Voya Investment Management LLC - MarketBeat. The Charles Schwab Co. (NYSE:SCHW) Shares Sold by Voya Investment Management LLC  MarketBeat,,-0.99999595,negative,2025-05-01 07:00:00
