ticker,company_name,title,summary,text,search_term,sentiment_score,sentiment_label,published
TXN,Texas Instruments,Top Wall Street analysts are bullish on these 3 dividend stocks for stable returns - CNBC,Top Wall Street analysts are bullish on these 3 dividend stocks for stable returns  CNBC,Top Wall Street analysts are bullish on these 3 dividend stocks for stable returns - CNBC. Top Wall Street analysts are bullish on these 3 dividend stocks for stable returns  CNBC,,1.0,neutral,2025-05-04 11:18:45
TXN,Texas Instruments,Are Texas Instruments Incorporated's (NASDAQ:TXN) Fundamentals Good Enough to Warrant Buying Given The Stock's Recent Weakness? - Yahoo Finance,Are Texas Instruments Incorporated's (NASDAQ:TXN) Fundamentals Good Enough to Warrant Buying Given The Stock's Recent Weakness?  Yahoo Finance,Are Texas Instruments Incorporated's (NASDAQ:TXN) Fundamentals Good Enough to Warrant Buying Given The Stock's Recent Weakness? - Yahoo Finance. Are Texas Instruments Incorporated's (NASDAQ:TXN) Fundamentals Good Enough to Warrant Buying Given The Stock's Recent Weakness?  Yahoo Finance,,0.9999989,neutral,2025-05-02 11:00:28
TXN,Texas Instruments,Texas Instruments Incorporated (TXN): Jim Cramer Left Wishful – “Texan Is So Non-Promotional” - Yahoo Finance,Texas Instruments Incorporated (TXN): Jim Cramer Left Wishful – “Texan Is So Non-Promotional”  Yahoo Finance,Texas Instruments Incorporated (TXN): Jim Cramer Left Wishful – “Texan Is So Non-Promotional” - Yahoo Finance. Texas Instruments Incorporated (TXN): Jim Cramer Left Wishful – “Texan Is So Non-Promotional”  Yahoo Finance,,-0.9997446,negative,2025-05-01 21:37:37
TXN,Texas Instruments,Texas Instruments (TXN) Receives Sell Rating from Seaport Resear - GuruFocus,Texas Instruments (TXN) Receives Sell Rating from Seaport Resear  GuruFocus,Texas Instruments (TXN) Receives Sell Rating from Seaport Resear - GuruFocus. Texas Instruments (TXN) Receives Sell Rating from Seaport Resear  GuruFocus,,-0.84213376,negative,2025-05-01 07:15:06
TXN,Texas Instruments,Seaport Global Initiates Coverage of Texas Instruments (SNSE:TXN) with Sell Recommendation - Nasdaq,Seaport Global Initiates Coverage of Texas Instruments (SNSE:TXN) with Sell Recommendation  Nasdaq,Seaport Global Initiates Coverage of Texas Instruments (SNSE:TXN) with Sell Recommendation - Nasdaq. Seaport Global Initiates Coverage of Texas Instruments (SNSE:TXN) with Sell Recommendation  Nasdaq,,-0.7408426,negative,2025-05-01 06:24:00
TXN,Texas Instruments,Seaport Global Initiates Coverage of Texas Instruments (TXN) with Sell Recommendation - Nasdaq,Seaport Global Initiates Coverage of Texas Instruments (TXN) with Sell Recommendation  Nasdaq,Seaport Global Initiates Coverage of Texas Instruments (TXN) with Sell Recommendation - Nasdaq. Seaport Global Initiates Coverage of Texas Instruments (TXN) with Sell Recommendation  Nasdaq,,-0.95248944,negative,2025-05-01 00:04:00
