ticker,company_name,title,summary,text,search_term,sentiment_score,sentiment_label,published
GOOG,Google,ESG News Recap: Google's Power in Danger with Antitrust Trial - Impakter,ESG News Recap: Google's Power in Danger with Antitrust Trial  Impakter,ESG News Recap: Google's Power in Danger with Antitrust Trial - Impakter. ESG News Recap: Google's Power in Danger with Antitrust Trial  Impakter,ESG,0.507088,neutral,2025-04-30 16:19:52
GOOG,Google,Alphabet Inc. (NASDAQ:GOOGL) Shares Sold by ESG Planning DBA Harper Investing - Defense World,Alphabet Inc. (NASDAQ:GOOGL) Shares Sold by ESG Planning DBA Harper Investing  Defense World,Alphabet Inc. (NASDAQ:GOOGL) Shares Sold by ESG Planning DBA Harper Investing - Defense World. Alphabet Inc. (NASDAQ:GOOGL) Shares Sold by ESG Planning DBA Harper Investing  Defense World,ESG,-0.99998975,negative,2025-04-07 07:00:00
GOOG,Google,"Amazon Follows Google’s Lead, Deploys AI for Flood Prevention - ESG News","Amazon Follows Google’s Lead, Deploys AI for Flood Prevention  ESG News","Amazon Follows Google’s Lead, Deploys AI for Flood Prevention - ESG News. Amazon Follows Google’s Lead, Deploys AI for Flood Prevention  ESG News",ESG,-0.99998724,negative,2025-03-04 08:00:00
GOOG,Google,10 Best ESG Stocks for 2025 - The Motley Fool,10 Best ESG Stocks for 2025  The Motley Fool,10 Best ESG Stocks for 2025 - The Motley Fool. 10 Best ESG Stocks for 2025  The Motley Fool,ESG,-0.96607536,negative,2025-02-25 08:00:00
GOOG,Google,ESG News Recap: EU Spares 80% of Companies From Border Tax - Impakter,ESG News Recap: EU Spares 80% of Companies From Border Tax  Impakter,ESG News Recap: EU Spares 80% of Companies From Border Tax - Impakter. ESG News Recap: EU Spares 80% of Companies From Border Tax  Impakter,ESG,-0.9999913,negative,2025-02-07 08:00:00
GOOG,Google,ESG Framework for Sustainable AI Business - Samsung SDS,ESG Framework for Sustainable AI Business  Samsung SDS,ESG Framework for Sustainable AI Business - Samsung SDS. ESG Framework for Sustainable AI Business  Samsung SDS,ESG,-0.99998903,negative,2024-12-30 08:00:00
GOOG,Google,Best ESG ETFs: Top Funds For Socially Responsible Investing - Bankrate,Best ESG ETFs: Top Funds For Socially Responsible Investing  Bankrate,Best ESG ETFs: Top Funds For Socially Responsible Investing - Bankrate. Best ESG ETFs: Top Funds For Socially Responsible Investing  Bankrate,ESG,-0.99941397,negative,2024-12-19 08:00:00
GOOG,Google,8 Ways Google is Using AI to Help Cities Become More Sustainable - ESG News,8 Ways Google is Using AI to Help Cities Become More Sustainable  ESG News,8 Ways Google is Using AI to Help Cities Become More Sustainable - ESG News. 8 Ways Google is Using AI to Help Cities Become More Sustainable  ESG News,ESG,-0.95166856,negative,2024-10-22 07:00:00
GOOG,Google,Google Signs World’s First Corporate Nuclear Energy Deal to Power Clean AI Growth - ESG News,Google Signs World’s First Corporate Nuclear Energy Deal to Power Clean AI Growth  ESG News,Google Signs World’s First Corporate Nuclear Energy Deal to Power Clean AI Growth - ESG News. Google Signs World’s First Corporate Nuclear Energy Deal to Power Clean AI Growth  ESG News,ESG,-0.75492126,negative,2024-10-15 07:00:00
GOOG,Google,Billie Eilish Teams Up with Google Maps for Sustainable Touring - ESG News,Billie Eilish Teams Up with Google Maps for Sustainable Touring  ESG News,Billie Eilish Teams Up with Google Maps for Sustainable Touring - ESG News. Billie Eilish Teams Up with Google Maps for Sustainable Touring  ESG News,ESG,-0.9999945,negative,2024-09-26 07:00:00
GOOG,Google,Power thirst complicates ESG investors' love affair with tech stocks - Reuters,Power thirst complicates ESG investors' love affair with tech stocks  Reuters,Power thirst complicates ESG investors' love affair with tech stocks - Reuters. Power thirst complicates ESG investors' love affair with tech stocks  Reuters,ESG,-0.9999132,negative,2024-09-26 07:00:00
GOOG,Google,Google Drops Carbon-Neutral Promise Amid Surge in AI Emissions - Seneca ESG,Google Drops Carbon-Neutral Promise Amid Surge in AI Emissions  Seneca ESG,Google Drops Carbon-Neutral Promise Amid Surge in AI Emissions - Seneca ESG. Google Drops Carbon-Neutral Promise Amid Surge in AI Emissions  Seneca ESG,ESG,0.99997723,neutral,2024-09-19 07:00:00
GOOG,Google,"ESG uncertainty, investor attention and stock price crash risk in China: evidence from PVAR model analysis - Nature","ESG uncertainty, investor attention and stock price crash risk in China: evidence from PVAR model analysis  Nature","ESG uncertainty, investor attention and stock price crash risk in China: evidence from PVAR model analysis - Nature. ESG uncertainty, investor attention and stock price crash risk in China: evidence from PVAR model analysis  Nature",ESG,0.8731687,positive,2024-09-06 07:00:00
GOOG,Google,Why are Big Tech stocks still ESG stars? - Investors' Chronicle,Why are Big Tech stocks still ESG stars?  Investors' Chronicle,Why are Big Tech stocks still ESG stars? - Investors' Chronicle. Why are Big Tech stocks still ESG stars?  Investors' Chronicle,ESG,0.55459714,positive,2024-08-28 07:00:00
GOOG,Google,ESG Disclosures in the Private Equity Industry - ABRAHAM - 2024 - Journal of Accounting Research - Wiley Online Library,ESG Disclosures in the Private Equity Industry - ABRAHAM - 2024 - Journal of Accounting Research  Wiley Online Library,ESG Disclosures in the Private Equity Industry - ABRAHAM - 2024 - Journal of Accounting Research - Wiley Online Library. ESG Disclosures in the Private Equity Industry - ABRAHAM - 2024 - Journal of Accounting Research  Wiley Online Library,ESG,-0.99999905,negative,2024-08-28 07:00:00
GOOG,Google,ESG and customer stability: a perspective based on external and internal supervision and reputation mechanisms - Nature,ESG and customer stability: a perspective based on external and internal supervision and reputation mechanisms  Nature,ESG and customer stability: a perspective based on external and internal supervision and reputation mechanisms - Nature. ESG and customer stability: a perspective based on external and internal supervision and reputation mechanisms  Nature,ESG,-0.99963343,negative,2024-07-30 07:00:00
GOOG,Google,Google and DHL Form Global Partnership to Reduce CO2 Emissions with Sustainable Aviation Fuel - ESG News,Google and DHL Form Global Partnership to Reduce CO2 Emissions with Sustainable Aviation Fuel  ESG News,Google and DHL Form Global Partnership to Reduce CO2 Emissions with Sustainable Aviation Fuel - ESG News. Google and DHL Form Global Partnership to Reduce CO2 Emissions with Sustainable Aviation Fuel  ESG News,ESG,-0.9722545,negative,2024-07-24 07:00:00
GOOG,Google,"Green Economy Outperforms Global Market Over Past 10 Years, Second Only to Tech: LSEG - ESG Today","Green Economy Outperforms Global Market Over Past 10 Years, Second Only to Tech: LSEG  ESG Today","Green Economy Outperforms Global Market Over Past 10 Years, Second Only to Tech: LSEG - ESG Today. Green Economy Outperforms Global Market Over Past 10 Years, Second Only to Tech: LSEG  ESG Today",ESG,0.99986005,neutral,2024-07-11 07:00:00
GOOG,Google,Does ESG performance promote vitality of capital market? Analysis from the perspective of stock liquidity - Frontiers,Does ESG performance promote vitality of capital market? Analysis from the perspective of stock liquidity  Frontiers,Does ESG performance promote vitality of capital market? Analysis from the perspective of stock liquidity - Frontiers. Does ESG performance promote vitality of capital market? Analysis from the perspective of stock liquidity  Frontiers,ESG,-0.9999796,negative,2024-06-27 15:51:37
GOOG,Google,ESG performance and corporate value: Analysis from the stakeholders’ perspective - Frontiers,ESG performance and corporate value: Analysis from the stakeholders’ perspective  Frontiers,ESG performance and corporate value: Analysis from the stakeholders’ perspective - Frontiers. ESG performance and corporate value: Analysis from the stakeholders’ perspective  Frontiers,ESG,-0.99998045,negative,2024-06-27 10:31:29
GOOG,Google,Resource dependence and enterprise ESG performance: an empirical study based on A-share listed companies - Frontiers,Resource dependence and enterprise ESG performance: an empirical study based on A-share listed companies  Frontiers,Resource dependence and enterprise ESG performance: an empirical study based on A-share listed companies - Frontiers. Resource dependence and enterprise ESG performance: an empirical study based on A-share listed companies  Frontiers,ESG,-0.9999995,negative,2024-06-26 07:24:01
GOOG,Google,Higher expected returns for investors in the energy sector in Europe using an ESG strategy - Frontiers,Higher expected returns for investors in the energy sector in Europe using an ESG strategy  Frontiers,Higher expected returns for investors in the energy sector in Europe using an ESG strategy - Frontiers. Higher expected returns for investors in the energy sector in Europe using an ESG strategy  Frontiers,ESG,0.99999964,neutral,2024-06-25 16:55:29
GOOG,Google,ESG metrics and social equity: Investigating commensurability - Frontiers,ESG metrics and social equity: Investigating commensurability  Frontiers,ESG metrics and social equity: Investigating commensurability - Frontiers. ESG metrics and social equity: Investigating commensurability  Frontiers,ESG,-0.99999654,negative,2024-06-25 11:50:04
GOOG,Google,Google and NV Energy Forge Innovative Clean Energy Partnership - ESG News,Google and NV Energy Forge Innovative Clean Energy Partnership  ESG News,Google and NV Energy Forge Innovative Clean Energy Partnership - ESG News. Google and NV Energy Forge Innovative Clean Energy Partnership  ESG News,ESG,-0.9963289,negative,2024-06-14 07:00:00
GOOG,Google,"Amazon, Google, Microsoft, Nucor and Duke Energy Collaborate to Accelerate Carbon-Free Energy Generation Through Innovative Tariffs - ESG News","Amazon, Google, Microsoft, Nucor and Duke Energy Collaborate to Accelerate Carbon-Free Energy Generation Through Innovative Tariffs  ESG News","Amazon, Google, Microsoft, Nucor and Duke Energy Collaborate to Accelerate Carbon-Free Energy Generation Through Innovative Tariffs - ESG News. Amazon, Google, Microsoft, Nucor and Duke Energy Collaborate to Accelerate Carbon-Free Energy Generation Through Innovative Tariffs  ESG News",ESG,0.98995143,neutral,2024-06-04 07:00:00
GOOG,Google,Deep-learning-based stock market prediction incorporating ESG sentiment and technical indicators - Nature,Deep-learning-based stock market prediction incorporating ESG sentiment and technical indicators  Nature,Deep-learning-based stock market prediction incorporating ESG sentiment and technical indicators - Nature. Deep-learning-based stock market prediction incorporating ESG sentiment and technical indicators  Nature,ESG,-0.9999995,negative,2024-05-04 07:00:00
GOOG,Google,American Forests and Green Columbus Partner with Google to Enhance Tree Equity in Central Ohio - ESG News,American Forests and Green Columbus Partner with Google to Enhance Tree Equity in Central Ohio  ESG News,American Forests and Green Columbus Partner with Google to Enhance Tree Equity in Central Ohio - ESG News. American Forests and Green Columbus Partner with Google to Enhance Tree Equity in Central Ohio  ESG News,ESG,0.98485607,neutral,2024-04-04 07:00:00
GOOG,Google,Does corporate digital transformation restrain ESG decoupling? Evidence from China - Nature,Does corporate digital transformation restrain ESG decoupling? Evidence from China  Nature,Does corporate digital transformation restrain ESG decoupling? Evidence from China - Nature. Does corporate digital transformation restrain ESG decoupling? Evidence from China  Nature,ESG,0.51681936,positive,2024-03-14 07:00:00
GOOG,Google,"ESG performance, auditing quality, and investment efficiency: Empirical evidence from China - Frontiers","ESG performance, auditing quality, and investment efficiency: Empirical evidence from China  Frontiers","ESG performance, auditing quality, and investment efficiency: Empirical evidence from China - Frontiers. ESG performance, auditing quality, and investment efficiency: Empirical evidence from China  Frontiers",ESG,-0.992462,negative,2024-02-15 22:24:14
GOOG,Google,The role of ESG performance during times of COVID-19 pandemic - Scientific Reports - Nature,The role of ESG performance during times of COVID-19 pandemic - Scientific Reports  Nature,The role of ESG performance during times of COVID-19 pandemic - Scientific Reports - Nature. The role of ESG performance during times of COVID-19 pandemic - Scientific Reports  Nature,ESG,-0.99999774,negative,2024-01-31 08:00:00
GOOG,Google,Examining supply chain vulnerability via an analysis of ESG-Prioritized firms amid the Russian-Ukrainian conflict - ScienceDirect.com,Examining supply chain vulnerability via an analysis of ESG-Prioritized firms amid the Russian-Ukrainian conflict  ScienceDirect.com,Examining supply chain vulnerability via an analysis of ESG-Prioritized firms amid the Russian-Ukrainian conflict - ScienceDirect.com. Examining supply chain vulnerability via an analysis of ESG-Prioritized firms amid the Russian-Ukrainian conflict  ScienceDirect.com,ESG,-0.9999603,negative,2024-01-01 08:00:00
GOOG,Google,Toward sustainable port development: an empirical analysis of China’s port industry using an ESG framework - Nature,Toward sustainable port development: an empirical analysis of China’s port industry using an ESG framework  Nature,Toward sustainable port development: an empirical analysis of China’s port industry using an ESG framework - Nature. Toward sustainable port development: an empirical analysis of China’s port industry using an ESG framework  Nature,ESG,-0.9999994,negative,2023-12-13 08:00:00
GOOG,Google,13 Best ESG Stocks To Buy Now - Yahoo Finance,13 Best ESG Stocks To Buy Now  Yahoo Finance,13 Best ESG Stocks To Buy Now - Yahoo Finance. 13 Best ESG Stocks To Buy Now  Yahoo Finance,ESG,-0.99779874,negative,2023-10-30 07:00:00
GOOG,Google,ESG has lost its meaning. One advocate says let’s throw it in the trash - CNN,ESG has lost its meaning. One advocate says let’s throw it in the trash  CNN,ESG has lost its meaning. One advocate says let’s throw it in the trash - CNN. ESG has lost its meaning. One advocate says let’s throw it in the trash  CNN,ESG,-0.9914147,negative,2023-10-03 07:00:00
GOOG,Google,Google Launches New Sustainability Tools to Help Businesses and Cities Map Environmental Information - ESG News,Google Launches New Sustainability Tools to Help Businesses and Cities Map Environmental Information  ESG News,Google Launches New Sustainability Tools to Help Businesses and Cities Map Environmental Information - ESG News. Google Launches New Sustainability Tools to Help Businesses and Cities Map Environmental Information  ESG News,ESG,-0.91679376,negative,2023-08-29 07:00:00
GOOG,Google,Google Joins One of the World’s Largest Sustainable Aviation Fuel Programs - ESG News,Google Joins One of the World’s Largest Sustainable Aviation Fuel Programs  ESG News,Google Joins One of the World’s Largest Sustainable Aviation Fuel Programs - ESG News. Google Joins One of the World’s Largest Sustainable Aviation Fuel Programs  ESG News,ESG,0.8286265,neutral,2023-08-16 07:00:00
GOOG,Google,Exploring the relationship between corporate ESG information disclosure and audit fees: evidence from non-financial A-share listed companies in China - Frontiers,Exploring the relationship between corporate ESG information disclosure and audit fees: evidence from non-financial A-share listed companies in China  Frontiers,Exploring the relationship between corporate ESG information disclosure and audit fees: evidence from non-financial A-share listed companies in China - Frontiers. Exploring the relationship between corporate ESG information disclosure and audit fees: evidence from non-financial A-share listed companies in China  Frontiers,ESG,-0.9995096,negative,2023-07-30 07:00:00
GOOG,Google,Does withdrawal from/remaining in an aggressor country affect companies’ ESG ratings? Case study of the Russia-Ukraine war - Frontiers,Does withdrawal from/remaining in an aggressor country affect companies’ ESG ratings? Case study of the Russia-Ukraine war  Frontiers,Does withdrawal from/remaining in an aggressor country affect companies’ ESG ratings? Case study of the Russia-Ukraine war - Frontiers. Does withdrawal from/remaining in an aggressor country affect companies’ ESG ratings? Case study of the Russia-Ukraine war  Frontiers,ESG,-0.9999062,negative,2023-07-25 07:00:00
GOOG,Google,Green bond issuance and corporate ESG performance: the perspective of internal attention and external supervision - Nature,Green bond issuance and corporate ESG performance: the perspective of internal attention and external supervision  Nature,Green bond issuance and corporate ESG performance: the perspective of internal attention and external supervision - Nature. Green bond issuance and corporate ESG performance: the perspective of internal attention and external supervision  Nature,ESG,-0.99995756,negative,2023-07-24 07:00:00
GOOG,Google,"Do business strategies and environmental, social, and governance (ESG) performance mitigate the likelihood of financial distress? A multiple mediation model - ScienceDirect.com","Do business strategies and environmental, social, and governance (ESG) performance mitigate the likelihood of financial distress? A multiple mediation model  ScienceDirect.com","Do business strategies and environmental, social, and governance (ESG) performance mitigate the likelihood of financial distress? A multiple mediation model - ScienceDirect.com. Do business strategies and environmental, social, and governance (ESG) performance mitigate the likelihood of financial distress? A multiple mediation model  ScienceDirect.com",ESG,-0.57457,negative,2023-07-07 13:32:00
GOOG,Google,"Aswath Damodaran: A Valuation Expert’s Take on Inflation, Stock Buybacks, ESG, and More - Morningstar","Aswath Damodaran: A Valuation Expert’s Take on Inflation, Stock Buybacks, ESG, and More  Morningstar","Aswath Damodaran: A Valuation Expert’s Take on Inflation, Stock Buybacks, ESG, and More - Morningstar. Aswath Damodaran: A Valuation Expert’s Take on Inflation, Stock Buybacks, ESG, and More  Morningstar",ESG,-0.9999974,negative,2023-05-16 07:00:00
GOOG,Google,Global Investments in ESG Funds Plunged 76% in 2022 - Investopedia,Global Investments in ESG Funds Plunged 76% in 2022  Investopedia,Global Investments in ESG Funds Plunged 76% in 2022 - Investopedia. Global Investments in ESG Funds Plunged 76% in 2022  Investopedia,ESG,0.6963918,positive,2023-02-08 08:00:00
GOOG,Google,Google Trends Relative Importance of the ESG from 2019 untill 2021 - ResearchGate,Google Trends Relative Importance of the ESG from 2019 untill 2021  ResearchGate,Google Trends Relative Importance of the ESG from 2019 untill 2021 - ResearchGate. Google Trends Relative Importance of the ESG from 2019 untill 2021  ResearchGate,ESG,-0.9999919,negative,2023-02-03 15:43:13
GOOG,Google,FAANG Bets That Wiped Out ESG Returns May Do More Harm in 2023 - Bloomberg.com,FAANG Bets That Wiped Out ESG Returns May Do More Harm in 2023  Bloomberg.com,FAANG Bets That Wiped Out ESG Returns May Do More Harm in 2023 - Bloomberg.com. FAANG Bets That Wiped Out ESG Returns May Do More Harm in 2023  Bloomberg.com,ESG,-0.9569125,negative,2022-11-17 08:00:00
GOOG,Google,Exploring the relationship of ESG score and firm value using fsQCA method: Cases of the Chinese manufacturing enterprises - Frontiers,Exploring the relationship of ESG score and firm value using fsQCA method: Cases of the Chinese manufacturing enterprises  Frontiers,Exploring the relationship of ESG score and firm value using fsQCA method: Cases of the Chinese manufacturing enterprises - Frontiers. Exploring the relationship of ESG score and firm value using fsQCA method: Cases of the Chinese manufacturing enterprises  Frontiers,ESG,-0.9999938,negative,2022-10-10 07:00:00
GOOG,Google,Why Big Tech is slow to embrace ESG-linked pay - capitalmonitor.ai,Why Big Tech is slow to embrace ESG-linked pay  capitalmonitor.ai,Why Big Tech is slow to embrace ESG-linked pay - capitalmonitor.ai. Why Big Tech is slow to embrace ESG-linked pay  capitalmonitor.ai,ESG,0.9605347,positive,2022-09-06 07:00:00
GOOG,Google,ESG performance and stock prices: evidence from the COVID-19 outbreak in China - Nature,ESG performance and stock prices: evidence from the COVID-19 outbreak in China  Nature,ESG performance and stock prices: evidence from the COVID-19 outbreak in China - Nature. ESG performance and stock prices: evidence from the COVID-19 outbreak in China  Nature,ESG,-0.99956244,negative,2022-07-18 07:00:00
GOOG,Google,Evaluation of ESG Ratings for Chinese Listed Companies From the Perspective of Stock Price Crash Risk - Frontiers,Evaluation of ESG Ratings for Chinese Listed Companies From the Perspective of Stock Price Crash Risk  Frontiers,Evaluation of ESG Ratings for Chinese Listed Companies From the Perspective of Stock Price Crash Risk - Frontiers. Evaluation of ESG Ratings for Chinese Listed Companies From the Perspective of Stock Price Crash Risk  Frontiers,ESG,-0.9997577,negative,2022-06-23 07:00:00
GOOG,Google,ESG Funds Aren’t Giving Up on Tesla Stock - Barron's,ESG Funds Aren’t Giving Up on Tesla Stock  Barron's,ESG Funds Aren’t Giving Up on Tesla Stock - Barron's. ESG Funds Aren’t Giving Up on Tesla Stock  Barron's,ESG,-0.9999896,negative,2022-05-23 07:00:00
GOOG,Google,EFIV Refreshed After ESG Index Rebalance - ETF Database,EFIV Refreshed After ESG Index Rebalance  ETF Database,EFIV Refreshed After ESG Index Rebalance - ETF Database. EFIV Refreshed After ESG Index Rebalance  ETF Database,ESG,-0.9999925,negative,2022-05-18 07:00:00
GOOG,Google,Does ESG Disclosure Help Improve Intangible Capital? Evidence From A-Share Listed Companies - Frontiers,Does ESG Disclosure Help Improve Intangible Capital? Evidence From A-Share Listed Companies  Frontiers,Does ESG Disclosure Help Improve Intangible Capital? Evidence From A-Share Listed Companies - Frontiers. Does ESG Disclosure Help Improve Intangible Capital? Evidence From A-Share Listed Companies  Frontiers,ESG,0.9999995,neutral,2022-05-09 07:00:00
GOOG,Google,ESG investing and the great data challenge - Financial Times,ESG investing and the great data challenge  Financial Times,ESG investing and the great data challenge - Financial Times. ESG investing and the great data challenge  Financial Times,ESG,0.71788853,neutral,2022-01-10 09:01:11
GOOG,Google,100 Best ESG Companies Combine Superior Stock Ratings With Social Values - Investor's Business Daily,100 Best ESG Companies Combine Superior Stock Ratings With Social Values  Investor's Business Daily,100 Best ESG Companies Combine Superior Stock Ratings With Social Values - Investor's Business Daily. 100 Best ESG Companies Combine Superior Stock Ratings With Social Values  Investor's Business Daily,ESG,0.9999546,neutral,2021-11-09 08:00:00
GOOG,Google,"Eurazeo’s Virginie Morgon Discusses Tech, Talent and ESG - WSJ","Eurazeo’s Virginie Morgon Discusses Tech, Talent and ESG  WSJ","Eurazeo’s Virginie Morgon Discusses Tech, Talent and ESG - WSJ. Eurazeo’s Virginie Morgon Discusses Tech, Talent and ESG  WSJ",ESG,-0.9999994,negative,2021-07-08 07:00:00
GOOG,Google,Alphabet was the most widely held stock for the largest ESG funds. Here’s what else they own - CNBC,Alphabet was the most widely held stock for the largest ESG funds. Here’s what else they own  CNBC,Alphabet was the most widely held stock for the largest ESG funds. Here’s what else they own - CNBC. Alphabet was the most widely held stock for the largest ESG funds. Here’s what else they own  CNBC,ESG,-0.9998222,negative,2021-05-18 07:00:00
GOOG,Google,"Behind the buzz of ESG investing, a focus on tech giants and no regulation - Mongabay","Behind the buzz of ESG investing, a focus on tech giants and no regulation  Mongabay","Behind the buzz of ESG investing, a focus on tech giants and no regulation - Mongabay. Behind the buzz of ESG investing, a focus on tech giants and no regulation  Mongabay",ESG,-0.9999964,negative,2021-04-30 07:00:00
GOOG,Google,Funds branded ‘ESG’ are laden with technology stocks - Financial Times,Funds branded ‘ESG’ are laden with technology stocks  Financial Times,Funds branded ‘ESG’ are laden with technology stocks - Financial Times. Funds branded ‘ESG’ are laden with technology stocks  Financial Times,ESG,-0.9999943,negative,2020-08-14 07:00:00
GOOG,Google,How ESG Investing Can Reduce Risk - Morningstar,How ESG Investing Can Reduce Risk  Morningstar,How ESG Investing Can Reduce Risk - Morningstar. How ESG Investing Can Reduce Risk  Morningstar,ESG,0.99951386,neutral,2020-07-28 07:00:00
GOOG,Google,"Tech Giants, Anti-trust and ESG - Morningstar","Tech Giants, Anti-trust and ESG  Morningstar","Tech Giants, Anti-trust and ESG - Morningstar. Tech Giants, Anti-trust and ESG  Morningstar",ESG,-0.9999907,negative,2020-07-22 07:00:00
GOOG,Google,15 Best ESG Funds for Responsible Investors - Kiplinger,15 Best ESG Funds for Responsible Investors  Kiplinger,15 Best ESG Funds for Responsible Investors - Kiplinger. 15 Best ESG Funds for Responsible Investors  Kiplinger,ESG,-0.99999595,negative,2020-06-01 07:00:00
GOOG,Google,ESG Investing Is Having a Good Crisis. It's Also Killing Jobs - Bloomberg.com,ESG Investing Is Having a Good Crisis. It's Also Killing Jobs  Bloomberg.com,ESG Investing Is Having a Good Crisis. It's Also Killing Jobs - Bloomberg.com. ESG Investing Is Having a Good Crisis. It's Also Killing Jobs  Bloomberg.com,ESG,0.86451817,positive,2020-05-20 07:00:00
