ticker,company_name,title,summary,text,search_term,sentiment_score,sentiment_label,published
BYDDY,BYD Company,Why Tesla Stock is Up 18% Since Weak Q1: Should You Book Profits? - The Globe and Mail,Why Tesla Stock is Up 18% Since Weak Q1: Should You Book Profits?  The Globe and Mail,Why Tesla Stock is Up 18% Since Weak Q1: Should You Book Profits? - The Globe and Mail. Why Tesla Stock is Up 18% Since Weak Q1: Should You Book Profits?  The Globe and Mail,AI,0.99973613,neutral,2025-05-01 13:20:00
BYDDY,BYD Company,2 Chinese AI Stocks to Buy as Huawei Reveals New AI Chips - MoneyMorning.com,2 Chinese AI Stocks to Buy as Huawei Reveals New AI Chips  MoneyMorning.com,2 Chinese AI Stocks to Buy as Huawei Reveals New AI Chips - MoneyMorning.com. 2 Chinese AI Stocks to Buy as Huawei Reveals New AI Chips  MoneyMorning.com,AI,-0.9999536,negative,2025-04-30 18:05:34
BYDDY,BYD Company,How Intuit is Revolutionizing Its Business and Products with AI - The Globe and Mail,How Intuit is Revolutionizing Its Business and Products with AI  The Globe and Mail,How Intuit is Revolutionizing Its Business and Products with AI - The Globe and Mail. How Intuit is Revolutionizing Its Business and Products with AI  The Globe and Mail,AI,0.70041853,neutral,2025-04-23 07:00:00
BYDDY,BYD Company,"Got $1,000? 2 No-Brainer Warren Buffett Stocks to Buy Right Now. - The Motley Fool","Got $1,000? 2 No-Brainer Warren Buffett Stocks to Buy Right Now.  The Motley Fool","Got $1,000? 2 No-Brainer Warren Buffett Stocks to Buy Right Now. - The Motley Fool. Got $1,000? 2 No-Brainer Warren Buffett Stocks to Buy Right Now.  The Motley Fool",AI,-0.9997224,negative,2025-04-11 07:00:00
BYDDY,BYD Company,Jefferies maintains Buy on BYD stock with HK$447 target - Investing.com,Jefferies maintains Buy on BYD stock with HK$447 target  Investing.com,Jefferies maintains Buy on BYD stock with HK$447 target - Investing.com. Jefferies maintains Buy on BYD stock with HK$447 target  Investing.com,AI,0.99953413,neutral,2025-04-08 07:00:00
BYDDY,BYD Company,"Trump 'Liberation Day' Tariffs Could Drive US Tech Sector Uncertainty, Slowdown AI Spending, Wedbush Analysts Say - marketscreener.com","Trump 'Liberation Day' Tariffs Could Drive US Tech Sector Uncertainty, Slowdown AI Spending, Wedbush Analysts Say  marketscreener.com","Trump 'Liberation Day' Tariffs Could Drive US Tech Sector Uncertainty, Slowdown AI Spending, Wedbush Analysts Say - marketscreener.com. Trump 'Liberation Day' Tariffs Could Drive US Tech Sector Uncertainty, Slowdown AI Spending, Wedbush Analysts Say  marketscreener.com",AI,0.9992071,positive,2025-04-01 07:00:00
BYDDY,BYD Company,"Jefferies lifts BYD stock price target to HK$447, maintains Buy rating - Investing.com","Jefferies lifts BYD stock price target to HK$447, maintains Buy rating  Investing.com","Jefferies lifts BYD stock price target to HK$447, maintains Buy rating - Investing.com. Jefferies lifts BYD stock price target to HK$447, maintains Buy rating  Investing.com",AI,1.0,neutral,2025-03-25 07:00:00
BYDDY,BYD Company,BYD Unveils Ultra-Fast Charging—Will It Supercharge BYDDY Stock? - The Globe and Mail,BYD Unveils Ultra-Fast Charging—Will It Supercharge BYDDY Stock?  The Globe and Mail,BYD Unveils Ultra-Fast Charging—Will It Supercharge BYDDY Stock? - The Globe and Mail. BYD Unveils Ultra-Fast Charging—Will It Supercharge BYDDY Stock?  The Globe and Mail,AI,-0.99998224,negative,2025-03-21 07:00:00
BYDDY,BYD Company,BYD Just Took Another Shot at Tesla Stock. How Should You Play TSLA Here? - The Globe and Mail,BYD Just Took Another Shot at Tesla Stock. How Should You Play TSLA Here?  The Globe and Mail,BYD Just Took Another Shot at Tesla Stock. How Should You Play TSLA Here? - The Globe and Mail. BYD Just Took Another Shot at Tesla Stock. How Should You Play TSLA Here?  The Globe and Mail,AI,-0.99998486,negative,2025-03-18 07:00:00
BYDDY,BYD Company,2 Top Artificial Intelligence Stocks to Buy in March - The Motley Fool,2 Top Artificial Intelligence Stocks to Buy in March  The Motley Fool,2 Top Artificial Intelligence Stocks to Buy in March - The Motley Fool. 2 Top Artificial Intelligence Stocks to Buy in March  The Motley Fool,AI,-0.99602544,negative,2025-03-11 07:00:00
BYDDY,BYD Company,BYD looks to raise up to $5.2B in share offering - report (BYDDF:Pink Current Info) - Seeking Alpha,BYD looks to raise up to $5.2B in share offering - report (BYDDF:Pink Current Info)  Seeking Alpha,BYD looks to raise up to $5.2B in share offering - report (BYDDF:Pink Current Info) - Seeking Alpha. BYD looks to raise up to $5.2B in share offering - report (BYDDF:Pink Current Info)  Seeking Alpha,AI,-0.87903684,negative,2025-03-03 08:00:00
BYDDY,BYD Company,DBS Raises BYD ELECTRONIC's TP to $65; Beneficiary from AI iPhone/ NEV Penetration - AASTOCKS.com,DBS Raises BYD ELECTRONIC's TP to $65; Beneficiary from AI iPhone/ NEV Penetration  AASTOCKS.com,DBS Raises BYD ELECTRONIC's TP to $65; Beneficiary from AI iPhone/ NEV Penetration - AASTOCKS.com. DBS Raises BYD ELECTRONIC's TP to $65; Beneficiary from AI iPhone/ NEV Penetration  AASTOCKS.com,AI,0.99975365,neutral,2025-02-18 07:38:00
BYDDY,BYD Company,China's BYD links up with DeepSeek in an AI threat to Tesla - Yahoo Finance,China's BYD links up with DeepSeek in an AI threat to Tesla  Yahoo Finance,China's BYD links up with DeepSeek in an AI threat to Tesla - Yahoo Finance. China's BYD links up with DeepSeek in an AI threat to Tesla  Yahoo Finance,AI,0.7564931,positive,2025-02-11 08:00:00
BYDDY,BYD Company,BYD Teams Up With DeepSeek To Outpace Tesla In Budget-Friendly AI-Driven Tech For Chinese Cars Amid Regulatory Roadblocks - Benzinga,BYD Teams Up With DeepSeek To Outpace Tesla In Budget-Friendly AI-Driven Tech For Chinese Cars Amid Regulatory Roadblocks  Benzinga,BYD Teams Up With DeepSeek To Outpace Tesla In Budget-Friendly AI-Driven Tech For Chinese Cars Amid Regulatory Roadblocks - Benzinga. BYD Teams Up With DeepSeek To Outpace Tesla In Budget-Friendly AI-Driven Tech For Chinese Cars Amid Regulatory Roadblocks  Benzinga,AI,0.99999523,neutral,2025-02-11 08:00:00
BYDDY,BYD Company,"Bernstein maintains BYD stock Outperform rating, HK$350 target - Investing.com","Bernstein maintains BYD stock Outperform rating, HK$350 target  Investing.com","Bernstein maintains BYD stock Outperform rating, HK$350 target - Investing.com. Bernstein maintains BYD stock Outperform rating, HK$350 target  Investing.com",AI,0.9999999,neutral,2025-01-09 08:00:00
BYDDY,BYD Company,"BYD Sets Up Advanced Tech Center, Plans $13.7 Billion AI Investment - GuruFocus","BYD Sets Up Advanced Tech Center, Plans $13.7 Billion AI Investment  GuruFocus","BYD Sets Up Advanced Tech Center, Plans $13.7 Billion AI Investment - GuruFocus. BYD Sets Up Advanced Tech Center, Plans $13.7 Billion AI Investment  GuruFocus",AI,-0.99999857,negative,2024-12-17 08:00:00
BYDDY,BYD Company,"BYD Surpassed Tesla In Quarterly Revenue For The First Time In Q3. It Assembles Over 30% Of iPads For Apple, And Is Now Planning To Build AI Robots For Nvidia - Benzinga","BYD Surpassed Tesla In Quarterly Revenue For The First Time In Q3. It Assembles Over 30% Of iPads For Apple, And Is Now Planning To Build AI Robots For Nvidia  Benzinga","BYD Surpassed Tesla In Quarterly Revenue For The First Time In Q3. It Assembles Over 30% Of iPads For Apple, And Is Now Planning To Build AI Robots For Nvidia - Benzinga. BYD Surpassed Tesla In Quarterly Revenue For The First Time In Q3. It Assembles Over 30% Of iPads For Apple, And Is Now Planning To Build AI Robots For Nvidia  Benzinga",AI,-0.8133428,negative,2024-12-02 08:00:00
BYDDY,BYD Company,AI predicts BYD stock price for end of 2024 - Finbold,AI predicts BYD stock price for end of 2024  Finbold,AI predicts BYD stock price for end of 2024 - Finbold. AI predicts BYD stock price for end of 2024  Finbold,AI,-0.9999974,negative,2024-08-09 07:00:00
BYDDY,BYD Company,"China's BYD Gains Automaking Identity, Reputation And Market Share Quarter By Quarter - Seeking Alpha","China's BYD Gains Automaking Identity, Reputation And Market Share Quarter By Quarter  Seeking Alpha","China's BYD Gains Automaking Identity, Reputation And Market Share Quarter By Quarter - Seeking Alpha. China's BYD Gains Automaking Identity, Reputation And Market Share Quarter By Quarter  Seeking Alpha",AI,0.9999999,neutral,2024-07-13 07:00:00
BYDDY,BYD Company,The 7 Best Stocks to Invest In for Big Gains in 2024 - InvestorPlace,The 7 Best Stocks to Invest In for Big Gains in 2024  InvestorPlace,The 7 Best Stocks to Invest In for Big Gains in 2024 - InvestorPlace. The 7 Best Stocks to Invest In for Big Gains in 2024  InvestorPlace,AI,0.9973621,neutral,2024-01-08 08:00:00
BYDDY,BYD Company,25 Millionaire-Maker AI Stocks to Buy Now - InvestorPlace,25 Millionaire-Maker AI Stocks to Buy Now  InvestorPlace,25 Millionaire-Maker AI Stocks to Buy Now - InvestorPlace. 25 Millionaire-Maker AI Stocks to Buy Now  InvestorPlace,AI,-0.99998856,negative,2023-07-20 07:00:00
BYDDY,BYD Company,25 AI Stocks to Buy Right Now - InvestorPlace,25 AI Stocks to Buy Right Now  InvestorPlace,25 AI Stocks to Buy Right Now - InvestorPlace. 25 AI Stocks to Buy Right Now  InvestorPlace,AI,-0.99997294,negative,2023-02-16 08:00:00
BYDDY,BYD Company,What Are Tesla’s (TSLA) Main Competitors? - Investopedia,What Are Tesla’s (TSLA) Main Competitors?  Investopedia,What Are Tesla’s (TSLA) Main Competitors? - Investopedia. What Are Tesla’s (TSLA) Main Competitors?  Investopedia,AI,-0.9999851,negative,2017-03-25 16:21:50
