ticker,company_name,title,summary,text,search_term,sentiment_score,sentiment_label,published
HSBC,HSBC,NVIDIA (NVDA) Downgraded by HSBC as AI GPU Momentum Shows Signs of Slowing - Yahoo Finance,NVIDIA (NVDA) Downgraded by HSBC as AI GPU Momentum Shows Signs of Slowing  Yahoo Finance,NVIDIA (NVDA) Downgraded by HSBC as AI GPU Momentum Shows Signs of Slowing - Yahoo Finance. NVIDIA (NVDA) Downgraded by HSBC as AI GPU Momentum Shows Signs of Slowing  Yahoo Finance,AI,0.9999831,positive,2025-04-07 07:00:00
HSBC,HSBC,Nvidia Slips Into Bearish Trend As HSBC Downgrades AI Giant - Benzinga,Nvidia Slips Into Bearish Trend As HSBC Downgrades AI Giant  Benzinga,Nvidia Slips Into Bearish Trend As HSBC Downgrades AI Giant - Benzinga. Nvidia Slips Into Bearish Trend As HSBC Downgrades AI Giant  Benzinga,AI,0.9985183,positive,2025-04-04 12:15:52
HSBC,HSBC,"Nvidia Tumbles as HSBC Slashes Target, Warns of AI Slowdown - Yahoo Finance","Nvidia Tumbles as HSBC Slashes Target, Warns of AI Slowdown  Yahoo Finance","Nvidia Tumbles as HSBC Slashes Target, Warns of AI Slowdown - Yahoo Finance. Nvidia Tumbles as HSBC Slashes Target, Warns of AI Slowdown  Yahoo Finance",AI,0.98301965,positive,2025-04-03 07:00:00
HSBC,HSBC,HSBC launches first multi-asset index driven by AI and big data - FinTech Futures,HSBC launches first multi-asset index driven by AI and big data  FinTech Futures,HSBC launches first multi-asset index driven by AI and big data - FinTech Futures. HSBC launches first multi-asset index driven by AI and big data  FinTech Futures,AI,-0.9999496,negative,2025-03-30 18:59:58
HSBC,HSBC,"Investors bank on more AI-driven stock upside in Hong Kong, Singapore, US: HSBC survey - MSN","Investors bank on more AI-driven stock upside in Hong Kong, Singapore, US: HSBC survey  MSN","Investors bank on more AI-driven stock upside in Hong Kong, Singapore, US: HSBC survey - MSN. Investors bank on more AI-driven stock upside in Hong Kong, Singapore, US: HSBC survey  MSN",AI,0.9999956,neutral,2025-03-27 15:58:50
HSBC,HSBC,"Investors bank on more AI-driven stock upside in Hong Kong, Singapore, US: HSBC - South China Morning Post","Investors bank on more AI-driven stock upside in Hong Kong, Singapore, US: HSBC  South China Morning Post","Investors bank on more AI-driven stock upside in Hong Kong, Singapore, US: HSBC - South China Morning Post. Investors bank on more AI-driven stock upside in Hong Kong, Singapore, US: HSBC  South China Morning Post",AI,0.9999969,neutral,2025-03-27 07:00:00
HSBC,HSBC,Alibaba Stock Drops. Its Chairman Sees an AI Bubble. - Barron's,Alibaba Stock Drops. Its Chairman Sees an AI Bubble.  Barron's,Alibaba Stock Drops. Its Chairman Sees an AI Bubble. - Barron's. Alibaba Stock Drops. Its Chairman Sees an AI Bubble.  Barron's,AI,-0.9991455,negative,2025-03-25 07:00:00
HSBC,HSBC,"HSBC Research Constructive on CN AI Stocks in Mid-to-Long Term, Expects Baidu/ Lenovo/ Alibaba to Catch Up - AASTOCKS.com","HSBC Research Constructive on CN AI Stocks in Mid-to-Long Term, Expects Baidu/ Lenovo/ Alibaba to Catch Up  AASTOCKS.com","HSBC Research Constructive on CN AI Stocks in Mid-to-Long Term, Expects Baidu/ Lenovo/ Alibaba to Catch Up - AASTOCKS.com. HSBC Research Constructive on CN AI Stocks in Mid-to-Long Term, Expects Baidu/ Lenovo/ Alibaba to Catch Up  AASTOCKS.com",AI,0.99830294,neutral,2025-03-06 08:00:00
HSBC,HSBC,"HSBC cuts NVIDIA stock price target to $175, maintains Buy - Investing.com","HSBC cuts NVIDIA stock price target to $175, maintains Buy  Investing.com","HSBC cuts NVIDIA stock price target to $175, maintains Buy - Investing.com. HSBC cuts NVIDIA stock price target to $175, maintains Buy  Investing.com",AI,-0.5682003,negative,2025-02-19 08:00:00
HSBC,HSBC,HSBC Mexico Taps OneMeta's Revolutionary AI Translation Tech for Global Cybersecurity Event - Stock Titan,HSBC Mexico Taps OneMeta's Revolutionary AI Translation Tech for Global Cybersecurity Event  Stock Titan,HSBC Mexico Taps OneMeta's Revolutionary AI Translation Tech for Global Cybersecurity Event - Stock Titan. HSBC Mexico Taps OneMeta's Revolutionary AI Translation Tech for Global Cybersecurity Event  Stock Titan,AI,-0.9981781,negative,2025-02-13 08:00:00
HSBC,HSBC,AI thinks these could be the best FTSE 100 stocks to consider buying now - The Motley Fool UK,AI thinks these could be the best FTSE 100 stocks to consider buying now  The Motley Fool UK,AI thinks these could be the best FTSE 100 stocks to consider buying now - The Motley Fool UK. AI thinks these could be the best FTSE 100 stocks to consider buying now  The Motley Fool UK,AI,-0.9662624,negative,2025-01-16 08:00:00
HSBC,HSBC,HSBC analyst raises Amazon stock price citing AI growth potential and strong profitability - Finbold,HSBC analyst raises Amazon stock price citing AI growth potential and strong profitability  Finbold,HSBC analyst raises Amazon stock price citing AI growth potential and strong profitability - Finbold. HSBC analyst raises Amazon stock price citing AI growth potential and strong profitability  Finbold,AI,1.0,neutral,2025-01-14 08:00:00
HSBC,HSBC,Nvidia Shares Dip on U.S. AI Export Restrictions and HSBC Price Target Cut - Yahoo Finance,Nvidia Shares Dip on U.S. AI Export Restrictions and HSBC Price Target Cut  Yahoo Finance,Nvidia Shares Dip on U.S. AI Export Restrictions and HSBC Price Target Cut - Yahoo Finance. Nvidia Shares Dip on U.S. AI Export Restrictions and HSBC Price Target Cut  Yahoo Finance,AI,0.86256164,positive,2025-01-13 08:00:00
HSBC,HSBC,Nvidia (NVDA) HSBC Securities Cut Target Forecast to $185 - The Globe and Mail,Nvidia (NVDA) HSBC Securities Cut Target Forecast to $185  The Globe and Mail,Nvidia (NVDA) HSBC Securities Cut Target Forecast to $185 - The Globe and Mail. Nvidia (NVDA) HSBC Securities Cut Target Forecast to $185  The Globe and Mail,AI,0.9743517,positive,2025-01-13 08:00:00
HSBC,HSBC,"AMD’s AI Ambitions Face Headwinds, HSBC Analyst Warns - TipRanks","AMD’s AI Ambitions Face Headwinds, HSBC Analyst Warns  TipRanks","AMD’s AI Ambitions Face Headwinds, HSBC Analyst Warns - TipRanks. AMD’s AI Ambitions Face Headwinds, HSBC Analyst Warns  TipRanks",AI,0.99882036,positive,2025-01-09 08:00:00
HSBC,HSBC,AMD Stock Slumps After Double Downgrade by HSBC on AI Revenue Concerns - MSN,AMD Stock Slumps After Double Downgrade by HSBC on AI Revenue Concerns  MSN,AMD Stock Slumps After Double Downgrade by HSBC on AI Revenue Concerns - MSN. AMD Stock Slumps After Double Downgrade by HSBC on AI Revenue Concerns  MSN,AI,0.9999857,positive,2025-01-08 20:07:20
HSBC,HSBC,AMD stock down as HSBC cuts rating on less competitive AI roadmap - MSN,AMD stock down as HSBC cuts rating on less competitive AI roadmap  MSN,AMD stock down as HSBC cuts rating on less competitive AI roadmap - MSN. AMD stock down as HSBC cuts rating on less competitive AI roadmap  MSN,AI,0.9999889,positive,2025-01-08 14:09:32
HSBC,HSBC,AMD Shares Plunge 5% as Analysts Cut Rating on AI Concerns - Yahoo Finance,AMD Shares Plunge 5% as Analysts Cut Rating on AI Concerns  Yahoo Finance,AMD Shares Plunge 5% as Analysts Cut Rating on AI Concerns - Yahoo Finance. AMD Shares Plunge 5% as Analysts Cut Rating on AI Concerns  Yahoo Finance,AI,0.9999951,positive,2025-01-08 08:00:00
HSBC,HSBC,"AMD Stock Drops After Downgrade. It's Behind Nvidia, Intel in AI Chips Race. - Barron's","AMD Stock Drops After Downgrade. It's Behind Nvidia, Intel in AI Chips Race.  Barron's","AMD Stock Drops After Downgrade. It's Behind Nvidia, Intel in AI Chips Race. - Barron's. AMD Stock Drops After Downgrade. It's Behind Nvidia, Intel in AI Chips Race.  Barron's",AI,-0.837908,negative,2025-01-08 08:00:00
HSBC,HSBC,HSBC analyst revises AMD stock price amid ‘less competitive’ AI chip roadmap - Finbold,HSBC analyst revises AMD stock price amid ‘less competitive’ AI chip roadmap  Finbold,HSBC analyst revises AMD stock price amid ‘less competitive’ AI chip roadmap - Finbold. HSBC analyst revises AMD stock price amid ‘less competitive’ AI chip roadmap  Finbold,AI,-0.999964,negative,2025-01-08 08:00:00
HSBC,HSBC,"HSBC double downgrades AMD, says chipmaker will fall due to strong AI competition - CNBC","HSBC double downgrades AMD, says chipmaker will fall due to strong AI competition  CNBC","HSBC double downgrades AMD, says chipmaker will fall due to strong AI competition - CNBC. HSBC double downgrades AMD, says chipmaker will fall due to strong AI competition  CNBC",AI,-0.5767318,negative,2025-01-08 08:00:00
HSBC,HSBC,AMD Stock Slumps After Double Downgrade by HSBC on AI Revenue Concerns - Investopedia,AMD Stock Slumps After Double Downgrade by HSBC on AI Revenue Concerns  Investopedia,AMD Stock Slumps After Double Downgrade by HSBC on AI Revenue Concerns - Investopedia. AMD Stock Slumps After Double Downgrade by HSBC on AI Revenue Concerns  Investopedia,AI,0.99996984,positive,2025-01-08 08:00:00
HSBC,HSBC,AMD stock down as HSBC cuts rating on less competitive AI roadmap - Investing.com Nigeria,AMD stock down as HSBC cuts rating on less competitive AI roadmap  Investing.com Nigeria,AMD stock down as HSBC cuts rating on less competitive AI roadmap - Investing.com Nigeria. AMD stock down as HSBC cuts rating on less competitive AI roadmap  Investing.com Nigeria,AI,0.9999058,positive,2025-01-08 08:00:00
HSBC,HSBC,"HSBC reduces AMD shares rating, highlighting challenges in AI GPU market and competition - Investing.com","HSBC reduces AMD shares rating, highlighting challenges in AI GPU market and competition  Investing.com","HSBC reduces AMD shares rating, highlighting challenges in AI GPU market and competition - Investing.com. HSBC reduces AMD shares rating, highlighting challenges in AI GPU market and competition  Investing.com",AI,0.99987376,positive,2025-01-08 08:00:00
HSBC,HSBC,AMD Faces AI Roadblocks: HSBC Slashes Price Target by Nearly 50% - GuruFocus,AMD Faces AI Roadblocks: HSBC Slashes Price Target by Nearly 50%  GuruFocus,AMD Faces AI Roadblocks: HSBC Slashes Price Target by Nearly 50% - GuruFocus. AMD Faces AI Roadblocks: HSBC Slashes Price Target by Nearly 50%  GuruFocus,AI,-0.9949372,negative,2025-01-08 08:00:00
HSBC,HSBC,AMD’s AI Ambitions Downshifted: HSBC Slashes Price Target - Wall Street Pit,AMD’s AI Ambitions Downshifted: HSBC Slashes Price Target  Wall Street Pit,AMD’s AI Ambitions Downshifted: HSBC Slashes Price Target - Wall Street Pit. AMD’s AI Ambitions Downshifted: HSBC Slashes Price Target  Wall Street Pit,AI,-0.99999595,negative,2025-01-08 08:00:00
HSBC,HSBC,AMD stock down as HSBC cuts rating on less competitive AI roadmap - Investing.com,AMD stock down as HSBC cuts rating on less competitive AI roadmap  Investing.com,AMD stock down as HSBC cuts rating on less competitive AI roadmap - Investing.com. AMD stock down as HSBC cuts rating on less competitive AI roadmap  Investing.com,AI,0.9999651,positive,2025-01-08 08:00:00
HSBC,HSBC,HSBC and AI - HSBC,HSBC and AI  HSBC,HSBC and AI - HSBC. HSBC and AI  HSBC,AI,-0.9999572,negative,2024-12-16 21:05:33
HSBC,HSBC,HSBC Initiates Coverage on Broadcom Inc. (AVGO) with ‘Hold’ Rating Amid Rising AI Revenues and High Valuation - Yahoo Finance,HSBC Initiates Coverage on Broadcom Inc. (AVGO) with ‘Hold’ Rating Amid Rising AI Revenues and High Valuation  Yahoo Finance,HSBC Initiates Coverage on Broadcom Inc. (AVGO) with ‘Hold’ Rating Amid Rising AI Revenues and High Valuation - Yahoo Finance. HSBC Initiates Coverage on Broadcom Inc. (AVGO) with ‘Hold’ Rating Amid Rising AI Revenues and High Valuation  Yahoo Finance,AI,-0.9989436,negative,2024-12-05 08:00:00
HSBC,HSBC,"Canara HSBC Life Insurance launches OmniGen AI, an industry first Generative AI solution to Optimize Risk Evaluation in Underwriting - Business Standard","Canara HSBC Life Insurance launches OmniGen AI, an industry first Generative AI solution to Optimize Risk Evaluation in Underwriting  Business Standard","Canara HSBC Life Insurance launches OmniGen AI, an industry first Generative AI solution to Optimize Risk Evaluation in Underwriting - Business Standard. Canara HSBC Life Insurance launches OmniGen AI, an industry first Generative AI solution to Optimize Risk Evaluation in Underwriting  Business Standard",AI,-0.9247993,negative,2024-11-25 08:00:00
HSBC,HSBC,Singapore investors can now trade depository receipts of 5 Hong Kong blue chips on SGX - The Straits Times,Singapore investors can now trade depository receipts of 5 Hong Kong blue chips on SGX  The Straits Times,Singapore investors can now trade depository receipts of 5 Hong Kong blue chips on SGX - The Straits Times. Singapore investors can now trade depository receipts of 5 Hong Kong blue chips on SGX  The Straits Times,AI,-0.9999981,negative,2024-10-30 07:00:00
HSBC,HSBC,VNET gets vote of confidence amid deepening AI focus - Bamboo Works,VNET gets vote of confidence amid deepening AI focus  Bamboo Works,VNET gets vote of confidence amid deepening AI focus - Bamboo Works. VNET gets vote of confidence amid deepening AI focus  Bamboo Works,AI,0.4999089,neutral,2024-10-16 07:00:00
HSBC,HSBC,HSBC exec says there's a lot of AI 'success theater' happening in finance - CNBC,HSBC exec says there's a lot of AI 'success theater' happening in finance  CNBC,HSBC exec says there's a lot of AI 'success theater' happening in finance - CNBC. HSBC exec says there's a lot of AI 'success theater' happening in finance  CNBC,AI,0.999984,neutral,2024-10-09 07:00:00
HSBC,HSBC,HSBC says buy this data center stock as AI drives growth - CNBC,HSBC says buy this data center stock as AI drives growth  CNBC,HSBC says buy this data center stock as AI drives growth - CNBC. HSBC says buy this data center stock as AI drives growth  CNBC,AI,0.98345447,neutral,2024-10-04 07:00:00
HSBC,HSBC,"HSBC raises NVIDIA stock price target, holds buy on strong AI demand - Investing.com","HSBC raises NVIDIA stock price target, holds buy on strong AI demand  Investing.com","HSBC raises NVIDIA stock price target, holds buy on strong AI demand - Investing.com. HSBC raises NVIDIA stock price target, holds buy on strong AI demand  Investing.com",AI,0.99999833,neutral,2024-08-21 07:00:00
HSBC,HSBC,Nasdaq 100 Is in Correction Territory With AI Darlings Sinking - Bloomberg.com,Nasdaq 100 Is in Correction Territory With AI Darlings Sinking  Bloomberg.com,Nasdaq 100 Is in Correction Territory With AI Darlings Sinking - Bloomberg.com. Nasdaq 100 Is in Correction Territory With AI Darlings Sinking  Bloomberg.com,AI,-0.9999926,negative,2024-08-02 07:00:00
HSBC,HSBC,"AMD Has a New Bull, and Is Coming for Nvidia’s AI Lunch - Barron's","AMD Has a New Bull, and Is Coming for Nvidia’s AI Lunch  Barron's","AMD Has a New Bull, and Is Coming for Nvidia’s AI Lunch - Barron's. AMD Has a New Bull, and Is Coming for Nvidia’s AI Lunch  Barron's",AI,-0.9998211,negative,2024-04-16 07:00:00
HSBC,HSBC,Another AI sector for investors – Asean and India - The Straits Times,Another AI sector for investors – Asean and India  The Straits Times,Another AI sector for investors – Asean and India - The Straits Times. Another AI sector for investors – Asean and India  The Straits Times,AI,-0.99999785,negative,2024-02-25 08:00:00
HSBC,HSBC,HSBC pioneers Quantum protection for AI-powered FX trading - HSBC,HSBC pioneers Quantum protection for AI-powered FX trading  HSBC,HSBC pioneers Quantum protection for AI-powered FX trading - HSBC. HSBC pioneers Quantum protection for AI-powered FX trading  HSBC,AI,0.9995801,neutral,2023-12-06 08:00:00
HSBC,HSBC,HSBC’s head of artificial intelligence for markets departs for JP Morgan - The TRADE,HSBC’s head of artificial intelligence for markets departs for JP Morgan  The TRADE,HSBC’s head of artificial intelligence for markets departs for JP Morgan - The TRADE. HSBC’s head of artificial intelligence for markets departs for JP Morgan  The TRADE,AI,-0.99999285,negative,2023-07-04 07:00:00
HSBC,HSBC,"HSBC Launches AI-Powered Index Tracking Companies with ""ESG Momentum"" - ESG Today","HSBC Launches AI-Powered Index Tracking Companies with ""ESG Momentum""  ESG Today","HSBC Launches AI-Powered Index Tracking Companies with ""ESG Momentum"" - ESG Today. HSBC Launches AI-Powered Index Tracking Companies with ""ESG Momentum""  ESG Today",AI,-0.99992394,negative,2023-05-31 07:00:00
HSBC,HSBC,HSBC launches structured product linked to AI-driven multi-asset index - Fund Selector Asia,HSBC launches structured product linked to AI-driven multi-asset index  Fund Selector Asia,HSBC launches structured product linked to AI-driven multi-asset index - Fund Selector Asia. HSBC launches structured product linked to AI-driven multi-asset index  Fund Selector Asia,AI,-0.9998745,negative,2023-03-30 07:00:00
HSBC,HSBC,HSBC Launches AI-Driven Investment Strategy - Wealth Briefing Asia,HSBC Launches AI-Driven Investment Strategy  Wealth Briefing Asia,HSBC Launches AI-Driven Investment Strategy - Wealth Briefing Asia. HSBC Launches AI-Driven Investment Strategy  Wealth Briefing Asia,AI,-0.9991333,negative,2023-03-30 07:00:00
HSBC,HSBC,HSBC Launches AI-Driven Investment Strategy - WealthBriefing,HSBC Launches AI-Driven Investment Strategy  WealthBriefing,HSBC Launches AI-Driven Investment Strategy - WealthBriefing. HSBC Launches AI-Driven Investment Strategy  WealthBriefing,AI,-0.9988188,negative,2023-03-30 07:00:00
HSBC,HSBC,HSBC Launches AI Powered Multi Asset Index (AIMAX) With EquBot - FinanceFeeds,HSBC Launches AI Powered Multi Asset Index (AIMAX) With EquBot  FinanceFeeds,HSBC Launches AI Powered Multi Asset Index (AIMAX) With EquBot - FinanceFeeds. HSBC Launches AI Powered Multi Asset Index (AIMAX) With EquBot  FinanceFeeds,AI,-0.9998801,negative,2021-04-23 07:00:00
HSBC,HSBC,"IBM Watson powers AiPEX, the first fully AI-driven index - IBM","IBM Watson powers AiPEX, the first fully AI-driven index  IBM","IBM Watson powers AiPEX, the first fully AI-driven index - IBM. IBM Watson powers AiPEX, the first fully AI-driven index  IBM",AI,-0.9694734,negative,2020-09-14 07:00:00
HSBC,HSBC,HSBC launches AI-powered equity index products in Malaysia - Digital News Asia,HSBC launches AI-powered equity index products in Malaysia  Digital News Asia,HSBC launches AI-powered equity index products in Malaysia - Digital News Asia. HSBC launches AI-powered equity index products in Malaysia  Digital News Asia,AI,-0.99995244,negative,2020-09-10 07:00:00
