ticker,company_name,title,summary,text,search_term,sentiment_score,sentiment_label,published
MAHMF,Mahindra,"Tech Mahindra and CrateDB Partner to Provide Agentic AI Solutions for Automotive, Manufacturing and Smart Factories - CXOToday.com","Tech Mahindra and CrateDB Partner to Provide Agentic AI Solutions for Automotive, Manufacturing and Smart Factories  CXOToday.com","Tech Mahindra and CrateDB Partner to Provide Agentic AI Solutions for Automotive, Manufacturing and Smart Factories - CXOToday.com. Tech Mahindra and CrateDB Partner to Provide Agentic AI Solutions for Automotive, Manufacturing and Smart Factories  CXOToday.com",AI,-0.9989704,negative,2025-04-01 07:00:00
MAHMF,Mahindra,"Tech M sees strong market in APAC, robust demand for AI-driven solutions - Industry News - The Financial Express","Tech M sees strong market in APAC, robust demand for AI-driven solutions - Industry News  The Financial Express","Tech M sees strong market in APAC, robust demand for AI-driven solutions - Industry News - The Financial Express. Tech M sees strong market in APAC, robust demand for AI-driven solutions - Industry News  The Financial Express",AI,1.0,neutral,2025-04-01 07:00:00
MAHMF,Mahindra,"Tech Mahindra Partners with The Open University to Advance AI-driven Innovation, Entrepreneurship and Skills Development - Business News Wales","Tech Mahindra Partners with The Open University to Advance AI-driven Innovation, Entrepreneurship and Skills Development  Business News Wales","Tech Mahindra Partners with The Open University to Advance AI-driven Innovation, Entrepreneurship and Skills Development - Business News Wales. Tech Mahindra Partners with The Open University to Advance AI-driven Innovation, Entrepreneurship and Skills Development  Business News Wales",AI,-0.981712,negative,2025-03-24 07:00:00
MAHMF,Mahindra,Tech majors forge AI tie-ups with Nvidia - The Financial Express,Tech majors forge AI tie-ups with Nvidia  The Financial Express,Tech majors forge AI tie-ups with Nvidia - The Financial Express. Tech majors forge AI tie-ups with Nvidia  The Financial Express,AI,-0.99983394,negative,2025-03-19 07:00:00
MAHMF,Mahindra,Tech Mahindra extends partnership with Google Cloud to boost AI adoption - Business Standard,Tech Mahindra extends partnership with Google Cloud to boost AI adoption  Business Standard,Tech Mahindra extends partnership with Google Cloud to boost AI adoption - Business Standard. Tech Mahindra extends partnership with Google Cloud to boost AI adoption  Business Standard,AI,0.9930219,neutral,2025-03-18 07:00:00
MAHMF,Mahindra,Tech Mahindra expands partnership with Google Cloud to scale enterprise-wide AI adoption - ZAWYA,Tech Mahindra expands partnership with Google Cloud to scale enterprise-wide AI adoption  ZAWYA,Tech Mahindra expands partnership with Google Cloud to scale enterprise-wide AI adoption - ZAWYA. Tech Mahindra expands partnership with Google Cloud to scale enterprise-wide AI adoption  ZAWYA,AI,-0.6839844,negative,2025-03-18 07:00:00
MAHMF,Mahindra,"Oracle UK Investment, ServiceNow AI Agents, Google AI Chip, Tech Mahindra–Google Cloud Partnership - TelecomTalk","Oracle UK Investment, ServiceNow AI Agents, Google AI Chip, Tech Mahindra–Google Cloud Partnership  TelecomTalk","Oracle UK Investment, ServiceNow AI Agents, Google AI Chip, Tech Mahindra–Google Cloud Partnership - TelecomTalk. Oracle UK Investment, ServiceNow AI Agents, Google AI Chip, Tech Mahindra–Google Cloud Partnership  TelecomTalk",AI,-0.9999641,negative,2025-03-18 07:00:00
MAHMF,Mahindra,Tech Mahindra Unveils New LLM to Boost AI in Telecom Operations - Equitypandit,Tech Mahindra Unveils New LLM to Boost AI in Telecom Operations  Equitypandit,Tech Mahindra Unveils New LLM to Boost AI in Telecom Operations - Equitypandit. Tech Mahindra Unveils New LLM to Boost AI in Telecom Operations  Equitypandit,AI,-0.999841,negative,2025-03-04 08:00:00
MAHMF,Mahindra,AI fever in power stocks moves from nuclear to plain natural gas | Stock Market News - Mint,AI fever in power stocks moves from nuclear to plain natural gas | Stock Market News  Mint,AI fever in power stocks moves from nuclear to plain natural gas | Stock Market News - Mint. AI fever in power stocks moves from nuclear to plain natural gas | Stock Market News  Mint,AI,-0.99996185,negative,2025-03-01 08:00:00
MAHMF,Mahindra,Tech Mahindra Joins the AI-RAN Alliance to Advance 5G and AI-Powered Networks of the Future - Yahoo,Tech Mahindra Joins the AI-RAN Alliance to Advance 5G and AI-Powered Networks of the Future  Yahoo,Tech Mahindra Joins the AI-RAN Alliance to Advance 5G and AI-Powered Networks of the Future - Yahoo. Tech Mahindra Joins the AI-RAN Alliance to Advance 5G and AI-Powered Networks of the Future  Yahoo,AI,-0.8017434,negative,2025-02-25 08:30:00
MAHMF,Mahindra,Tech Mahindra joins the AI-RAN Alliance - BusinessLine,Tech Mahindra joins the AI-RAN Alliance  BusinessLine,Tech Mahindra joins the AI-RAN Alliance - BusinessLine. Tech Mahindra joins the AI-RAN Alliance  BusinessLine,AI,-0.99859434,negative,2025-02-25 08:00:00
MAHMF,Mahindra,Anand Mahindra shares worrisome data: Humans make up only 38.5% of users online the rest is AI - Times of India,Anand Mahindra shares worrisome data: Humans make up only 38.5% of users online the rest is AI  Times of India,Anand Mahindra shares worrisome data: Humans make up only 38.5% of users online the rest is AI - Times of India. Anand Mahindra shares worrisome data: Humans make up only 38.5% of users online the rest is AI  Times of India,AI,-0.9999285,negative,2025-02-25 08:00:00
MAHMF,Mahindra,Mahindra Group stock jumps after it partners with Anduril Industries for AI based defence system - Trade Brains,Mahindra Group stock jumps after it partners with Anduril Industries for AI based defence system  Trade Brains,Mahindra Group stock jumps after it partners with Anduril Industries for AI based defence system - Trade Brains. Mahindra Group stock jumps after it partners with Anduril Industries for AI based defence system  Trade Brains,AI,-0.9999317,negative,2025-02-20 08:00:00
MAHMF,Mahindra,"Mahindra & Mahindra Says Mahindra Group, Anduril Partner To Develop Autonomous Maritime Systems, AI Counter-UAS Tech - marketscreener.com","Mahindra & Mahindra Says Mahindra Group, Anduril Partner To Develop Autonomous Maritime Systems, AI Counter-UAS Tech  marketscreener.com","Mahindra & Mahindra Says Mahindra Group, Anduril Partner To Develop Autonomous Maritime Systems, AI Counter-UAS Tech - marketscreener.com. Mahindra & Mahindra Says Mahindra Group, Anduril Partner To Develop Autonomous Maritime Systems, AI Counter-UAS Tech  marketscreener.com",AI,-0.9999367,negative,2025-02-19 08:00:00
MAHMF,Mahindra,Top 10 AI Stocks in India - Analytics Insight,Top 10 AI Stocks in India  Analytics Insight,Top 10 AI Stocks in India - Analytics Insight. Top 10 AI Stocks in India  Analytics Insight,AI,-0.999686,negative,2025-01-31 08:00:00
MAHMF,Mahindra,Indian IT's AI conundrum: What model to use—ready-to-build or build-from-scratch | Company Business News - Mint,Indian IT's AI conundrum: What model to use—ready-to-build or build-from-scratch | Company Business News  Mint,Indian IT's AI conundrum: What model to use—ready-to-build or build-from-scratch | Company Business News - Mint. Indian IT's AI conundrum: What model to use—ready-to-build or build-from-scratch | Company Business News  Mint,AI,-0.99999714,negative,2025-01-22 08:00:00
MAHMF,Mahindra,"Q3 Results Highlights: 50,000 employees certified in AI, focused on Agentic AI and education, says Wipro CEO - Moneycontrol","Q3 Results Highlights: 50,000 employees certified in AI, focused on Agentic AI and education, says Wipro CEO  Moneycontrol","Q3 Results Highlights: 50,000 employees certified in AI, focused on Agentic AI and education, says Wipro CEO - Moneycontrol. Q3 Results Highlights: 50,000 employees certified in AI, focused on Agentic AI and education, says Wipro CEO  Moneycontrol",AI,-0.9998473,negative,2025-01-17 08:00:00
MAHMF,Mahindra,Is now the time to invest in India’s AI stocks? - The Indian Express,Is now the time to invest in India’s AI stocks?  The Indian Express,Is now the time to invest in India’s AI stocks? - The Indian Express. Is now the time to invest in India’s AI stocks?  The Indian Express,AI,-0.9999975,negative,2025-01-16 08:00:00
MAHMF,Mahindra,"Tech Mahindra, ServiceNow collaborate to offer Gen AI management solutions - Business Standard","Tech Mahindra, ServiceNow collaborate to offer Gen AI management solutions  Business Standard","Tech Mahindra, ServiceNow collaborate to offer Gen AI management solutions - Business Standard. Tech Mahindra, ServiceNow collaborate to offer Gen AI management solutions  Business Standard",AI,-0.9991553,negative,2024-12-12 08:00:00
MAHMF,Mahindra,"Amazon.com, Inc. (AMZN): Tech Mahindra Partners with AWS to Develop AI-Driven Autonomous Networks Platform for CSPs - Yahoo Finance","Amazon.com, Inc. (AMZN): Tech Mahindra Partners with AWS to Develop AI-Driven Autonomous Networks Platform for CSPs  Yahoo Finance","Amazon.com, Inc. (AMZN): Tech Mahindra Partners with AWS to Develop AI-Driven Autonomous Networks Platform for CSPs - Yahoo Finance. Amazon.com, Inc. (AMZN): Tech Mahindra Partners with AWS to Develop AI-Driven Autonomous Networks Platform for CSPs  Yahoo Finance",AI,-0.9998005,negative,2024-11-28 08:00:00
MAHMF,Mahindra,AI stock in focus after Kotak Mahindra sold stake in the company - Trade Brains,AI stock in focus after Kotak Mahindra sold stake in the company  Trade Brains,AI stock in focus after Kotak Mahindra sold stake in the company - Trade Brains. AI stock in focus after Kotak Mahindra sold stake in the company  Trade Brains,AI,-0.9999974,negative,2024-11-28 08:00:00
MAHMF,Mahindra,Nvidia to supply AI processors to Indian companies including Reliance Industries - Business Today,Nvidia to supply AI processors to Indian companies including Reliance Industries  Business Today,Nvidia to supply AI processors to Indian companies including Reliance Industries - Business Today. Nvidia to supply AI processors to Indian companies including Reliance Industries  Business Today,AI,-0.99997795,negative,2024-10-25 07:00:00
MAHMF,Mahindra,"Tech Mahindra Announces AI Center of Excellence, Powered by NVIDIA AI Enterprise and Omniverse Platforms - WebWire","Tech Mahindra Announces AI Center of Excellence, Powered by NVIDIA AI Enterprise and Omniverse Platforms  WebWire","Tech Mahindra Announces AI Center of Excellence, Powered by NVIDIA AI Enterprise and Omniverse Platforms - WebWire. Tech Mahindra Announces AI Center of Excellence, Powered by NVIDIA AI Enterprise and Omniverse Platforms  WebWire",AI,0.97578955,neutral,2024-10-25 07:00:00
MAHMF,Mahindra,Top AI Stocks to Buy - Analytics Insight,Top AI Stocks to Buy  Analytics Insight,Top AI Stocks to Buy - Analytics Insight. Top AI Stocks to Buy  Analytics Insight,AI,0.91855973,neutral,2024-10-09 07:00:00
MAHMF,Mahindra,Mahindra Group Forms AI Division for Business Growth - Rediff MoneyWiz,Mahindra Group Forms AI Division for Business Growth  Rediff MoneyWiz,Mahindra Group Forms AI Division for Business Growth - Rediff MoneyWiz. Mahindra Group Forms AI Division for Business Growth  Rediff MoneyWiz,AI,-0.9995828,negative,2024-09-22 07:00:00
MAHMF,Mahindra,Mahindra Group launches dedicated AI division to boost business operations - NewsBytes,Mahindra Group launches dedicated AI division to boost business operations  NewsBytes,Mahindra Group launches dedicated AI division to boost business operations - NewsBytes. Mahindra Group launches dedicated AI division to boost business operations  NewsBytes,AI,-0.92100114,negative,2024-09-22 07:00:00
MAHMF,Mahindra,Tech Mahindra and Discai to Deliver AI-Powered Anti-Money Laundering Solution for Global Financial Institutions - CXOToday.com,Tech Mahindra and Discai to Deliver AI-Powered Anti-Money Laundering Solution for Global Financial Institutions  CXOToday.com,Tech Mahindra and Discai to Deliver AI-Powered Anti-Money Laundering Solution for Global Financial Institutions - CXOToday.com. Tech Mahindra and Discai to Deliver AI-Powered Anti-Money Laundering Solution for Global Financial Institutions  CXOToday.com,AI,-0.9570396,negative,2024-09-12 07:00:00
MAHMF,Mahindra,Tech Mahindra and Google Cloud Partner to Boost Generative AI Adoption and Lead Digital Transformation for Mahindra Group Entities - Tech Mahindra,Tech Mahindra and Google Cloud Partner to Boost Generative AI Adoption and Lead Digital Transformation for Mahindra Group Entities  Tech Mahindra,Tech Mahindra and Google Cloud Partner to Boost Generative AI Adoption and Lead Digital Transformation for Mahindra Group Entities - Tech Mahindra. Tech Mahindra and Google Cloud Partner to Boost Generative AI Adoption and Lead Digital Transformation for Mahindra Group Entities  Tech Mahindra,AI,0.9993469,neutral,2024-08-22 07:00:00
MAHMF,Mahindra,"Tech Mahindra, LivePerson To Power AI-Driven CX in Finance, Healthcare, Life Sciences - NDTV Profit","Tech Mahindra, LivePerson To Power AI-Driven CX in Finance, Healthcare, Life Sciences  NDTV Profit","Tech Mahindra, LivePerson To Power AI-Driven CX in Finance, Healthcare, Life Sciences - NDTV Profit. Tech Mahindra, LivePerson To Power AI-Driven CX in Finance, Healthcare, Life Sciences  NDTV Profit",AI,-0.9980925,negative,2024-08-14 07:00:00
MAHMF,Mahindra,Tech Mahindra and Horizon3.ai Partner to Enhance AI-based Cyber Resilience for Global Customers - Business Wire,Tech Mahindra and Horizon3.ai Partner to Enhance AI-based Cyber Resilience for Global Customers  Business Wire,Tech Mahindra and Horizon3.ai Partner to Enhance AI-based Cyber Resilience for Global Customers - Business Wire. Tech Mahindra and Horizon3.ai Partner to Enhance AI-based Cyber Resilience for Global Customers  Business Wire,AI,0.99983275,neutral,2024-08-06 07:00:00
MAHMF,Mahindra,"Tech Mahindra, Horizon3.ai come together to provide AI-based cybersecurity - Business Standard","Tech Mahindra, Horizon3.ai come together to provide AI-based cybersecurity  Business Standard","Tech Mahindra, Horizon3.ai come together to provide AI-based cybersecurity - Business Standard. Tech Mahindra, Horizon3.ai come together to provide AI-based cybersecurity  Business Standard",AI,-0.99990034,negative,2024-08-06 07:00:00
MAHMF,Mahindra,"Microsoft Cloud, AI demand up: Cues for TCS, Infosys, HCL Tech, Wipro, TechM - Business Today","Microsoft Cloud, AI demand up: Cues for TCS, Infosys, HCL Tech, Wipro, TechM  Business Today","Microsoft Cloud, AI demand up: Cues for TCS, Infosys, HCL Tech, Wipro, TechM - Business Today. Microsoft Cloud, AI demand up: Cues for TCS, Infosys, HCL Tech, Wipro, TechM  Business Today",AI,-0.9535023,negative,2024-07-31 07:00:00
MAHMF,Mahindra,"Tata Comms gets first batch of Nvidia AI chips, begins internal deployment: MD & CEO Lakshminarayanan | Company Business News - Mint","Tata Comms gets first batch of Nvidia AI chips, begins internal deployment: MD & CEO Lakshminarayanan | Company Business News  Mint","Tata Comms gets first batch of Nvidia AI chips, begins internal deployment: MD & CEO Lakshminarayanan | Company Business News - Mint. Tata Comms gets first batch of Nvidia AI chips, begins internal deployment: MD & CEO Lakshminarayanan | Company Business News  Mint",AI,-0.99997485,negative,2024-07-22 07:00:00
MAHMF,Mahindra,Tech Mahindra Collaborates with Microsoft to Modernize Workplace Experiences with Generative AI - Tech Mahindra,Tech Mahindra Collaborates with Microsoft to Modernize Workplace Experiences with Generative AI  Tech Mahindra,Tech Mahindra Collaborates with Microsoft to Modernize Workplace Experiences with Generative AI - Tech Mahindra. Tech Mahindra Collaborates with Microsoft to Modernize Workplace Experiences with Generative AI  Tech Mahindra,AI,-0.99260026,negative,2024-07-09 07:00:00
MAHMF,Mahindra,Mahindra deploying multiple AI tools across manufacturing plants as it lines up mega investment - ET Manufacturing,Mahindra deploying multiple AI tools across manufacturing plants as it lines up mega investment  ET Manufacturing,Mahindra deploying multiple AI tools across manufacturing plants as it lines up mega investment - ET Manufacturing. Mahindra deploying multiple AI tools across manufacturing plants as it lines up mega investment  ET Manufacturing,AI,-0.99999416,negative,2024-07-04 07:00:00
MAHMF,Mahindra,AI to usher in era of technological prowess: Tech Mahindra Chairman - Business Standard,AI to usher in era of technological prowess: Tech Mahindra Chairman  Business Standard,AI to usher in era of technological prowess: Tech Mahindra Chairman - Business Standard. AI to usher in era of technological prowess: Tech Mahindra Chairman  Business Standard,AI,-0.9998826,negative,2024-06-28 07:00:00
MAHMF,Mahindra,Zapata AI Partners with Tech Mahindra to Transform Network - GlobeNewswire,Zapata AI Partners with Tech Mahindra to Transform Network  GlobeNewswire,Zapata AI Partners with Tech Mahindra to Transform Network - GlobeNewswire. Zapata AI Partners with Tech Mahindra to Transform Network  GlobeNewswire,AI,-0.9999906,negative,2024-05-14 07:00:00
MAHMF,Mahindra,Tech Mahindra and Cisco to deliver AI-powered firewall modernisation solution for global customers - Mahindra,Tech Mahindra and Cisco to deliver AI-powered firewall modernisation solution for global customers  Mahindra,Tech Mahindra and Cisco to deliver AI-powered firewall modernisation solution for global customers - Mahindra. Tech Mahindra and Cisco to deliver AI-powered firewall modernisation solution for global customers  Mahindra,AI,-0.91984636,negative,2024-05-06 07:00:00
MAHMF,Mahindra,Former Tech Mahindra India business head quits to set up AI startup - Times of India,Former Tech Mahindra India business head quits to set up AI startup  Times of India,Former Tech Mahindra India business head quits to set up AI startup - Times of India. Former Tech Mahindra India business head quits to set up AI startup  Times of India,AI,-0.9999293,negative,2024-04-28 07:00:00
MAHMF,Mahindra,"InterGlobe's Rahul Bhatia, Tech Mahindra ex-CEO CP Gurnani launch AI firm AIonOS - Moneycontrol","InterGlobe's Rahul Bhatia, Tech Mahindra ex-CEO CP Gurnani launch AI firm AIonOS  Moneycontrol","InterGlobe's Rahul Bhatia, Tech Mahindra ex-CEO CP Gurnani launch AI firm AIonOS - Moneycontrol. InterGlobe's Rahul Bhatia, Tech Mahindra ex-CEO CP Gurnani launch AI firm AIonOS  Moneycontrol",AI,-0.9999956,negative,2024-04-23 07:00:00
MAHMF,Mahindra,Subex announces deal with leading telecom operator in APAC region for AI-driven business - Upstox,Subex announces deal with leading telecom operator in APAC region for AI-driven business  Upstox,Subex announces deal with leading telecom operator in APAC region for AI-driven business - Upstox. Subex announces deal with leading telecom operator in APAC region for AI-driven business  Upstox,AI,-0.8495029,negative,2024-04-12 07:00:00
MAHMF,Mahindra,"Tech Mahindra, Pegatron ink MoU to develop AI-enabled private 5G networks - Business Standard","Tech Mahindra, Pegatron ink MoU to develop AI-enabled private 5G networks  Business Standard","Tech Mahindra, Pegatron ink MoU to develop AI-enabled private 5G networks - Business Standard. Tech Mahindra, Pegatron ink MoU to develop AI-enabled private 5G networks  Business Standard",AI,-0.99888784,negative,2024-02-28 08:00:00
MAHMF,Mahindra,"Anand Mahindra’s message for new Tech Mahindra CEO, CP Gurnani on 42-year career, Ghazal Alagh on woman judge facing sexual harassment, Vijay Shekhar Sharma on fake Amul AI product: India Inc on X - Business Today","Anand Mahindra’s message for new Tech Mahindra CEO, CP Gurnani on 42-year career, Ghazal Alagh on woman judge facing sexual harassment, Vijay Shekhar Sharma on fake Amul AI product: India Inc on X  Business Today","Anand Mahindra’s message for new Tech Mahindra CEO, CP Gurnani on 42-year career, Ghazal Alagh on woman judge facing sexual harassment, Vijay Shekhar Sharma on fake Amul AI product: India Inc on X - Business Today. Anand Mahindra’s message for new Tech Mahindra CEO, CP Gurnani on 42-year career, Ghazal Alagh on woman judge facing sexual harassment, Vijay Shekhar Sharma on fake Amul AI product: India Inc on X  Business Today",AI,-0.99998724,negative,2023-12-21 08:00:00
MAHMF,Mahindra,M&M taps into AI to develop auto safety features - The Financial Express,M&M taps into AI to develop auto safety features  The Financial Express,M&M taps into AI to develop auto safety features - The Financial Express. M&M taps into AI to develop auto safety features  The Financial Express,AI,-0.9999739,negative,2023-11-21 08:00:00
MAHMF,Mahindra,Anand Mahindra shares AI-made video showing how ‘technology of war has evolved’ - The Indian Express,Anand Mahindra shares AI-made video showing how ‘technology of war has evolved’  The Indian Express,Anand Mahindra shares AI-made video showing how ‘technology of war has evolved’ - The Indian Express. Anand Mahindra shares AI-made video showing how ‘technology of war has evolved’  The Indian Express,AI,-0.99989605,negative,2023-10-12 07:00:00
MAHMF,Mahindra,"BANKER OF THE YEAR: Dipak Gupta, MD, Kotak Mahindra Bank | An ‘AI’ for hi-tech banking - The Financial Express","BANKER OF THE YEAR: Dipak Gupta, MD, Kotak Mahindra Bank | An ‘AI’ for hi-tech banking  The Financial Express","BANKER OF THE YEAR: Dipak Gupta, MD, Kotak Mahindra Bank | An ‘AI’ for hi-tech banking - The Financial Express. BANKER OF THE YEAR: Dipak Gupta, MD, Kotak Mahindra Bank | An ‘AI’ for hi-tech banking  The Financial Express",AI,-0.9999962,negative,2023-10-11 07:00:00
MAHMF,Mahindra,"RIL Chairman Mukesh Ambani's Independence Day celebration with family, Anand Mahindra shares army jawan's video, CP Gurnani on AI, Anupam Mittal shares Shaadi.com's campaign: India Inc on X (Twitter) - Business Today","RIL Chairman Mukesh Ambani's Independence Day celebration with family, Anand Mahindra shares army jawan's video, CP Gurnani on AI, Anupam Mittal shares Shaadi.com's campaign: India Inc on X (Twitter)  Business Today","RIL Chairman Mukesh Ambani's Independence Day celebration with family, Anand Mahindra shares army jawan's video, CP Gurnani on AI, Anupam Mittal shares Shaadi.com's campaign: India Inc on X (Twitter) - Business Today. RIL Chairman Mukesh Ambani's Independence Day celebration with family, Anand Mahindra shares army jawan's video, CP Gurnani on AI, Anupam Mittal shares Shaadi.com's campaign: India Inc on X (Twitter)  Business Today",AI,-0.99997675,negative,2023-08-16 07:00:00
MAHMF,Mahindra,"Mahindra bets on digitalisation, AI and ML to futureproof itself - The Financial Express","Mahindra bets on digitalisation, AI and ML to futureproof itself  The Financial Express","Mahindra bets on digitalisation, AI and ML to futureproof itself - The Financial Express. Mahindra bets on digitalisation, AI and ML to futureproof itself  The Financial Express",AI,-0.99999654,negative,2023-07-05 07:00:00
MAHMF,Mahindra,"Anand Mahindra shares a fake AI-generated image of himself, says the future will be scary - India Today","Anand Mahindra shares a fake AI-generated image of himself, says the future will be scary  India Today","Anand Mahindra shares a fake AI-generated image of himself, says the future will be scary - India Today. Anand Mahindra shares a fake AI-generated image of himself, says the future will be scary  India Today",AI,-0.976828,negative,2023-06-15 07:00:00
MAHMF,Mahindra,"Sam Altman says 'hopeless' for India to train ChatGPT-like AI, Tech Mahindra CEO says 'challenge accepted' - Business Today","Sam Altman says 'hopeless' for India to train ChatGPT-like AI, Tech Mahindra CEO says 'challenge accepted'  Business Today","Sam Altman says 'hopeless' for India to train ChatGPT-like AI, Tech Mahindra CEO says 'challenge accepted' - Business Today. Sam Altman says 'hopeless' for India to train ChatGPT-like AI, Tech Mahindra CEO says 'challenge accepted'  Business Today",AI,-0.94703823,negative,2023-06-10 07:00:00
MAHMF,Mahindra,Anand Mahindra Shares AI-Generated Video Of A Girl Ageing From 5 To 95 - ABP Live English,Anand Mahindra Shares AI-Generated Video Of A Girl Ageing From 5 To 95  ABP Live English,Anand Mahindra Shares AI-Generated Video Of A Girl Ageing From 5 To 95 - ABP Live English. Anand Mahindra Shares AI-Generated Video Of A Girl Ageing From 5 To 95  ABP Live English,AI,-0.9999757,negative,2023-04-26 07:00:00
MAHMF,Mahindra,‘Hauntingly beautiful’ Anand Mahindra shares AI video of a girl ageing - KalingaTV,‘Hauntingly beautiful’ Anand Mahindra shares AI video of a girl ageing  KalingaTV,‘Hauntingly beautiful’ Anand Mahindra shares AI video of a girl ageing - KalingaTV. ‘Hauntingly beautiful’ Anand Mahindra shares AI video of a girl ageing  KalingaTV,AI,-0.9999957,negative,2023-04-26 07:00:00
MAHMF,Mahindra,Watch: Anand Mahindra shares 'hauntingly beautiful' AI-generated video of a little girl ageing - Business Today,Watch: Anand Mahindra shares 'hauntingly beautiful' AI-generated video of a little girl ageing  Business Today,Watch: Anand Mahindra shares 'hauntingly beautiful' AI-generated video of a little girl ageing - Business Today. Watch: Anand Mahindra shares 'hauntingly beautiful' AI-generated video of a little girl ageing  Business Today,AI,-0.99998295,negative,2023-04-26 07:00:00
MAHMF,Mahindra,CEO Anand Mahindra shares a breathtaking AI-generated portrait of a girl ageing from 5 to 95 - Times of India,CEO Anand Mahindra shares a breathtaking AI-generated portrait of a girl ageing from 5 to 95  Times of India,CEO Anand Mahindra shares a breathtaking AI-generated portrait of a girl ageing from 5 to 95 - Times of India. CEO Anand Mahindra shares a breathtaking AI-generated portrait of a girl ageing from 5 to 95  Times of India,AI,-0.9999813,negative,2023-04-26 07:00:00
