ticker,company_name,title,summary,text,search_term,sentiment_score,sentiment_label,published
MAHMF,Mahindra,Anand Mahindra shares AI-generated video of little girl gracefully ageing. We agree with his caption - India Today,Anand Mahindra shares AI-generated video of little girl gracefully ageing. We agree with his caption  India Today,Anand Mahindra shares AI-generated video of little girl gracefully ageing. We agree with his caption - India Today. Anand Mahindra shares AI-generated video of little girl gracefully ageing. We agree with his caption  India Today,AI,-0.99999905,negative,2023-04-25 07:00:00
MAHMF,Mahindra,Anand Mahindra shares AI-generated video of girl transforming into elderly woman; Watch - news24online.com,Anand Mahindra shares AI-generated video of girl transforming into elderly woman; Watch  news24online.com,Anand Mahindra shares AI-generated video of girl transforming into elderly woman; Watch - news24online.com. Anand Mahindra shares AI-generated video of girl transforming into elderly woman; Watch  news24online.com,AI,-0.9999558,negative,2023-04-25 07:00:00
MAHMF,Mahindra,"WATCH: Anand Mahindra shares AI-created video of a girl aging, calls it hauntingly beautiful - Free Press Journal","WATCH: Anand Mahindra shares AI-created video of a girl aging, calls it hauntingly beautiful  Free Press Journal","WATCH: Anand Mahindra shares AI-created video of a girl aging, calls it hauntingly beautiful - Free Press Journal. WATCH: Anand Mahindra shares AI-created video of a girl aging, calls it hauntingly beautiful  Free Press Journal",AI,-0.9999932,negative,2023-04-25 07:00:00
MAHMF,Mahindra,Anand Mahindra shares AI-created video of a girl aging. Watch - Hindustan Times,Anand Mahindra shares AI-created video of a girl aging. Watch  Hindustan Times,Anand Mahindra shares AI-created video of a girl aging. Watch - Hindustan Times. Anand Mahindra shares AI-created video of a girl aging. Watch  Hindustan Times,AI,-0.99999106,negative,2023-04-25 07:00:00
MAHMF,Mahindra,''Hauntingly Beautiful'': Anand Mahindra Shares AI Video That Shows How A Girl Ages - NDTV,''Hauntingly Beautiful'': Anand Mahindra Shares AI Video That Shows How A Girl Ages  NDTV,''Hauntingly Beautiful'': Anand Mahindra Shares AI Video That Shows How A Girl Ages - NDTV. ''Hauntingly Beautiful'': Anand Mahindra Shares AI Video That Shows How A Girl Ages  NDTV,AI,-0.9999821,negative,2023-04-25 07:00:00
MAHMF,Mahindra,Best Robotics & AI Stocks In India 2023 – Complete List of Stocks - Trade Brains,Best Robotics & AI Stocks In India 2023 – Complete List of Stocks  Trade Brains,Best Robotics & AI Stocks In India 2023 – Complete List of Stocks - Trade Brains. Best Robotics & AI Stocks In India 2023 – Complete List of Stocks  Trade Brains,AI,-0.9999813,negative,2023-04-01 07:00:00
MAHMF,Mahindra,"'AI will not take away jobs, it will create jobs': Tech Mahindra CEO CP Gurnani - Business Today","'AI will not take away jobs, it will create jobs': Tech Mahindra CEO CP Gurnani  Business Today","'AI will not take away jobs, it will create jobs': Tech Mahindra CEO CP Gurnani - Business Today. 'AI will not take away jobs, it will create jobs': Tech Mahindra CEO CP Gurnani  Business Today",AI,-0.99998915,negative,2023-03-03 08:00:00
MAHMF,Mahindra,"Anand Mahindra Shares AI-Generated Deep Fake Video To Alert Users, Internet Concerned - NDTV","Anand Mahindra Shares AI-Generated Deep Fake Video To Alert Users, Internet Concerned  NDTV","Anand Mahindra Shares AI-Generated Deep Fake Video To Alert Users, Internet Concerned - NDTV. Anand Mahindra Shares AI-Generated Deep Fake Video To Alert Users, Internet Concerned  NDTV",AI,-0.9999627,negative,2023-01-22 08:00:00
MAHMF,Mahindra,"Tech Mahindra acquires 80% stake in Australian AI firm, Geomatic.AI - Business Standard","Tech Mahindra acquires 80% stake in Australian AI firm, Geomatic.AI  Business Standard","Tech Mahindra acquires 80% stake in Australian AI firm, Geomatic.AI - Business Standard. Tech Mahindra acquires 80% stake in Australian AI firm, Geomatic.AI  Business Standard",AI,-0.99991286,negative,2022-02-16 08:00:00
