ticker,company_name,title,summary,text,search_term,sentiment_score,sentiment_label,published
MU,Micron,Micron (MU) and Synopsys (SNPS) Stand Out in AI Investment Strategy - GuruFocus,Micron (MU) and Synopsys (SNPS) Stand Out in AI Investment Strategy  GuruFocus,Micron (MU) and Synopsys (SNPS) Stand Out in AI Investment Strategy - GuruFocus. Micron (MU) and Synopsys (SNPS) Stand Out in AI Investment Strategy  GuruFocus,AI,-0.999997,negative,2025-05-04 15:55:36
MU,Micron,Micron Stock Has Given Up AI Rally Gains. Why SK Hynix Could Help Change That. - Barron's,Micron Stock Has Given Up AI Rally Gains. Why SK Hynix Could Help Change That.  Barron's,Micron Stock Has Given Up AI Rally Gains. Why SK Hynix Could Help Change That. - Barron's. Micron Stock Has Given Up AI Rally Gains. Why SK Hynix Could Help Change That.  Barron's,AI,0.9999002,neutral,2025-04-24 13:04:00
MU,Micron,This Incredibly Cheap Artificial Intelligence (AI) Stock Is a Terrific Bargain Right Now - The Motley Fool,This Incredibly Cheap Artificial Intelligence (AI) Stock Is a Terrific Bargain Right Now  The Motley Fool,This Incredibly Cheap Artificial Intelligence (AI) Stock Is a Terrific Bargain Right Now - The Motley Fool. This Incredibly Cheap Artificial Intelligence (AI) Stock Is a Terrific Bargain Right Now  The Motley Fool,AI,0.9999989,neutral,2025-04-18 07:00:00
MU,Micron,"Micron Technology, Inc. (MU) Restructures Around AI With New Cloud Memory Division - Yahoo Finance","Micron Technology, Inc. (MU) Restructures Around AI With New Cloud Memory Division  Yahoo Finance","Micron Technology, Inc. (MU) Restructures Around AI With New Cloud Memory Division - Yahoo Finance. Micron Technology, Inc. (MU) Restructures Around AI With New Cloud Memory Division  Yahoo Finance",AI,-0.99980384,negative,2025-04-18 07:00:00
MU,Micron,"AMD, Micron, Broadcom Stocks Hit by AI Rules and Tariff Uncertainty - Barron's","AMD, Micron, Broadcom Stocks Hit by AI Rules and Tariff Uncertainty  Barron's","AMD, Micron, Broadcom Stocks Hit by AI Rules and Tariff Uncertainty - Barron's. AMD, Micron, Broadcom Stocks Hit by AI Rules and Tariff Uncertainty  Barron's",AI,0.831709,positive,2025-04-17 11:10:50
MU,Micron,"Micron Technology, Inc. Announces Market Segment-Based Reorganization to Enhance AI-Driven Growth Opportunities - Nasdaq","Micron Technology, Inc. Announces Market Segment-Based Reorganization to Enhance AI-Driven Growth Opportunities  Nasdaq","Micron Technology, Inc. Announces Market Segment-Based Reorganization to Enhance AI-Driven Growth Opportunities - Nasdaq. Micron Technology, Inc. Announces Market Segment-Based Reorganization to Enhance AI-Driven Growth Opportunities  Nasdaq",AI,0.9999969,neutral,2025-04-17 07:00:00
MU,Micron,Micron rejigs business units to highlight AI data center demand - Reuters,Micron rejigs business units to highlight AI data center demand  Reuters,Micron rejigs business units to highlight AI data center demand - Reuters. Micron rejigs business units to highlight AI data center demand  Reuters,AI,-0.9999461,negative,2025-04-17 07:00:00
MU,Micron,Micron Announces Business Unit Reorganization to Capitalize on AI Growth Across All Market Segments - GlobeNewswire,Micron Announces Business Unit Reorganization to Capitalize on AI Growth Across All Market Segments  GlobeNewswire,Micron Announces Business Unit Reorganization to Capitalize on AI Growth Across All Market Segments - GlobeNewswire. Micron Announces Business Unit Reorganization to Capitalize on AI Growth Across All Market Segments  GlobeNewswire,AI,0.94070935,neutral,2025-04-17 07:00:00
MU,Micron,"Micron's Bold AI Strategy: Tech Giant Splits Into 4 Powerhouse Units to Dominate Cloud, Mobile, and Auto Markets - Stock Titan","Micron's Bold AI Strategy: Tech Giant Splits Into 4 Powerhouse Units to Dominate Cloud, Mobile, and Auto Markets  Stock Titan","Micron's Bold AI Strategy: Tech Giant Splits Into 4 Powerhouse Units to Dominate Cloud, Mobile, and Auto Markets - Stock Titan. Micron's Bold AI Strategy: Tech Giant Splits Into 4 Powerhouse Units to Dominate Cloud, Mobile, and Auto Markets  Stock Titan",AI,-0.99895763,negative,2025-04-17 07:00:00
MU,Micron,Tariff Hangover Sees Micron Stock (MU) Plotting AI-Driven Comeback - Yahoo Finance,Tariff Hangover Sees Micron Stock (MU) Plotting AI-Driven Comeback  Yahoo Finance,Tariff Hangover Sees Micron Stock (MU) Plotting AI-Driven Comeback - Yahoo Finance. Tariff Hangover Sees Micron Stock (MU) Plotting AI-Driven Comeback  Yahoo Finance,AI,-0.9999658,negative,2025-04-11 07:00:00
MU,Micron,Memory stocks in focus as Google says AI hypercomputer runs on new TPU (MU:NASDAQ) - Seeking Alpha,Memory stocks in focus as Google says AI hypercomputer runs on new TPU (MU:NASDAQ)  Seeking Alpha,Memory stocks in focus as Google says AI hypercomputer runs on new TPU (MU:NASDAQ) - Seeking Alpha. Memory stocks in focus as Google says AI hypercomputer runs on new TPU (MU:NASDAQ)  Seeking Alpha,AI,-0.9999684,negative,2025-04-09 07:00:00
MU,Micron,Micron's SWOT analysis: memory chip giant's stock poised for AI-driven growth - Investing.com,Micron's SWOT analysis: memory chip giant's stock poised for AI-driven growth  Investing.com,Micron's SWOT analysis: memory chip giant's stock poised for AI-driven growth - Investing.com. Micron's SWOT analysis: memory chip giant's stock poised for AI-driven growth  Investing.com,AI,-0.8662271,negative,2025-04-08 07:00:00
MU,Micron,Micron Technology (NasdaqGS:MU) Sees 27% Weekly Price Drop As AI Memory Solutions Announced - Yahoo Finance,Micron Technology (NasdaqGS:MU) Sees 27% Weekly Price Drop As AI Memory Solutions Announced  Yahoo Finance,Micron Technology (NasdaqGS:MU) Sees 27% Weekly Price Drop As AI Memory Solutions Announced - Yahoo Finance. Micron Technology (NasdaqGS:MU) Sees 27% Weekly Price Drop As AI Memory Solutions Announced  Yahoo Finance,AI,-0.9787174,negative,2025-04-06 07:00:00
MU,Micron,Micron Technology (NasdaqGS:MU) Teams Up With NVIDIA For AI Memory Solutions - Yahoo Finance,Micron Technology (NasdaqGS:MU) Teams Up With NVIDIA For AI Memory Solutions  Yahoo Finance,Micron Technology (NasdaqGS:MU) Teams Up With NVIDIA For AI Memory Solutions - Yahoo Finance. Micron Technology (NasdaqGS:MU) Teams Up With NVIDIA For AI Memory Solutions  Yahoo Finance,AI,-0.9999974,negative,2025-04-01 07:00:00
MU,Micron,1 No-Brainer Artificial Intelligence (AI) Stock to Buy Before It Skyrockets - The Motley Fool,1 No-Brainer Artificial Intelligence (AI) Stock to Buy Before It Skyrockets  The Motley Fool,1 No-Brainer Artificial Intelligence (AI) Stock to Buy Before It Skyrockets - The Motley Fool. 1 No-Brainer Artificial Intelligence (AI) Stock to Buy Before It Skyrockets  The Motley Fool,AI,-0.9980636,negative,2025-03-28 07:00:00
MU,Micron,Micron Technology (NasdaqGS:MU) Ships HBM3E For AI Servers In Partnership With NVIDIA - Yahoo Finance,Micron Technology (NasdaqGS:MU) Ships HBM3E For AI Servers In Partnership With NVIDIA  Yahoo Finance,Micron Technology (NasdaqGS:MU) Ships HBM3E For AI Servers In Partnership With NVIDIA - Yahoo Finance. Micron Technology (NasdaqGS:MU) Ships HBM3E For AI Servers In Partnership With NVIDIA  Yahoo Finance,AI,-0.9999924,negative,2025-03-28 07:00:00
MU,Micron,Micron: AI Demand Is Just The Beginning (NASDAQ:MU) - Seeking Alpha,Micron: AI Demand Is Just The Beginning (NASDAQ:MU)  Seeking Alpha,Micron: AI Demand Is Just The Beginning (NASDAQ:MU) - Seeking Alpha. Micron: AI Demand Is Just The Beginning (NASDAQ:MU)  Seeking Alpha,AI,-0.9999906,negative,2025-03-28 07:00:00
MU,Micron,Looking for a Bargain? 1 Artificial Intelligence (AI) Chip Stock to Buy the Dip Hand Over Fist. (Hint: It's Not Nvidia.) - Yahoo Finance,Looking for a Bargain? 1 Artificial Intelligence (AI) Chip Stock to Buy the Dip Hand Over Fist. (Hint: It's Not Nvidia.)  Yahoo Finance,Looking for a Bargain? 1 Artificial Intelligence (AI) Chip Stock to Buy the Dip Hand Over Fist. (Hint: It's Not Nvidia.) - Yahoo Finance. Looking for a Bargain? 1 Artificial Intelligence (AI) Chip Stock to Buy the Dip Hand Over Fist. (Hint: It's Not Nvidia.)  Yahoo Finance,AI,-0.99929833,negative,2025-03-26 07:00:00
MU,Micron,Is Micron Technology Inc. (MU) the Best Semiconductor Stock to Buy According to Billionaires? - Yahoo Finance,Is Micron Technology Inc. (MU) the Best Semiconductor Stock to Buy According to Billionaires?  Yahoo Finance,Is Micron Technology Inc. (MU) the Best Semiconductor Stock to Buy According to Billionaires? - Yahoo Finance. Is Micron Technology Inc. (MU) the Best Semiconductor Stock to Buy According to Billionaires?  Yahoo Finance,AI,-0.9665499,negative,2025-03-26 07:00:00
MU,Micron,1 Super Semiconductor Stock (Besides Nvidia or AMD) to Buy Hand Over Fist for the Artificial Intelligence (AI) Revolution - The Motley Fool,1 Super Semiconductor Stock (Besides Nvidia or AMD) to Buy Hand Over Fist for the Artificial Intelligence (AI) Revolution  The Motley Fool,1 Super Semiconductor Stock (Besides Nvidia or AMD) to Buy Hand Over Fist for the Artificial Intelligence (AI) Revolution - The Motley Fool. 1 Super Semiconductor Stock (Besides Nvidia or AMD) to Buy Hand Over Fist for the Artificial Intelligence (AI) Revolution  The Motley Fool,AI,-0.9582728,negative,2025-03-25 07:00:00
MU,Micron,Micron Shares Dip After Margin Concerns Despite AI Revenue Push - Finimize,Micron Shares Dip After Margin Concerns Despite AI Revenue Push  Finimize,Micron Shares Dip After Margin Concerns Despite AI Revenue Push - Finimize. Micron Shares Dip After Margin Concerns Despite AI Revenue Push  Finimize,AI,0.9999547,positive,2025-03-21 14:52:52
MU,Micron,Micron Gives Upbeat Sales Forecast After AI Helps Fuel Demand - Bloomberg.com,Micron Gives Upbeat Sales Forecast After AI Helps Fuel Demand  Bloomberg.com,Micron Gives Upbeat Sales Forecast After AI Helps Fuel Demand - Bloomberg.com. Micron Gives Upbeat Sales Forecast After AI Helps Fuel Demand  Bloomberg.com,AI,1.0,neutral,2025-03-21 07:00:00
MU,Micron,Micron Stock Falls After Earnings. The Detail That Overshadowed Strong Results. - Barron's,Micron Stock Falls After Earnings. The Detail That Overshadowed Strong Results.  Barron's,Micron Stock Falls After Earnings. The Detail That Overshadowed Strong Results. - Barron's. Micron Stock Falls After Earnings. The Detail That Overshadowed Strong Results.  Barron's,AI,0.98432195,positive,2025-03-21 07:00:00
MU,Micron,Micron's $1B AI Chip Surge Has Wall Street Racing to Raise Targets - Yahoo Finance,Micron's $1B AI Chip Surge Has Wall Street Racing to Raise Targets  Yahoo Finance,Micron's $1B AI Chip Surge Has Wall Street Racing to Raise Targets - Yahoo Finance. Micron's $1B AI Chip Surge Has Wall Street Racing to Raise Targets  Yahoo Finance,AI,0.9999883,neutral,2025-03-21 07:00:00
MU,Micron,Chipmaker Micron's shares slump as tepid margin forecast eclipses AI prospects - Reuters,Chipmaker Micron's shares slump as tepid margin forecast eclipses AI prospects  Reuters,Chipmaker Micron's shares slump as tepid margin forecast eclipses AI prospects - Reuters. Chipmaker Micron's shares slump as tepid margin forecast eclipses AI prospects  Reuters,AI,0.99999523,positive,2025-03-21 07:00:00
MU,Micron,Micron: A Dirt-Cheap AI Growth Play (NASDAQ:MU) - Seeking Alpha,Micron: A Dirt-Cheap AI Growth Play (NASDAQ:MU)  Seeking Alpha,Micron: A Dirt-Cheap AI Growth Play (NASDAQ:MU) - Seeking Alpha. Micron: A Dirt-Cheap AI Growth Play (NASDAQ:MU)  Seeking Alpha,AI,-0.97593135,negative,2025-03-21 07:00:00
MU,Micron,Micron revenue surges on AI demand as NAND weighs on gross margin: analysts (MU:NASDAQ) - Seeking Alpha,Micron revenue surges on AI demand as NAND weighs on gross margin: analysts (MU:NASDAQ)  Seeking Alpha,Micron revenue surges on AI demand as NAND weighs on gross margin: analysts (MU:NASDAQ) - Seeking Alpha. Micron revenue surges on AI demand as NAND weighs on gross margin: analysts (MU:NASDAQ)  Seeking Alpha,AI,0.9999994,neutral,2025-03-21 07:00:00
MU,Micron,Micron Q2: AI Agents Accelerating Growth (NASDAQ:MU) - Seeking Alpha,Micron Q2: AI Agents Accelerating Growth (NASDAQ:MU)  Seeking Alpha,Micron Q2: AI Agents Accelerating Growth (NASDAQ:MU) - Seeking Alpha. Micron Q2: AI Agents Accelerating Growth (NASDAQ:MU)  Seeking Alpha,AI,0.9999993,neutral,2025-03-21 07:00:00
MU,Micron,Micron Technology (MU) Poised for AI-Driven Growth with HBM and LPDDR5 Memory - Yahoo Finance,Micron Technology (MU) Poised for AI-Driven Growth with HBM and LPDDR5 Memory  Yahoo Finance,Micron Technology (MU) Poised for AI-Driven Growth with HBM and LPDDR5 Memory - Yahoo Finance. Micron Technology (MU) Poised for AI-Driven Growth with HBM and LPDDR5 Memory  Yahoo Finance,AI,1.0,neutral,2025-03-21 07:00:00
MU,Micron,Micron’s Margin Pressure Overwhelms AI Boost - WSJ,Micron’s Margin Pressure Overwhelms AI Boost  WSJ,Micron’s Margin Pressure Overwhelms AI Boost - WSJ. Micron’s Margin Pressure Overwhelms AI Boost  WSJ,AI,0.9993229,positive,2025-03-21 07:00:00
MU,Micron,"Micron Stock Pops as AI Demand Drives Better-Than-Expected Earnings, Outlook - Investopedia","Micron Stock Pops as AI Demand Drives Better-Than-Expected Earnings, Outlook  Investopedia","Micron Stock Pops as AI Demand Drives Better-Than-Expected Earnings, Outlook - Investopedia. Micron Stock Pops as AI Demand Drives Better-Than-Expected Earnings, Outlook  Investopedia",AI,1.0,neutral,2025-03-20 07:00:00
MU,Micron,Watch These Micron Price Levels as Stock Rises After AI-Driven Earnings Beat - Investopedia,Watch These Micron Price Levels as Stock Rises After AI-Driven Earnings Beat  Investopedia,Watch These Micron Price Levels as Stock Rises After AI-Driven Earnings Beat - Investopedia. Watch These Micron Price Levels as Stock Rises After AI-Driven Earnings Beat  Investopedia,AI,0.9618102,neutral,2025-03-20 07:00:00
MU,Micron,Micron gets boost with surging AI memory-chip sales; shares rise on earnings beat - MarketWatch,Micron gets boost with surging AI memory-chip sales; shares rise on earnings beat  MarketWatch,Micron gets boost with surging AI memory-chip sales; shares rise on earnings beat - MarketWatch. Micron gets boost with surging AI memory-chip sales; shares rise on earnings beat  MarketWatch,AI,1.0,neutral,2025-03-20 07:00:00
MU,Micron,Micron Stock Rises on Solid Earnings. The AI Case May Be Paying Off. - Barron's,Micron Stock Rises on Solid Earnings. The AI Case May Be Paying Off.  Barron's,Micron Stock Rises on Solid Earnings. The AI Case May Be Paying Off. - Barron's. Micron Stock Rises on Solid Earnings. The AI Case May Be Paying Off.  Barron's,AI,1.0,neutral,2025-03-20 07:00:00
MU,Micron,Micron’s stock falls despite solid jump in revenue from AI memory chips - SiliconANGLE,Micron’s stock falls despite solid jump in revenue from AI memory chips  SiliconANGLE,Micron’s stock falls despite solid jump in revenue from AI memory chips - SiliconANGLE. Micron’s stock falls despite solid jump in revenue from AI memory chips  SiliconANGLE,AI,0.9999858,positive,2025-03-20 07:00:00
MU,Micron,Rising AI Investments to Boost Micron Technology's Q2 Earnings - Nasdaq,Rising AI Investments to Boost Micron Technology's Q2 Earnings  Nasdaq,Rising AI Investments to Boost Micron Technology's Q2 Earnings - Nasdaq. Rising AI Investments to Boost Micron Technology's Q2 Earnings  Nasdaq,AI,0.9999999,neutral,2025-03-19 07:00:00
MU,Micron,Micron Technology (NasdaqGS:MU) Unveils World's Fastest AI Memory Solutions In Partnership With NVIDIA - Yahoo Finance,Micron Technology (NasdaqGS:MU) Unveils World's Fastest AI Memory Solutions In Partnership With NVIDIA  Yahoo Finance,Micron Technology (NasdaqGS:MU) Unveils World's Fastest AI Memory Solutions In Partnership With NVIDIA - Yahoo Finance. Micron Technology (NasdaqGS:MU) Unveils World's Fastest AI Memory Solutions In Partnership With NVIDIA  Yahoo Finance,AI,-0.99912184,negative,2025-03-19 07:00:00
MU,Micron,"Micron Technology, Inc. (MU) Ships Industry-First 1γ DRAM to Power AI and Data Centers - Yahoo Finance","Micron Technology, Inc. (MU) Ships Industry-First 1γ DRAM to Power AI and Data Centers  Yahoo Finance","Micron Technology, Inc. (MU) Ships Industry-First 1γ DRAM to Power AI and Data Centers - Yahoo Finance. Micron Technology, Inc. (MU) Ships Industry-First 1γ DRAM to Power AI and Data Centers  Yahoo Finance",AI,-0.9999101,negative,2025-02-27 08:00:00
MU,Micron,"Micron Technology, Inc. (MU) Positioned for AI-Driven Growth with Advanced Memory Solutions - Yahoo Finance","Micron Technology, Inc. (MU) Positioned for AI-Driven Growth with Advanced Memory Solutions  Yahoo Finance","Micron Technology, Inc. (MU) Positioned for AI-Driven Growth with Advanced Memory Solutions - Yahoo Finance. Micron Technology, Inc. (MU) Positioned for AI-Driven Growth with Advanced Memory Solutions  Yahoo Finance",AI,0.99999976,neutral,2025-02-26 08:00:00
MU,Micron,"Micron Technology, Inc. (MU) Rides AI-Driven HBM Demand with 2026 EPS Estimates Up 25% - Yahoo Finance","Micron Technology, Inc. (MU) Rides AI-Driven HBM Demand with 2026 EPS Estimates Up 25%  Yahoo Finance","Micron Technology, Inc. (MU) Rides AI-Driven HBM Demand with 2026 EPS Estimates Up 25% - Yahoo Finance. Micron Technology, Inc. (MU) Rides AI-Driven HBM Demand with 2026 EPS Estimates Up 25%  Yahoo Finance",AI,0.9999076,neutral,2025-02-22 08:00:00
MU,Micron,Analyst Bullish on Micron (MU) Amid ‘Critical’ AI Components It Sells - Yahoo Finance,Analyst Bullish on Micron (MU) Amid ‘Critical’ AI Components It Sells  Yahoo Finance,Analyst Bullish on Micron (MU) Amid ‘Critical’ AI Components It Sells - Yahoo Finance. Analyst Bullish on Micron (MU) Amid ‘Critical’ AI Components It Sells  Yahoo Finance,AI,0.99999857,neutral,2025-02-19 08:00:00
MU,Micron,Micron Technology: Growth Potential In The AI Era (NASDAQ:MU) - Seeking Alpha,Micron Technology: Growth Potential In The AI Era (NASDAQ:MU)  Seeking Alpha,Micron Technology: Growth Potential In The AI Era (NASDAQ:MU) - Seeking Alpha. Micron Technology: Growth Potential In The AI Era (NASDAQ:MU)  Seeking Alpha,AI,0.9998827,neutral,2025-02-19 08:00:00
MU,Micron,Why Micron Technology (MU) Is One of the Best Performing AI Stocks in 2025 - Yahoo Finance,Why Micron Technology (MU) Is One of the Best Performing AI Stocks in 2025  Yahoo Finance,Why Micron Technology (MU) Is One of the Best Performing AI Stocks in 2025 - Yahoo Finance. Why Micron Technology (MU) Is One of the Best Performing AI Stocks in 2025  Yahoo Finance,AI,0.9999913,neutral,2025-02-18 08:00:00
MU,Micron,"Micron Redefines Performance for AI PCs, Gamers and Professionals - Micron","Micron Redefines Performance for AI PCs, Gamers and Professionals  Micron","Micron Redefines Performance for AI PCs, Gamers and Professionals - Micron. Micron Redefines Performance for AI PCs, Gamers and Professionals  Micron",AI,-0.9982469,negative,2025-02-18 08:00:00
MU,Micron,"Micron Technology, Inc. (MU): Among the Semiconductor Stocks Making Impressive Comeback from DeepSeek AI Dip - Yahoo Finance","Micron Technology, Inc. (MU): Among the Semiconductor Stocks Making Impressive Comeback from DeepSeek AI Dip  Yahoo Finance","Micron Technology, Inc. (MU): Among the Semiconductor Stocks Making Impressive Comeback from DeepSeek AI Dip - Yahoo Finance. Micron Technology, Inc. (MU): Among the Semiconductor Stocks Making Impressive Comeback from DeepSeek AI Dip  Yahoo Finance",AI,0.9999304,neutral,2025-02-17 08:00:00
MU,Micron,Nvidia and Micron: Analyst Selects the Top AI Stocks to Buy Amid AI Upheaval - Yahoo Finance,Nvidia and Micron: Analyst Selects the Top AI Stocks to Buy Amid AI Upheaval  Yahoo Finance,Nvidia and Micron: Analyst Selects the Top AI Stocks to Buy Amid AI Upheaval - Yahoo Finance. Nvidia and Micron: Analyst Selects the Top AI Stocks to Buy Amid AI Upheaval  Yahoo Finance,AI,-0.9158718,negative,2025-02-14 08:00:00
MU,Micron,Micron: Undervalued At 6x 2026 Profits Amid Massive AI Tailwind - Seeking Alpha,Micron: Undervalued At 6x 2026 Profits Amid Massive AI Tailwind  Seeking Alpha,Micron: Undervalued At 6x 2026 Profits Amid Massive AI Tailwind - Seeking Alpha. Micron: Undervalued At 6x 2026 Profits Amid Massive AI Tailwind  Seeking Alpha,AI,0.9999999,neutral,2025-02-09 08:00:00
MU,Micron,"Micron Technology (MU): “Setting Up for Failure, Unfortunately,” Warns Jim Cramer - Yahoo Finance","Micron Technology (MU): “Setting Up for Failure, Unfortunately,” Warns Jim Cramer  Yahoo Finance","Micron Technology (MU): “Setting Up for Failure, Unfortunately,” Warns Jim Cramer - Yahoo Finance. Micron Technology (MU): “Setting Up for Failure, Unfortunately,” Warns Jim Cramer  Yahoo Finance",AI,0.7595438,positive,2025-02-01 08:00:00
MU,Micron,Micron Technology (MU): Investing in AI-Driven Memory Expansion - Yahoo Finance,Micron Technology (MU): Investing in AI-Driven Memory Expansion  Yahoo Finance,Micron Technology (MU): Investing in AI-Driven Memory Expansion - Yahoo Finance. Micron Technology (MU): Investing in AI-Driven Memory Expansion  Yahoo Finance,AI,-0.9999944,negative,2025-01-31 08:00:00
MU,Micron,Micron Technology: A Smart Bet on AI Memory for Future Gains - Yahoo Finance,Micron Technology: A Smart Bet on AI Memory for Future Gains  Yahoo Finance,Micron Technology: A Smart Bet on AI Memory for Future Gains - Yahoo Finance. Micron Technology: A Smart Bet on AI Memory for Future Gains  Yahoo Finance,AI,0.999894,neutral,2025-01-30 08:00:00
MU,Micron,Morgan Stanley Lowers Micron Technology (MU) Price Target to $91 Amid AI-Driven Market Shifts - Yahoo Finance,Morgan Stanley Lowers Micron Technology (MU) Price Target to $91 Amid AI-Driven Market Shifts  Yahoo Finance,Morgan Stanley Lowers Micron Technology (MU) Price Target to $91 Amid AI-Driven Market Shifts - Yahoo Finance. Morgan Stanley Lowers Micron Technology (MU) Price Target to $91 Amid AI-Driven Market Shifts  Yahoo Finance,AI,0.9986511,positive,2025-01-30 08:00:00
MU,Micron,Micron Technology’s (MU) AI Potential: What’s in Store for 2025? - Yahoo Finance,Micron Technology’s (MU) AI Potential: What’s in Store for 2025?  Yahoo Finance,Micron Technology’s (MU) AI Potential: What’s in Store for 2025? - Yahoo Finance. Micron Technology’s (MU) AI Potential: What’s in Store for 2025?  Yahoo Finance,AI,-0.99997985,negative,2025-01-28 08:00:00
MU,Micron,Micron Technology (MU): AI Demand Drives Growth Amid Challenges in NAND and Consumer Markets - Yahoo Finance,Micron Technology (MU): AI Demand Drives Growth Amid Challenges in NAND and Consumer Markets  Yahoo Finance,Micron Technology (MU): AI Demand Drives Growth Amid Challenges in NAND and Consumer Markets - Yahoo Finance. Micron Technology (MU): AI Demand Drives Growth Amid Challenges in NAND and Consumer Markets  Yahoo Finance,AI,0.7429625,neutral,2025-01-27 08:00:00
MU,Micron,"This Artificial Intelligence (AI) Stock Has Jumped 30% Already in 2025. It Could Jump Another 32%, According to Wall Street. - The Motley Fool","This Artificial Intelligence (AI) Stock Has Jumped 30% Already in 2025. It Could Jump Another 32%, According to Wall Street.  The Motley Fool","This Artificial Intelligence (AI) Stock Has Jumped 30% Already in 2025. It Could Jump Another 32%, According to Wall Street. - The Motley Fool. This Artificial Intelligence (AI) Stock Has Jumped 30% Already in 2025. It Could Jump Another 32%, According to Wall Street.  The Motley Fool",AI,0.99995935,neutral,2025-01-25 08:00:00
MU,Micron,Is Micron Technology (MU) the Most Promising AI Stock According to Wall Street Analysts? - Yahoo Finance,Is Micron Technology (MU) the Most Promising AI Stock According to Wall Street Analysts?  Yahoo Finance,Is Micron Technology (MU) the Most Promising AI Stock According to Wall Street Analysts? - Yahoo Finance. Is Micron Technology (MU) the Most Promising AI Stock According to Wall Street Analysts?  Yahoo Finance,AI,0.80307543,neutral,2025-01-24 08:00:00
MU,Micron,"If I Could Buy Only 1 AI Stock, This Would Be It - The Motley Fool","If I Could Buy Only 1 AI Stock, This Would Be It  The Motley Fool","If I Could Buy Only 1 AI Stock, This Would Be It - The Motley Fool. If I Could Buy Only 1 AI Stock, This Would Be It  The Motley Fool",AI,-0.9997813,negative,2025-01-23 08:00:00
MU,Micron,Micron Technology (MU): Riding the Wave of AI-Driven Demand with Cutting-Edge Memory and Storage Solutions - Yahoo Finance,Micron Technology (MU): Riding the Wave of AI-Driven Demand with Cutting-Edge Memory and Storage Solutions  Yahoo Finance,Micron Technology (MU): Riding the Wave of AI-Driven Demand with Cutting-Edge Memory and Storage Solutions - Yahoo Finance. Micron Technology (MU): Riding the Wave of AI-Driven Demand with Cutting-Edge Memory and Storage Solutions  Yahoo Finance,AI,-0.96306264,negative,2025-01-18 08:00:00
MU,Micron,"Artificial Intelligence (AI) Stocks Micron Technology, BigBear.ai, and C3.ai Pop After Positive Inflation Report - The Motley Fool","Artificial Intelligence (AI) Stocks Micron Technology, BigBear.ai, and C3.ai Pop After Positive Inflation Report  The Motley Fool","Artificial Intelligence (AI) Stocks Micron Technology, BigBear.ai, and C3.ai Pop After Positive Inflation Report - The Motley Fool. Artificial Intelligence (AI) Stocks Micron Technology, BigBear.ai, and C3.ai Pop After Positive Inflation Report  The Motley Fool",AI,-0.99797946,negative,2025-01-15 08:00:00
MU,Micron,Micron (MU) Stock: High-Growth Opportunities in the AI Revolution - TipRanks,Micron (MU) Stock: High-Growth Opportunities in the AI Revolution  TipRanks,Micron (MU) Stock: High-Growth Opportunities in the AI Revolution - TipRanks. Micron (MU) Stock: High-Growth Opportunities in the AI Revolution  TipRanks,AI,1.0,neutral,2025-01-14 08:00:00
MU,Micron,Micron and 7 Other Tech Stocks for Another AI-Driven Year - Barron's,Micron and 7 Other Tech Stocks for Another AI-Driven Year  Barron's,Micron and 7 Other Tech Stocks for Another AI-Driven Year - Barron's. Micron and 7 Other Tech Stocks for Another AI-Driven Year  Barron's,AI,-0.9995565,negative,2025-01-09 08:00:00
