ticker,company_name,title,summary,text,search_term,sentiment_score,sentiment_label,published
MU,Micron,Micron Stock Is Up 18% This Year. Wall Street Sees an AI Winner. - Barron's,Micron Stock Is Up 18% This Year. Wall Street Sees an AI Winner.  Barron's,Micron Stock Is Up 18% This Year. Wall Street Sees an AI Winner. - Barron's. Micron Stock Is Up 18% This Year. Wall Street Sees an AI Winner.  Barron's,AI,0.9999999,neutral,2025-01-09 08:00:00
MU,Micron,Nvidia or Micron: Morgan Stanley Picks the Superior AI Stock to Buy - TipRanks,Nvidia or Micron: Morgan Stanley Picks the Superior AI Stock to Buy  TipRanks,Nvidia or Micron: Morgan Stanley Picks the Superior AI Stock to Buy - TipRanks. Nvidia or Micron: Morgan Stanley Picks the Superior AI Stock to Buy  TipRanks,AI,0.99988294,neutral,2025-01-09 08:00:00
MU,Micron,Watch These Micron Price Levels After Stock Leads AI-Fueled Chip Rally - Investopedia,Watch These Micron Price Levels After Stock Leads AI-Fueled Chip Rally  Investopedia,Watch These Micron Price Levels After Stock Leads AI-Fueled Chip Rally - Investopedia. Watch These Micron Price Levels After Stock Leads AI-Fueled Chip Rally  Investopedia,AI,-0.9842508,negative,2025-01-06 08:00:00
MU,Micron,Micron's Bold Bet On AI Memory - Seeking Alpha,Micron's Bold Bet On AI Memory  Seeking Alpha,Micron's Bold Bet On AI Memory - Seeking Alpha. Micron's Bold Bet On AI Memory  Seeking Alpha,AI,0.93627894,neutral,2025-01-04 08:00:00
MU,Micron,1 Top Artificial Intelligence Stock Down 35% to Buy Before It Crushes the Market in 2025 - The Motley Fool,1 Top Artificial Intelligence Stock Down 35% to Buy Before It Crushes the Market in 2025  The Motley Fool,1 Top Artificial Intelligence Stock Down 35% to Buy Before It Crushes the Market in 2025 - The Motley Fool. 1 Top Artificial Intelligence Stock Down 35% to Buy Before It Crushes the Market in 2025  The Motley Fool,AI,0.99948597,positive,2024-12-27 08:00:00
MU,Micron,"2 AI Stocks to Buy at Huge Discounts in 2025: MU, AMD - Nasdaq","2 AI Stocks to Buy at Huge Discounts in 2025: MU, AMD  Nasdaq","2 AI Stocks to Buy at Huge Discounts in 2025: MU, AMD - Nasdaq. 2 AI Stocks to Buy at Huge Discounts in 2025: MU, AMD  Nasdaq",AI,-0.99345714,negative,2024-12-23 08:00:00
MU,Micron,"Micron boosted by AI-driven sales surge, but shares dip after forecast disappoints - Blocks and Files","Micron boosted by AI-driven sales surge, but shares dip after forecast disappoints  Blocks and Files","Micron boosted by AI-driven sales surge, but shares dip after forecast disappoints - Blocks and Files. Micron boosted by AI-driven sales surge, but shares dip after forecast disappoints  Blocks and Files",AI,0.9999999,neutral,2024-12-19 08:00:00
MU,Micron,Strong AI Data-Center Business Not Enough To Help Micron - Investor's Business Daily,Strong AI Data-Center Business Not Enough To Help Micron  Investor's Business Daily,Strong AI Data-Center Business Not Enough To Help Micron - Investor's Business Daily. Strong AI Data-Center Business Not Enough To Help Micron  Investor's Business Daily,AI,1.0,neutral,2024-12-19 08:00:00
MU,Micron,Micron Stock Dives As Chipmaker Whiffs On Guidance - Investor's Business Daily,Micron Stock Dives As Chipmaker Whiffs On Guidance  Investor's Business Daily,Micron Stock Dives As Chipmaker Whiffs On Guidance - Investor's Business Daily. Micron Stock Dives As Chipmaker Whiffs On Guidance  Investor's Business Daily,AI,-0.99994934,negative,2024-12-18 08:00:00
MU,Micron,Micron’s stock skids as AI momentum doesn’t make up for pressures elsewhere - MarketWatch,Micron’s stock skids as AI momentum doesn’t make up for pressures elsewhere  MarketWatch,Micron’s stock skids as AI momentum doesn’t make up for pressures elsewhere - MarketWatch. Micron’s stock skids as AI momentum doesn’t make up for pressures elsewhere  MarketWatch,AI,0.8983743,positive,2024-12-18 08:00:00
MU,Micron,Prediction: This Artificial Intelligence (AI) Semiconductor Stock Is Set to Soar After Dec. 18 - The Motley Fool,Prediction: This Artificial Intelligence (AI) Semiconductor Stock Is Set to Soar After Dec. 18  The Motley Fool,Prediction: This Artificial Intelligence (AI) Semiconductor Stock Is Set to Soar After Dec. 18 - The Motley Fool. Prediction: This Artificial Intelligence (AI) Semiconductor Stock Is Set to Soar After Dec. 18  The Motley Fool,AI,-0.9999341,negative,2024-12-17 08:00:00
