ticker,company_name,title,summary,text,search_term,sentiment_score,sentiment_label,published
NIO,NIO,"‘Shanghai bump’: Nio, Zeekr, Li Auto, and Pony AI stocks jump on news from Auto Shanghai - Investorsobserver","‘Shanghai bump’: Nio, Zeekr, Li Auto, and Pony AI stocks jump on news from Auto Shanghai  Investorsobserver","‘Shanghai bump’: Nio, Zeekr, Li Auto, and Pony AI stocks jump on news from Auto Shanghai - Investorsobserver. ‘Shanghai bump’: Nio, Zeekr, Li Auto, and Pony AI stocks jump on news from Auto Shanghai  Investorsobserver",AI,-0.999995,negative,2025-04-29 07:50:11
NIO,NIO,"NIO Stock Catches Some Air After Tough Month, but Caution Remains - Own Snap","NIO Stock Catches Some Air After Tough Month, but Caution Remains  Own Snap","NIO Stock Catches Some Air After Tough Month, but Caution Remains - Own Snap. NIO Stock Catches Some Air After Tough Month, but Caution Remains  Own Snap",AI,0.92816913,positive,2025-04-28 15:24:14
NIO,NIO,How Intuit is Revolutionizing Its Business and Products with AI - The Globe and Mail,How Intuit is Revolutionizing Its Business and Products with AI  The Globe and Mail,How Intuit is Revolutionizing Its Business and Products with AI - The Globe and Mail. How Intuit is Revolutionizing Its Business and Products with AI  The Globe and Mail,AI,0.70041853,neutral,2025-04-23 07:00:00
NIO,NIO,Artificial intelligence stocks under $10 - Investorsobserver,Artificial intelligence stocks under $10  Investorsobserver,Artificial intelligence stocks under $10 - Investorsobserver. Artificial intelligence stocks under $10  Investorsobserver,AI,-0.99997795,negative,2025-03-12 07:00:00
NIO,NIO,"Nio forms team to research AI robot dog project, report says - CnEVPost","Nio forms team to research AI robot dog project, report says  CnEVPost","Nio forms team to research AI robot dog project, report says - CnEVPost. Nio forms team to research AI robot dog project, report says  CnEVPost",AI,-0.999992,negative,2025-01-21 08:00:00
NIO,NIO,"2 Artificial Intelligence (AI) Electric Vehicle Stocks to Buy With $500. If Certain Wall Street Analysts Are Right, They Could Soar as Much as 60% and 119%. - The Motley Fool","2 Artificial Intelligence (AI) Electric Vehicle Stocks to Buy With $500. If Certain Wall Street Analysts Are Right, They Could Soar as Much as 60% and 119%.  The Motley Fool","2 Artificial Intelligence (AI) Electric Vehicle Stocks to Buy With $500. If Certain Wall Street Analysts Are Right, They Could Soar as Much as 60% and 119%. - The Motley Fool. 2 Artificial Intelligence (AI) Electric Vehicle Stocks to Buy With $500. If Certain Wall Street Analysts Are Right, They Could Soar as Much as 60% and 119%.  The Motley Fool",AI,-0.90847045,negative,2025-01-17 08:00:00
NIO,NIO,"Alibaba, Baidu, JD, NIO, Li Auto Stocks Slide As Potential AI Chip Sanctions Add Pressure On China - Benzinga","Alibaba, Baidu, JD, NIO, Li Auto Stocks Slide As Potential AI Chip Sanctions Add Pressure On China  Benzinga","Alibaba, Baidu, JD, NIO, Li Auto Stocks Slide As Potential AI Chip Sanctions Add Pressure On China - Benzinga. Alibaba, Baidu, JD, NIO, Li Auto Stocks Slide As Potential AI Chip Sanctions Add Pressure On China  Benzinga",AI,0.8079429,positive,2025-01-10 08:00:00
NIO,NIO,Nio and Monolith Join Forces for AI-Powered EV Battery Testing - AskTraders.com,Nio and Monolith Join Forces for AI-Powered EV Battery Testing  AskTraders.com,Nio and Monolith Join Forces for AI-Powered EV Battery Testing - AskTraders.com. Nio and Monolith Join Forces for AI-Powered EV Battery Testing  AskTraders.com,AI,-0.9982029,negative,2024-10-01 07:00:00
NIO,NIO,Tesla's China Rivals Set Delivery Records; Archrival BYD Tops 1 Million EV Milestone - Investor's Business Daily,Tesla's China Rivals Set Delivery Records; Archrival BYD Tops 1 Million EV Milestone  Investor's Business Daily,Tesla's China Rivals Set Delivery Records; Archrival BYD Tops 1 Million EV Milestone - Investor's Business Daily. Tesla's China Rivals Set Delivery Records; Archrival BYD Tops 1 Million EV Milestone  Investor's Business Daily,AI,-0.998917,negative,2024-10-01 07:00:00
NIO,NIO,AI Stocks Under $10 To Buy - 24/7 Wall St.,AI Stocks Under $10 To Buy  24/7 Wall St.,AI Stocks Under $10 To Buy - 24/7 Wall St.. AI Stocks Under $10 To Buy  24/7 Wall St.,AI,0.5398189,neutral,2024-09-17 07:00:00
NIO,NIO,"C3.ai, Tesla, U.S. Steel, Nvidia, NIO, Frontier, HPE, ChargePoint, and More Movers - Barron's","C3.ai, Tesla, U.S. Steel, Nvidia, NIO, Frontier, HPE, ChargePoint, and More Movers  Barron's","C3.ai, Tesla, U.S. Steel, Nvidia, NIO, Frontier, HPE, ChargePoint, and More Movers - Barron's. C3.ai, Tesla, U.S. Steel, Nvidia, NIO, Frontier, HPE, ChargePoint, and More Movers  Barron's",AI,-0.99995136,negative,2024-09-05 07:00:00
NIO,NIO,AI predicts NIO stock price for the end of 2024 - Finbold,AI predicts NIO stock price for the end of 2024  Finbold,AI predicts NIO stock price for the end of 2024 - Finbold. AI predicts NIO stock price for the end of 2024  Finbold,AI,-0.99999845,negative,2024-07-24 07:00:00
NIO,NIO,Nio to hold Nio IN 2024 tech day event on Jul 27 in Shanghai - CnEVPost,Nio to hold Nio IN 2024 tech day event on Jul 27 in Shanghai  CnEVPost,Nio to hold Nio IN 2024 tech day event on Jul 27 in Shanghai - CnEVPost. Nio to hold Nio IN 2024 tech day event on Jul 27 in Shanghai  CnEVPost,AI,-0.99999356,negative,2024-07-21 07:00:00
NIO,NIO,"Forget Nvidia: These 2 Artificial Intelligence (AI) Stocks Are Expected to More Than Double Investor's Money, According to Select Wall Street Analysts - The Motley Fool","Forget Nvidia: These 2 Artificial Intelligence (AI) Stocks Are Expected to More Than Double Investor's Money, According to Select Wall Street Analysts  The Motley Fool","Forget Nvidia: These 2 Artificial Intelligence (AI) Stocks Are Expected to More Than Double Investor's Money, According to Select Wall Street Analysts - The Motley Fool. Forget Nvidia: These 2 Artificial Intelligence (AI) Stocks Are Expected to More Than Double Investor's Money, According to Select Wall Street Analysts  The Motley Fool",AI,-0.99460703,negative,2024-07-11 07:00:00
NIO,NIO,Who is head of Onvo? Nio president explains - CnEVPost,Who is head of Onvo? Nio president explains  CnEVPost,Who is head of Onvo? Nio president explains - CnEVPost. Who is head of Onvo? Nio president explains  CnEVPost,AI,-0.99999297,negative,2024-05-14 07:00:00
NIO,NIO,Nio rolls out AI-powered voice assistant NOMI GPT - CnEVPost,Nio rolls out AI-powered voice assistant NOMI GPT  CnEVPost,Nio rolls out AI-powered voice assistant NOMI GPT - CnEVPost. Nio rolls out AI-powered voice assistant NOMI GPT  CnEVPost,AI,-0.99999714,negative,2024-04-12 07:00:00
NIO,NIO,ChatGPT Stock Predictions: 3 Electric Vehicle Companies the AI Bot Thinks Have 10X Potential - InvestorPlace,ChatGPT Stock Predictions: 3 Electric Vehicle Companies the AI Bot Thinks Have 10X Potential  InvestorPlace,ChatGPT Stock Predictions: 3 Electric Vehicle Companies the AI Bot Thinks Have 10X Potential - InvestorPlace. ChatGPT Stock Predictions: 3 Electric Vehicle Companies the AI Bot Thinks Have 10X Potential  InvestorPlace,AI,-0.9999976,negative,2024-02-20 08:00:00
NIO,NIO,3 Stocks That AI Predicts Will Be 10-Baggers in 10 Years - InvestorPlace,3 Stocks That AI Predicts Will Be 10-Baggers in 10 Years  InvestorPlace,3 Stocks That AI Predicts Will Be 10-Baggers in 10 Years - InvestorPlace. 3 Stocks That AI Predicts Will Be 10-Baggers in 10 Years  InvestorPlace,AI,-0.9999995,negative,2024-01-15 08:00:00
NIO,NIO,AI predicts NIO stock price for end of 2024 - Finbold,AI predicts NIO stock price for end of 2024  Finbold,AI predicts NIO stock price for end of 2024 - Finbold. AI predicts NIO stock price for end of 2024  Finbold,AI,-0.9999994,negative,2024-01-12 08:00:00
NIO,NIO,7 Mid-Cap Stocks to Buy to Capture Massive AI Growth - InvestorPlace,7 Mid-Cap Stocks to Buy to Capture Massive AI Growth  InvestorPlace,7 Mid-Cap Stocks to Buy to Capture Massive AI Growth - InvestorPlace. 7 Mid-Cap Stocks to Buy to Capture Massive AI Growth  InvestorPlace,AI,0.941783,neutral,2023-12-04 08:00:00
NIO,NIO,Artificial Intelligence Stocks Under $10 - 24/7 Wall St.,Artificial Intelligence Stocks Under $10  24/7 Wall St.,Artificial Intelligence Stocks Under $10 - 24/7 Wall St.. Artificial Intelligence Stocks Under $10  24/7 Wall St.,AI,-0.9999933,negative,2023-11-29 08:00:00
NIO,NIO,8 Best AI Stocks Under $10 - AOL.com,8 Best AI Stocks Under $10  AOL.com,8 Best AI Stocks Under $10 - AOL.com. 8 Best AI Stocks Under $10  AOL.com,AI,-0.9969796,negative,2023-11-21 08:00:00
NIO,NIO,8 Best Artificial Intelligence Stocks Under $10 - Nasdaq,8 Best Artificial Intelligence Stocks Under $10  Nasdaq,8 Best Artificial Intelligence Stocks Under $10 - Nasdaq. 8 Best Artificial Intelligence Stocks Under $10  Nasdaq,AI,-0.99653816,negative,2023-08-18 07:00:00
NIO,NIO,"Tesla rival Nio plans Singapore research hub for AI, self-driving - Nikkei Asia","Tesla rival Nio plans Singapore research hub for AI, self-driving  Nikkei Asia","Tesla rival Nio plans Singapore research hub for AI, self-driving - Nikkei Asia. Tesla rival Nio plans Singapore research hub for AI, self-driving  Nikkei Asia",AI,-0.99999654,negative,2022-05-21 07:00:00
NIO,NIO,Chinese Tesla rival Nio files to raise $1.8 billion in US IPO - TechCrunch,Chinese Tesla rival Nio files to raise $1.8 billion in US IPO  TechCrunch,Chinese Tesla rival Nio files to raise $1.8 billion in US IPO - TechCrunch. Chinese Tesla rival Nio files to raise $1.8 billion in US IPO  TechCrunch,AI,-0.9987587,negative,2018-08-14 07:00:00
