ticker,company_name,title,summary,text,search_term,sentiment_score,sentiment_label,published
NVDA,NVIDIA,"Nvidia stock set for rebound as Meta, Amazon, and Google go all-in on AI - Fingerlakes1.com","Nvidia stock set for rebound as Meta, Amazon, and Google go all-in on AI  Fingerlakes1.com","Nvidia stock set for rebound as Meta, Amazon, and Google go all-in on AI - Fingerlakes1.com. Nvidia stock set for rebound as Meta, Amazon, and Google go all-in on AI  Fingerlakes1.com",AI,0.99999595,neutral,2025-05-05 00:37:18
NVDA,NVIDIA,NVIDIA Corp. (NVDA): Among Billionaire Chase Coleman’s Stocks with Huge Upside Potential - Yahoo Finance,NVIDIA Corp. (NVDA): Among Billionaire Chase Coleman’s Stocks with Huge Upside Potential  Yahoo Finance,NVIDIA Corp. (NVDA): Among Billionaire Chase Coleman’s Stocks with Huge Upside Potential - Yahoo Finance. NVIDIA Corp. (NVDA): Among Billionaire Chase Coleman’s Stocks with Huge Upside Potential  Yahoo Finance,AI,0.9999994,neutral,2025-05-04 21:22:34
NVDA,NVIDIA,Prediction: This Will Be the Top-Performing Semiconductor Stock Over the Next 10 Years (Hint: It's Not Nvidia) - The Globe and Mail,Prediction: This Will Be the Top-Performing Semiconductor Stock Over the Next 10 Years (Hint: It's Not Nvidia)  The Globe and Mail,Prediction: This Will Be the Top-Performing Semiconductor Stock Over the Next 10 Years (Hint: It's Not Nvidia) - The Globe and Mail. Prediction: This Will Be the Top-Performing Semiconductor Stock Over the Next 10 Years (Hint: It's Not Nvidia)  The Globe and Mail,AI,0.99999726,neutral,2025-05-04 19:31:52
NVDA,NVIDIA,"PLTR, SOUN, or NVDA: Which AI Stock Scores Wall Street’s “Strong Buy” Rating? - MSN","PLTR, SOUN, or NVDA: Which AI Stock Scores Wall Street’s “Strong Buy” Rating?  MSN","PLTR, SOUN, or NVDA: Which AI Stock Scores Wall Street’s “Strong Buy” Rating? - MSN. PLTR, SOUN, or NVDA: Which AI Stock Scores Wall Street’s “Strong Buy” Rating?  MSN",AI,0.9999999,neutral,2025-05-04 19:27:53
NVDA,NVIDIA,Is Now the Time to Buy Beaten-Down AI Stocks? - The Motley Fool,Is Now the Time to Buy Beaten-Down AI Stocks?  The Motley Fool,Is Now the Time to Buy Beaten-Down AI Stocks? - The Motley Fool. Is Now the Time to Buy Beaten-Down AI Stocks?  The Motley Fool,AI,-0.99959844,negative,2025-05-04 19:15:00
NVDA,NVIDIA,"AI Stocks Face 'Show Me' Moment. Microsoft Cloud Growth Shines, Amazon Lags. - Investor's Business Daily","AI Stocks Face 'Show Me' Moment. Microsoft Cloud Growth Shines, Amazon Lags.  Investor's Business Daily","AI Stocks Face 'Show Me' Moment. Microsoft Cloud Growth Shines, Amazon Lags. - Investor's Business Daily. AI Stocks Face 'Show Me' Moment. Microsoft Cloud Growth Shines, Amazon Lags.  Investor's Business Daily",AI,0.91551995,neutral,2025-05-04 18:20:00
NVDA,NVIDIA,"5 big analyst AI moves: Apple downgraded, Nvidia gets a Sell rating, TSMC top pick - Investing.com","5 big analyst AI moves: Apple downgraded, Nvidia gets a Sell rating, TSMC top pick  Investing.com","5 big analyst AI moves: Apple downgraded, Nvidia gets a Sell rating, TSMC top pick - Investing.com. 5 big analyst AI moves: Apple downgraded, Nvidia gets a Sell rating, TSMC top pick  Investing.com",AI,0.99876934,positive,2025-05-04 10:00:13
NVDA,NVIDIA,"PLTR, SOUN, or NVDA: Which AI Stock Scores Wall Street’s “Strong Buy” Rating? - TipRanks","PLTR, SOUN, or NVDA: Which AI Stock Scores Wall Street’s “Strong Buy” Rating?  TipRanks","PLTR, SOUN, or NVDA: Which AI Stock Scores Wall Street’s “Strong Buy” Rating? - TipRanks. PLTR, SOUN, or NVDA: Which AI Stock Scores Wall Street’s “Strong Buy” Rating?  TipRanks",AI,0.9999987,neutral,2025-05-04 06:08:05
NVDA,NVIDIA,NVIDIA Stock Faces Uncertainty Despite AI Hype and Earnings Beat - TECHi,NVIDIA Stock Faces Uncertainty Despite AI Hype and Earnings Beat  TECHi,NVIDIA Stock Faces Uncertainty Despite AI Hype and Earnings Beat - TECHi. NVIDIA Stock Faces Uncertainty Despite AI Hype and Earnings Beat  TECHi,AI,0.999992,positive,2025-05-03 17:24:59
NVDA,NVIDIA,Better Artificial Intelligence (AI) Stock: Nvidia vs. Super Micro Computer Inc. - MSN,Better Artificial Intelligence (AI) Stock: Nvidia vs. Super Micro Computer Inc.  MSN,Better Artificial Intelligence (AI) Stock: Nvidia vs. Super Micro Computer Inc. - MSN. Better Artificial Intelligence (AI) Stock: Nvidia vs. Super Micro Computer Inc.  MSN,AI,0.9999325,neutral,2025-05-03 14:30:05
NVDA,NVIDIA,Better Artificial Intelligence (AI) Stock: Nvidia vs. Super Micro Computer Inc. - The Motley Fool,Better Artificial Intelligence (AI) Stock: Nvidia vs. Super Micro Computer Inc.  The Motley Fool,Better Artificial Intelligence (AI) Stock: Nvidia vs. Super Micro Computer Inc. - The Motley Fool. Better Artificial Intelligence (AI) Stock: Nvidia vs. Super Micro Computer Inc.  The Motley Fool,AI,0.9999889,neutral,2025-05-03 14:05:00
NVDA,NVIDIA,"‘Don’t Miss the Next Leg Higher,’ Says Investor About Nvidia Stock - The Globe and Mail","‘Don’t Miss the Next Leg Higher,’ Says Investor About Nvidia Stock  The Globe and Mail","‘Don’t Miss the Next Leg Higher,’ Says Investor About Nvidia Stock - The Globe and Mail. ‘Don’t Miss the Next Leg Higher,’ Says Investor About Nvidia Stock  The Globe and Mail",AI,-0.999974,negative,2025-05-03 00:22:23
NVDA,NVIDIA,Better Artificial Intelligence (AI) Stock: Nvidia vs. Intel - The Motley Fool,Better Artificial Intelligence (AI) Stock: Nvidia vs. Intel  The Motley Fool,Better Artificial Intelligence (AI) Stock: Nvidia vs. Intel - The Motley Fool. Better Artificial Intelligence (AI) Stock: Nvidia vs. Intel  The Motley Fool,AI,0.9999895,neutral,2025-05-02 21:15:00
NVDA,NVIDIA,Should You Hold NVIDIA Stock as Meta & Microsoft Double Down on AI? - Yahoo Finance,Should You Hold NVIDIA Stock as Meta & Microsoft Double Down on AI?  Yahoo Finance,Should You Hold NVIDIA Stock as Meta & Microsoft Double Down on AI? - Yahoo Finance. Should You Hold NVIDIA Stock as Meta & Microsoft Double Down on AI?  Yahoo Finance,AI,-0.99989533,negative,2025-05-02 19:00:00
NVDA,NVIDIA,Nvidia stock surging on strategic AI chip revamp and Amazon Cloud boost - Fingerlakes1.com,Nvidia stock surging on strategic AI chip revamp and Amazon Cloud boost  Fingerlakes1.com,Nvidia stock surging on strategic AI chip revamp and Amazon Cloud boost - Fingerlakes1.com. Nvidia stock surging on strategic AI chip revamp and Amazon Cloud boost  Fingerlakes1.com,AI,-0.67684233,negative,2025-05-02 16:38:12
NVDA,NVIDIA,"Nvidia (NVDA) Advances, AMD Eyes Gains: Ruben Roy Sets the Stage Ahead of Earnings - TipRanks","Nvidia (NVDA) Advances, AMD Eyes Gains: Ruben Roy Sets the Stage Ahead of Earnings  TipRanks","Nvidia (NVDA) Advances, AMD Eyes Gains: Ruben Roy Sets the Stage Ahead of Earnings - TipRanks. Nvidia (NVDA) Advances, AMD Eyes Gains: Ruben Roy Sets the Stage Ahead of Earnings  TipRanks",AI,0.9999311,neutral,2025-05-02 15:43:47
NVDA,NVIDIA,Nvidia Jumps Past Key Level As Amazon Reports AI Spend Boost; Is Nvidia A Buy Now? - Investor's Business Daily,Nvidia Jumps Past Key Level As Amazon Reports AI Spend Boost; Is Nvidia A Buy Now?  Investor's Business Daily,Nvidia Jumps Past Key Level As Amazon Reports AI Spend Boost; Is Nvidia A Buy Now? - Investor's Business Daily. Nvidia Jumps Past Key Level As Amazon Reports AI Spend Boost; Is Nvidia A Buy Now?  Investor's Business Daily,AI,0.9999994,neutral,2025-05-02 14:59:00
NVDA,NVIDIA,Nvidia Stock Rises. It Just Got This Amazon AI Boost. - Barron's,Nvidia Stock Rises. It Just Got This Amazon AI Boost.  Barron's,Nvidia Stock Rises. It Just Got This Amazon AI Boost. - Barron's. Nvidia Stock Rises. It Just Got This Amazon AI Boost.  Barron's,AI,0.99999976,neutral,2025-05-02 13:55:00
NVDA,NVIDIA,Should You Forget Nvidia and Buy 2 Artificial Intelligence (AI) Stocks Right Now? - The Motley Fool,Should You Forget Nvidia and Buy 2 Artificial Intelligence (AI) Stocks Right Now?  The Motley Fool,Should You Forget Nvidia and Buy 2 Artificial Intelligence (AI) Stocks Right Now? - The Motley Fool. Should You Forget Nvidia and Buy 2 Artificial Intelligence (AI) Stocks Right Now?  The Motley Fool,AI,-0.99986553,negative,2025-05-02 11:00:00
NVDA,NVIDIA,Should You Forget Nvidia and Buy 2 Artificial Intelligence (AI) Stocks Right Now? - Yahoo Finance,Should You Forget Nvidia and Buy 2 Artificial Intelligence (AI) Stocks Right Now?  Yahoo Finance,Should You Forget Nvidia and Buy 2 Artificial Intelligence (AI) Stocks Right Now? - Yahoo Finance. Should You Forget Nvidia and Buy 2 Artificial Intelligence (AI) Stocks Right Now?  Yahoo Finance,AI,-0.99975556,negative,2025-05-02 11:00:00
NVDA,NVIDIA,Is Nvidia Stock (NVDA) Just Getting Started? Amazon’s AI Spending Ignites Fresh Chip Rally - TipRanks,Is Nvidia Stock (NVDA) Just Getting Started? Amazon’s AI Spending Ignites Fresh Chip Rally  TipRanks,Is Nvidia Stock (NVDA) Just Getting Started? Amazon’s AI Spending Ignites Fresh Chip Rally - TipRanks. Is Nvidia Stock (NVDA) Just Getting Started? Amazon’s AI Spending Ignites Fresh Chip Rally  TipRanks,AI,-0.6180717,negative,2025-05-02 10:55:54
NVDA,NVIDIA,Pay Close Attention to This Crucial Revenue Source for Artificial Intelligence (AI) Giant Nvidia - The Motley Fool,Pay Close Attention to This Crucial Revenue Source for Artificial Intelligence (AI) Giant Nvidia  The Motley Fool,Pay Close Attention to This Crucial Revenue Source for Artificial Intelligence (AI) Giant Nvidia - The Motley Fool. Pay Close Attention to This Crucial Revenue Source for Artificial Intelligence (AI) Giant Nvidia  The Motley Fool,AI,-0.99997675,negative,2025-05-02 08:00:00
NVDA,NVIDIA,"Nvidia CEO Jensen Huang Sounds Alarm As 50% Of AI Researchers Are Chinese, Urges America To Reskill Amid 'Infinite Game' - Yahoo Finance","Nvidia CEO Jensen Huang Sounds Alarm As 50% Of AI Researchers Are Chinese, Urges America To Reskill Amid 'Infinite Game'  Yahoo Finance","Nvidia CEO Jensen Huang Sounds Alarm As 50% Of AI Researchers Are Chinese, Urges America To Reskill Amid 'Infinite Game' - Yahoo Finance. Nvidia CEO Jensen Huang Sounds Alarm As 50% Of AI Researchers Are Chinese, Urges America To Reskill Amid 'Infinite Game'  Yahoo Finance",AI,0.99832565,positive,2025-05-02 03:59:00
NVDA,NVIDIA,Analyst behind Nvidia's only Sell rating names top AI stock pick - Yahoo Finance,Analyst behind Nvidia's only Sell rating names top AI stock pick  Yahoo Finance,Analyst behind Nvidia's only Sell rating names top AI stock pick - Yahoo Finance. Analyst behind Nvidia's only Sell rating names top AI stock pick  Yahoo Finance,AI,-0.8403064,negative,2025-05-01 20:57:03
NVDA,NVIDIA,"Nvidia stock rises to lead chip gains after Meta, Microsoft back AI investment plans - Yahoo Finance","Nvidia stock rises to lead chip gains after Meta, Microsoft back AI investment plans  Yahoo Finance","Nvidia stock rises to lead chip gains after Meta, Microsoft back AI investment plans - Yahoo Finance. Nvidia stock rises to lead chip gains after Meta, Microsoft back AI investment plans  Yahoo Finance",AI,0.99999905,neutral,2025-05-01 20:15:17
NVDA,NVIDIA,"What AI Slowdown? Nvidia Rallies As Meta, Microsoft Boost Data Center Spending. - Investor's Business Daily","What AI Slowdown? Nvidia Rallies As Meta, Microsoft Boost Data Center Spending.  Investor's Business Daily","What AI Slowdown? Nvidia Rallies As Meta, Microsoft Boost Data Center Spending. - Investor's Business Daily. What AI Slowdown? Nvidia Rallies As Meta, Microsoft Boost Data Center Spending.  Investor's Business Daily",AI,-0.77938986,negative,2025-05-01 20:07:00
NVDA,NVIDIA,Nvidia and other chip stocks are riding AI optimism. Will Amazon’s earnings change that? - MarketWatch,Nvidia and other chip stocks are riding AI optimism. Will Amazon’s earnings change that?  MarketWatch,Nvidia and other chip stocks are riding AI optimism. Will Amazon’s earnings change that? - MarketWatch. Nvidia and other chip stocks are riding AI optimism. Will Amazon’s earnings change that?  MarketWatch,AI,0.4639015,positive,2025-05-01 18:28:00
NVDA,NVIDIA,Nvidia raised concerns about Huawei's growing AI capabilities with US lawmakers - Reuters,Nvidia raised concerns about Huawei's growing AI capabilities with US lawmakers  Reuters,Nvidia raised concerns about Huawei's growing AI capabilities with US lawmakers - Reuters. Nvidia raised concerns about Huawei's growing AI capabilities with US lawmakers  Reuters,AI,0.9999969,positive,2025-05-01 18:06:25
NVDA,NVIDIA,Nvidia Is Jumping Today -- Is the Artificial Intelligence (AI) Stock a Buy? - The Motley Fool,Nvidia Is Jumping Today -- Is the Artificial Intelligence (AI) Stock a Buy?  The Motley Fool,Nvidia Is Jumping Today -- Is the Artificial Intelligence (AI) Stock a Buy? - The Motley Fool. Nvidia Is Jumping Today -- Is the Artificial Intelligence (AI) Stock a Buy?  The Motley Fool,AI,0.9999937,neutral,2025-05-01 17:27:00
NVDA,NVIDIA,Nvidia Is Jumping Today -- Is the Artificial Intelligence (AI) Stock a Buy? - Nasdaq,Nvidia Is Jumping Today -- Is the Artificial Intelligence (AI) Stock a Buy?  Nasdaq,Nvidia Is Jumping Today -- Is the Artificial Intelligence (AI) Stock a Buy? - Nasdaq. Nvidia Is Jumping Today -- Is the Artificial Intelligence (AI) Stock a Buy?  Nasdaq,AI,0.9999852,neutral,2025-05-01 17:27:00
NVDA,NVIDIA,Nvidia CEO sends Washington 10-word message on AI chip change - TheStreet,Nvidia CEO sends Washington 10-word message on AI chip change  TheStreet,Nvidia CEO sends Washington 10-word message on AI chip change - TheStreet. Nvidia CEO sends Washington 10-word message on AI chip change  TheStreet,AI,-0.9999771,negative,2025-05-01 16:37:00
NVDA,NVIDIA,"Nvidia Stock Rises. The AI Trade Is So Back After Meta, Microsoft Earnings. - Barron's","Nvidia Stock Rises. The AI Trade Is So Back After Meta, Microsoft Earnings.  Barron's","Nvidia Stock Rises. The AI Trade Is So Back After Meta, Microsoft Earnings. - Barron's. Nvidia Stock Rises. The AI Trade Is So Back After Meta, Microsoft Earnings.  Barron's",AI,0.7748294,neutral,2025-05-01 16:11:00
NVDA,NVIDIA,"Artificial Intelligence IPO CoreWeave Pops On Microsoft, Meta Earnings - Investor's Business Daily","Artificial Intelligence IPO CoreWeave Pops On Microsoft, Meta Earnings  Investor's Business Daily","Artificial Intelligence IPO CoreWeave Pops On Microsoft, Meta Earnings - Investor's Business Daily. Artificial Intelligence IPO CoreWeave Pops On Microsoft, Meta Earnings  Investor's Business Daily",AI,-0.99994385,negative,2025-05-01 16:05:00
NVDA,NVIDIA,Crypto and AI Are Converging — And Nvidia Stock (NVDA) Could Be the Biggest Winner - TipRanks,Crypto and AI Are Converging — And Nvidia Stock (NVDA) Could Be the Biggest Winner  TipRanks,Crypto and AI Are Converging — And Nvidia Stock (NVDA) Could Be the Biggest Winner - TipRanks. Crypto and AI Are Converging — And Nvidia Stock (NVDA) Could Be the Biggest Winner  TipRanks,AI,0.9999672,neutral,2025-05-01 15:09:45
NVDA,NVIDIA,1 Artificial Intelligence (AI) Stock That Could Go Parabolic - The Motley Fool,1 Artificial Intelligence (AI) Stock That Could Go Parabolic  The Motley Fool,1 Artificial Intelligence (AI) Stock That Could Go Parabolic - The Motley Fool. 1 Artificial Intelligence (AI) Stock That Could Go Parabolic  The Motley Fool,AI,-0.9999143,negative,2025-05-01 15:00:00
NVDA,NVIDIA,"Nvidia Stock Jumps as Microsoft, Meta Commit to Continued Heavy AI Spending - Investopedia","Nvidia Stock Jumps as Microsoft, Meta Commit to Continued Heavy AI Spending  Investopedia","Nvidia Stock Jumps as Microsoft, Meta Commit to Continued Heavy AI Spending - Investopedia. Nvidia Stock Jumps as Microsoft, Meta Commit to Continued Heavy AI Spending  Investopedia",AI,0.9999821,neutral,2025-05-01 12:39:20
NVDA,NVIDIA,Can Nvidia Stock (NVDA) Keep Soaring on Microsoft and Meta’s AI Boom? - TipRanks,Can Nvidia Stock (NVDA) Keep Soaring on Microsoft and Meta’s AI Boom?  TipRanks,Can Nvidia Stock (NVDA) Keep Soaring on Microsoft and Meta’s AI Boom? - TipRanks. Can Nvidia Stock (NVDA) Keep Soaring on Microsoft and Meta’s AI Boom?  TipRanks,AI,-0.99390477,negative,2025-05-01 10:21:51
NVDA,NVIDIA,"Trump, NVIDIA CEO unveil $500 billion AI investment to build chips in America - Fox Business","Trump, NVIDIA CEO unveil $500 billion AI investment to build chips in America  Fox Business","Trump, NVIDIA CEO unveil $500 billion AI investment to build chips in America - Fox Business. Trump, NVIDIA CEO unveil $500 billion AI investment to build chips in America  Fox Business",AI,-0.9998888,negative,2025-05-01 01:08:33
