ticker,company_name,title,summary,text,search_term,sentiment_score,sentiment_label,published
STT,State Street,"Carlyle, State Street Mull Partnership to Tap Retail Wealth - Bloomberg.com","Carlyle, State Street Mull Partnership to Tap Retail Wealth  Bloomberg.com","Carlyle, State Street Mull Partnership to Tap Retail Wealth - Bloomberg.com. Carlyle, State Street Mull Partnership to Tap Retail Wealth  Bloomberg.com",AI,-0.9999988,negative,2025-04-30 22:53:23
STT,State Street,"State Street stock target cut to $113 at KBW, retains Outperform - Investing.com India","State Street stock target cut to $113 at KBW, retains Outperform  Investing.com India","State Street stock target cut to $113 at KBW, retains Outperform - Investing.com India. State Street stock target cut to $113 at KBW, retains Outperform  Investing.com India",AI,0.99750036,neutral,2025-04-21 07:00:00
STT,State Street,"UK Pension Replaces State Street With Invesco, Amundi for $35B Mandate - ai-cio.com","UK Pension Replaces State Street With Invesco, Amundi for $35B Mandate  ai-cio.com","UK Pension Replaces State Street With Invesco, Amundi for $35B Mandate - ai-cio.com. UK Pension Replaces State Street With Invesco, Amundi for $35B Mandate  ai-cio.com",AI,-0.9999584,negative,2025-02-27 08:00:00
STT,State Street,"Prediction: This Artificial Intelligence (AI) Stock -- a 1,020% Gainer Since Its IPO -- Won't Split Its Stock in 2025. Here's Why - The Motley Fool","Prediction: This Artificial Intelligence (AI) Stock -- a 1,020% Gainer Since Its IPO -- Won't Split Its Stock in 2025. Here's Why  The Motley Fool","Prediction: This Artificial Intelligence (AI) Stock -- a 1,020% Gainer Since Its IPO -- Won't Split Its Stock in 2025. Here's Why - The Motley Fool. Prediction: This Artificial Intelligence (AI) Stock -- a 1,020% Gainer Since Its IPO -- Won't Split Its Stock in 2025. Here's Why  The Motley Fool",AI,-0.9996625,negative,2025-02-27 08:00:00
STT,State Street,(STT) Trading Report - news.stocktradersdaily.com,(STT) Trading Report  news.stocktradersdaily.com,(STT) Trading Report - news.stocktradersdaily.com. (STT) Trading Report  news.stocktradersdaily.com,AI,-0.9999993,negative,2025-02-14 08:00:00
STT,State Street,Saudi Arabia’s SWF Seeds State Street Bond ETF With $200M - ai-cio.com,Saudi Arabia’s SWF Seeds State Street Bond ETF With $200M  ai-cio.com,Saudi Arabia’s SWF Seeds State Street Bond ETF With $200M - ai-cio.com. Saudi Arabia’s SWF Seeds State Street Bond ETF With $200M  ai-cio.com,AI,-0.99997854,negative,2025-02-04 08:00:00
STT,State Street,ETF Wrap: AI-powered ETFs the new focus in active - ETF Stream,ETF Wrap: AI-powered ETFs the new focus in active  ETF Stream,ETF Wrap: AI-powered ETFs the new focus in active - ETF Stream. ETF Wrap: AI-powered ETFs the new focus in active  ETF Stream,AI,-0.98226446,negative,2025-01-31 08:00:00
STT,State Street,"Futures Mixed With Tesla, Meta, IBM Earnings Winners - Investor's Business Daily","Futures Mixed With Tesla, Meta, IBM Earnings Winners  Investor's Business Daily","Futures Mixed With Tesla, Meta, IBM Earnings Winners - Investor's Business Daily. Futures Mixed With Tesla, Meta, IBM Earnings Winners  Investor's Business Daily",AI,-0.75396,negative,2025-01-30 08:00:00
STT,State Street,"Stocks Take Fed In Stride, Await Earnings Wave; Cava, State Street, GE Aerospace In Focus - Investor's Business Daily","Stocks Take Fed In Stride, Await Earnings Wave; Cava, State Street, GE Aerospace In Focus  Investor's Business Daily","Stocks Take Fed In Stride, Await Earnings Wave; Cava, State Street, GE Aerospace In Focus - Investor's Business Daily. Stocks Take Fed In Stride, Await Earnings Wave; Cava, State Street, GE Aerospace In Focus  Investor's Business Daily",AI,-0.9995951,negative,2025-01-29 08:00:00
STT,State Street,"U.S. equity ‘exceptionalism’ to continue, State Street asset management CEO says - The Globe and Mail","U.S. equity ‘exceptionalism’ to continue, State Street asset management CEO says  The Globe and Mail","U.S. equity ‘exceptionalism’ to continue, State Street asset management CEO says - The Globe and Mail. U.S. equity ‘exceptionalism’ to continue, State Street asset management CEO says  The Globe and Mail",AI,-0.9972059,negative,2025-01-08 08:00:00
STT,State Street,"State Street Corp Boosts Stake in Airship AI Holdings, Inc. (NASDAQ:AISP) - Defense World","State Street Corp Boosts Stake in Airship AI Holdings, Inc. (NASDAQ:AISP)  Defense World","State Street Corp Boosts Stake in Airship AI Holdings, Inc. (NASDAQ:AISP) - Defense World. State Street Corp Boosts Stake in Airship AI Holdings, Inc. (NASDAQ:AISP)  Defense World",AI,0.99891627,neutral,2025-01-04 08:00:00
STT,State Street,Bridgewater opens strategy to retail investors through State Street ETF - Financial Times,Bridgewater opens strategy to retail investors through State Street ETF  Financial Times,Bridgewater opens strategy to retail investors through State Street ETF - Financial Times. Bridgewater opens strategy to retail investors through State Street ETF  Financial Times,AI,-0.99999964,negative,2024-11-19 08:00:00
STT,State Street,STT Fairview 1 set to open in Q2 2025 – positioned to support growing AI demands - Intelligent CIO,STT Fairview 1 set to open in Q2 2025 – positioned to support growing AI demands  Intelligent CIO,STT Fairview 1 set to open in Q2 2025 – positioned to support growing AI demands - Intelligent CIO. STT Fairview 1 set to open in Q2 2025 – positioned to support growing AI demands  Intelligent CIO,AI,0.9494123,neutral,2024-10-31 07:00:00
STT,State Street,"Immigration Critics Overlook the Good It Does, per State Street - ai-cio.com","Immigration Critics Overlook the Good It Does, per State Street  ai-cio.com","Immigration Critics Overlook the Good It Does, per State Street - ai-cio.com. Immigration Critics Overlook the Good It Does, per State Street  ai-cio.com",AI,-0.8430361,negative,2024-09-09 07:00:00
STT,State Street,Big names exit Nvidia stock as AI giant stumbles before earnings - Yahoo Finance,Big names exit Nvidia stock as AI giant stumbles before earnings  Yahoo Finance,Big names exit Nvidia stock as AI giant stumbles before earnings - Yahoo Finance. Big names exit Nvidia stock as AI giant stumbles before earnings  Yahoo Finance,AI,0.578421,positive,2024-08-15 07:00:00
STT,State Street,"Singapore's Sustainable Metal Cloud outlines global expansion plans, aims to raise $950m - Data Center Dynamics","Singapore's Sustainable Metal Cloud outlines global expansion plans, aims to raise $950m  Data Center Dynamics","Singapore's Sustainable Metal Cloud outlines global expansion plans, aims to raise $950m - Data Center Dynamics. Singapore's Sustainable Metal Cloud outlines global expansion plans, aims to raise $950m  Data Center Dynamics",AI,0.54518485,neutral,2024-07-29 07:00:00
STT,State Street,Goldman’s top stock analyst is waiting for AI bubble to burst - The Straits Times,Goldman’s top stock analyst is waiting for AI bubble to burst  The Straits Times,Goldman’s top stock analyst is waiting for AI bubble to burst - The Straits Times. Goldman’s top stock analyst is waiting for AI bubble to burst  The Straits Times,AI,-0.99654895,negative,2024-07-19 07:00:00
STT,State Street,Singtel-KKR consortium to invest $1.75 billion in data centre provider ST Telemedia GDC - The Straits Times,Singtel-KKR consortium to invest $1.75 billion in data centre provider ST Telemedia GDC  The Straits Times,Singtel-KKR consortium to invest $1.75 billion in data centre provider ST Telemedia GDC - The Straits Times. Singtel-KKR consortium to invest $1.75 billion in data centre provider ST Telemedia GDC  The Straits Times,AI,-0.9999801,negative,2024-06-18 07:00:00
STT,State Street,State Street Accelerates Investment Insights by Building AI-Enhanced Alpha Data Platform on Snowflake - Snowflake,State Street Accelerates Investment Insights by Building AI-Enhanced Alpha Data Platform on Snowflake  Snowflake,State Street Accelerates Investment Insights by Building AI-Enhanced Alpha Data Platform on Snowflake - Snowflake. State Street Accelerates Investment Insights by Building AI-Enhanced Alpha Data Platform on Snowflake  Snowflake,AI,0.99973017,neutral,2024-05-24 02:17:39
STT,State Street,"Ron O'Hanley, CEO of State Street: AI, overvalued? - marketscreener.com","Ron O'Hanley, CEO of State Street: AI, overvalued?  marketscreener.com","Ron O'Hanley, CEO of State Street: AI, overvalued? - marketscreener.com. Ron O'Hanley, CEO of State Street: AI, overvalued?  marketscreener.com",AI,-0.9999845,negative,2024-05-06 07:00:00
STT,State Street,Resolution round-up: AI resolution withdrawn at United Health Group - Responsible Investor,Resolution round-up: AI resolution withdrawn at United Health Group  Responsible Investor,Resolution round-up: AI resolution withdrawn at United Health Group - Responsible Investor. Resolution round-up: AI resolution withdrawn at United Health Group  Responsible Investor,AI,-0.9999826,negative,2024-03-27 07:00:00
STT,State Street,"3 Stock Sectors, All Tech, Expected to Soar in 2024 | Chief Investment Officer - ai-cio.com","3 Stock Sectors, All Tech, Expected to Soar in 2024 | Chief Investment Officer  ai-cio.com","3 Stock Sectors, All Tech, Expected to Soar in 2024 | Chief Investment Officer - ai-cio.com. 3 Stock Sectors, All Tech, Expected to Soar in 2024 | Chief Investment Officer  ai-cio.com",AI,-0.9999975,negative,2024-02-15 08:00:00
STT,State Street,How Generative AI Could Revolutionize State Street - Forbes,How Generative AI Could Revolutionize State Street  Forbes,How Generative AI Could Revolutionize State Street - Forbes. How Generative AI Could Revolutionize State Street  Forbes,AI,-0.96788144,negative,2023-06-21 07:00:00
STT,State Street,7 Artificial Intelligence Stocks Institutional Investors Are Buying - Forbes,7 Artificial Intelligence Stocks Institutional Investors Are Buying  Forbes,7 Artificial Intelligence Stocks Institutional Investors Are Buying - Forbes. 7 Artificial Intelligence Stocks Institutional Investors Are Buying  Forbes,AI,-0.99957126,negative,2023-05-19 07:00:00
STT,State Street,So the Federal Reserve Doesn’t Care About the Stock Market? Baloney - ai-cio.com,So the Federal Reserve Doesn’t Care About the Stock Market? Baloney  ai-cio.com,So the Federal Reserve Doesn’t Care About the Stock Market? Baloney - ai-cio.com. So the Federal Reserve Doesn’t Care About the Stock Market? Baloney  ai-cio.com,AI,-0.9999641,negative,2019-08-22 07:00:00
STT,State Street,State Street tests blockchain for securities lending - FinTech Futures,State Street tests blockchain for securities lending  FinTech Futures,State Street tests blockchain for securities lending - FinTech Futures. State Street tests blockchain for securities lending  FinTech Futures,AI,-0.99999404,negative,2016-12-22 08:00:00
